review,rating,sentiment,book_title,book_id
"Servility This is a book that delivers on several levels: it is an entertaining and engrossing novel with drama, humour and sadness, but it also causes us to reflect on deeply moral and racial issues. While racism has existed for a long time and continues to unfold, the story provides a snap-shot into a time that is fascinating and how historically it manifested itself into society in the US. It’s a story of how servants or maids show more integrity and moral compass than their employers. It’s a story of life and communities: how we love and hate, how we laugh and cry, how we interact with family, friends and those we work with/for. The narrative in The Help places the perspective from a white journalist, Miss Skeeter, and two black maids, Aibileen and Minny. Miss Skeeter wants to write a book using the insights both Aibileen and Minny as to what it's like to be a maid and how they are treated. This causes major concerns of trust, if they are to be open and truthful, as Minny says. “I can't believe Aibileen wants to tell Miss Skeeter the truth. Truth. It feels cool, like water washing over my sticky-hot body. Cooling a heat that's been burning me up all my life. Truth, I say inside my head again, just for that feeling.” Each character is very well developed with more than just a superficial front and they show depth to the many aspects of their lives. There are other books that cover slavery, segregation and racism in the US, many are more sensational and brutal in their coverage of black subjugation, however, this book leads us to those issues in a less graphic manner for a more mainstream international audience. The stories and insights in themselves are inspiring and understanding the paradox where someone like Aibileen can be trusted to raise white children but watched suspiciously in case she steals material items, is bizarre. How maids must remain upbeat and pleasant regardless of the way they’re treated or what may be happening within their own families and personal lives. To hold the quality of someone’s life as a weapon is corrupt and repulsive, but to do it on a systemic scale is completely abhorrent. The Help is a very clever book, perhaps meant for more global audiences as it provides an entertaining story whilst delivering these deep ethical issues. I highly recommend this book.",5.0,positive,The Help,4667024
"1.24.2020 update: Whew I originally read this book when I was in high school and wow did I lack racial awareness then. I left my original five-star review below, though now I recognize that there are a lot of problems with a white woman portraying the south in this way. Here's a link to an article that explains this with a good amount of depth, featuring the perspective of Viola Davis: Here's a concise Goodreads review I'd recommend checking out: Original review: Originally, I thought this book should have been retitled The Hype . At least that's what I told my friend. I remember thinking something along the lines of, blah, another story about racism in the old southern days? Must be the chick-lit version of To Kill a Mockingbird . Wow. I was so wrong. The Help details the lives of three women living in Jackson, Mississippi, right when the Civil Rights Movement began. There is Skeeter, a twenty-two-year-old aspiring writer who terribly misses her maid, Constantine. Aibileen is an experienced and knowledgeable black maid who is currently taking care of her seventeenth child, Mae Mobley, even though she realizes what's at stake for both of them. And Minny is a fierce, sassy cook who doesn't take nonsense from anyone, even when it risks her employment. This tumultuous trio takes the first step in sparking a movement that will ignite fire to the racism and hypocrisy of their small town. My synopsis of the story probably isn't even a tenth of the merit it deserves. I don't want to spoil too much about the book, but the most amazing thing about The Help is its characters. They are so real, so lifelike, I could feel their thoughts pulsing through my head and their emotions racing through my veins. I was angry alongside them, cheered for them, and cried with them. I think everyone should read this book, especially people who are ignorant about the racism and hypocrisy that still manages to plight everyday society. The Help wasn't just a darn good read, but something that has made me reevaluate and examine my own morals. I'll never forget it. Want to read more of my reviews? Follow me .",2.0,negative,The Help,4667024
"Back in the day, when I was 14 years old, I really loved this book, I found it witty and charming. However, I didn't read critically then, and I know that, nowadays, I would have lots of criticism in regards to the portrayal of the Black maids and the white characters in this novel. Many people around the world are turning to literature and film to help educate themselves on race and cultural issues, with sales of books on race and racism skyrocketing. But the problem is that The Help isn't an authentic look into the perspective and experiences of the racial injustices Black people face. The Help centers around a young, privileged white woman named Eugenia ""Skeeter"" Phelan, who writes a book about the experiences of two Black maids, Aibileen Clark and Minny Jackson, during the Civil Rights Movement in Jackson, Mississippi during the 1960s. The book is rightfully accused of playing into the white savior narrative, a trope where white characters come to the rescue of minorities in a feel-good tale that dilutes people of color in their own stories by minimizing and simplifying racial issues. What makes The Help worse than your typical white savior film is the implication that the main character is being brave by merely socializing with Black people. The Black female maids are almost idealized in The Help (similar to the ""Magical Negro"" trope), while African American men are far too often called ""no-account"". The mates of the primary maids are portrayed as absentee fathers, while Minny’s husband Leroy is a wife beater and abuser of his children and also a drunk. The way her abuse is handled in the novel is shocking and very ignorant. Meanwhile, the white men who practiced segregation are elevated. The Help is just one of many, many novels that fall into this misguided idea that a white character has to be the protagonist — or at least have a key role in ""healing"" of race-relations — in order for it to have mass appeal. Literature shapes the way we think. Stories told through books are inherently designed to invoke empathy from the reader, and draw you into a story and the experience of a character. If white people keep reading bestsellers like The Help, they will keep absorbing the wrong message: that Black people have no agency and need rescuing, while white people, by being oh-so gracious, will be the ones saving them.",1.0,negative,The Help,4667024
"There are 3 women in this novel: Aibileen is a 57-year-old black maid who lost her only child. She writes beautifully and is a devout believer in God. She's been a maid all her life, raising 17 white children. Right now, she's taking care of a little girl whose mom doesn't love her. Aibileen constantly reassures the child, saying, ”You are a kind, intelligent, and important person. You are a good girl, love yourself."" Skeeter is a 23-year-old white girl raised by a black woman who has now disappeared. Her biggest wish is to find and hug her. Skeeter dreams of becoming a great journalist but is stuck writing a gossip column. She's tall, not conventionally pretty, and loves wearing men's clothing. Skeeter is the unmarried daughter her mom is ashamed of. She once had a chance to marry a senator's son. She loved the handsome man but didn't let love cloud her judgment. Even though she lives in a society that strongly discriminates against black people, she wants to write a book about their true feelings. Minny is about 40, with several kids and an abusive husband. She can't keep her mouth shut and loves to argue with her white employers. She can't tell lies, even though she's diligent, strong, and an incredible cook. She's so eloquent, fierce, capable, and strong-willed that she can't tell others her husband is beating her. She can't afford to lose face. She loves her husband, and to avoid being beaten, she keeps getting pregnant. Over the years, Aibileen has learned to be as tough and smooth as a stone, but the humiliation still gets to her sometimes. Skeeter is young and doesn't know what she will face or the disaster her decision will bring. And Minny will never change herself. She instinctively resists boundaries. She loves, hates, cares, cooks, and enjoys watching others eat her food. Together, they write a book, with Aibileen dictating and Skeeter writing it down. On the surface, the story is simple, with no major external actions, but it's incredibly thrilling. The dangers and injustices of society seep in bit by bit, and every piece of information is terrifying. Dealing with black people is simpler: firing, beating, framing, and throwing them in jail. Dealing with white people is more complicated: isolation, indifference, and exclusion. The story is a quiet revolution, exposing the deep-rooted prejudices of society. The suspense is palpable as the women navigate a dangerous world. In the end, the book becomes more than just a story; it's a call to action. Everyone can only ""write"" 1 book in their lifetime. I'm “writing” mine now. I used to think “my book” would be about aspirations, dreams, and myself, but after reading The Help , I realized a book should be about justice, fairness, courage, breaking down boundaries, true love and freedom, people living honestly as their true selves, and the heroes of every era. We live in an unjust and unfree era. Every moment, we can hear the cries of sorrow around us. Future generations will only see cold news and numbers, a history of unknown shape. But we can write down what we see, everything we experience, and tell them: ""See, this is what this era is truly like. Even if our limitations force us to live reluctantly, in our hearts, life can blossom into a rich and abundant world."" 4.6 / 5 stars",5.0,positive,The Help,4667024
"So, it looks like THE HELP is turning out to be one of those novels that I love despite flaws. Nearly everyone in the world knows what this book is about (as I pen this review, it is at #2 in Amazon sales ranking) but I shall reiterate: it’s the story of three women -- two black, one white -- in 1960s Jackson, Mississippi, and how the two black maids work with the one extremely naive white young woman to write a book of their stories as “the help.” In the spirit of honesty, I should tell you that I didn’t want to read it. It sounded like it was going to hit the Maggie Trifecta of Doom: 1) Fiction that is Good for You 2) “Women’s Fiction”, now with 60% more tears 3) Mint Julep references* *I have not been thrilled by a single novel that mentions a mint julep. I’m not sure if this is coincidence. However, I loved it. Despite the fact that the book is massive -- pick it up next time you go by, it’s a doorstop -- I read it in three evenings. It was engrossing, very well characterized and often funny. Strangely enough, two of those are also part of what I consider its flaws. The characters are so reliably themselves that they are nearly caricatures in some areas. While it meant I could definitely never mistake one woman’s voice for another, it also gave it a bit of a Hollywood/ sitcom feel; they were types instead of people. And the funny -- well, race relations in ‘60s Mississippi is not exactly all fun and mint juleps, as everyone knows. But this book is upbeat, uplifting, and ultimately made a bit fluffy by all its humor and optimism. Again, I could imagine this as a Hollywood screenplay in a New York minute. Still, don’t get me wrong -- it’s wonderfully written and easy to love and very easy to recommend. I also think it would be a killer book club book, because there is a lot to talk about in here, and I don’t just mean the Trifecta of Doom bits. I think that everyone who reads it will at least like it, even if it will not become their absolute favorite in the world. And we need books like that. So go out and read it. ***wondering why all my reviews are five stars? Because I'm only reviewing my favorite books -- not every book I read. Consider a novel's presence on my Goodreads bookshelf as a hearty endorsement. I can't believe I just said ""hearty."" It sounds like a stew.***",5.0,positive,The Help,4667024
"5.0 ⭐ YOU IS KIND, YOU IS SMART, YOU IS IMPORTANT!! GENRE - FICTION / DRAMA - COMEDY. Ironically I got to know about this book after watching the Oscar nominated movie ""THE HELP"" nonetheless that still did not kill the intrest I had in reading this book and most of the times I went back to watch a few scenes from the movie that were mentioned in the book to see how precisely were they enacted. About the Book - The book is about African American maids and their relationships with their White American employers.The storyline majorly revolves around 3 characters.... Eugenia ""Skeeter"" Phelan : - A privileged White American Girl who was brought up by her maid Contestine who was very close to her than her own mother. Skeeter wants to be a journalist and write a book. Aibileen Clark : - Works as a Help for Leefolt family taking care of Mae Mobley the cutest baby i have ever seen in movies and who is hugely devastated by the loss of her son Treelore. Minny Jackson : - Works for Miss Ceelia Foorte Family has a abusive husband she is shit scared of and keeps loosing her jobs for sassing around her employers. The 3 of them get together to write a book about the life and the experience along with 11 other African maids in Jackson, Mississippi,USA. The best fiction read I have come across so far, the book is full of varied emotions there is Comedy, Romance, Action and a hell lot of Drama involved. I would easily have rated this book more than a 5⭐ .The book has more to offer than the movie does and actually it didn't make me much of a difference of watching the movie before reading the book. THIS BOOK IS IN MY ALL TIME BEST BOOK LIST, Higly recommended book to all those people who looking for a fun read. Thanks 😊",5.0,positive,The Help,4667024
"This is a powerful story about women's relationships with each other, and how they are affected by race (and class), told from the viewpoints of three women (two black maids and a young white woman). It is set in segregated Jackson, Mississippi, in 1962-64, at the dawn of the civil rights movement, but it's local and domestic, rather than looking at the big picture. The first third of the book establishes the main characters and their situation and relationships; the rest of it revolves around a dangerous plan to write about their lives: it ends up reading as if it's a book about how this book was created (though the notes at the end make it clear that it isn't). It is a novel about individuals, and makes no pretence of being a history of the civil rights movement, but given the subject matter, it arouses strong feelings (see below, including comments, for some of the reasons). Passions run high in those with direct experience or detailed knowledge of racial issues in the US. My comments are the reaction of a fairly ignorant outsider . For a deeper, more complex, and educational (for me) way of looking at the legacy of slavery on race relations, see Octavia Butler's Kindred , review . IT'S ABOUT MOTHERING AND AWAKENING AS MUCH AS RACE Although it might appear that the main relationships are between employer and help, mothering and displaced mothering is in many ways a stronger theme. It's also about other relationships, especially between women: bitchy cliques, friendships made and broken, fear versus collusion. Husbands don't generally come out of it well. There is an awkward pact involved for white mothers: letting your children be raised by members of a race you despise versus raising the children of your oppressors. As Skeeter says, ""They raise a white child and then 20 years later the child becomes the employer. It's that irony that we love them and they love us, yet we don't even allow them to use the toilet in the house"". There are opportunities to sway young minds (and Aibileen tries especially hard), whilst thinking, ""Baby Girl, who I know, deep down, I can't keep from turning out like her mama"". The maids' jobs and colour also have a negative effect on their own mothering. Not only do some of the white children feel the help loves them more than their own mothers; in some cases they are right, and that causes other tensions and problems. Yet firing the help is not always an option: ""the help always know"" all the secrets. The three main characters are very strong women, and each gradually finds the strength to follow her conscience, despite the personal risks, to the point where Skeeter realises ""I no longer feel protected because I am white"". They learn, grow, awaken, and take some control over the future. However, if I were an African-American, or raised in the deep south, I'm sure these aspects would seem much less significant in comparison to the race theme. AUTHENTICITY? When I read this, I had no idea how accurate any of it is (I have subsequently learned of many doubts), but in terms of individual relationships, it rings true to this Brit, especially the different voices through which the story is told. It was also interesting that the maids were so used to ""the lines"", that they disliked it when they were crossed, e.g. by an employer who was too friendly: ""She just don't see 'em. The Lines. Not between her and me, not between her and Hilly"". Yet the maids train their own children into subjugation by teaching the rules ""for working for a white lady"". This has strange effects: ""I don't know what to say to her. All I know is, I ain't saying it. And I know she ain't saying what she want a say either and it's a strange thing happening here cause nobody saying nothing and we still managing to have us a conversation"". On the other hand , it seems improbable that all the powerful white women in the town are only in their mid 20s. I presume that was necessary because they needed to be contemporaries of Skeeter, and she needed to be young, but it still made me question the story in broader terms. SYMPATHIES One expects to have strong sympathies for the maids, but a couple of the white women (including Skeeter) have a hard time (not as hard as the maids, though): material privilege, but they don't fit into either world. That creates a tension in the reader that is quite powerful. The saddest white person is the little girl Aibileen cares for; she is a misfit in her own home, because her mother never bonded with her, ""She like one a them baby chickens that get confused and follow the ducks around instead"". Aibileen tries hard to compensate, particularly by repeating the mantra ""You kind, you smart, you important"". Mind you, she also sows the seeds future disagreement with her parents by telling secret stories about a kind alien visitor called Marti a n Luther King who thinks all people are the same, and by wrapping identical sweets in different coloured wrappers to make the same point. ""I want to stop that moment from coming - and it comes in ever white child's life - when they start to think that coloured folks ain't as good as whites."" STEREOTYPES Although the book fits with some stereotypes (e.g. the hideous contradiction of raising money for starving Africans whilst campaigning for outside loos in all white homes, lest the owners catch black diseases), it certainly confounds others, both in the minds of some of the characters and, to a lesser extent, to the readers (e.g. many of the maids are more educated than might be expected and Aibileen is an keen and excellent writer). As Skeeter says, "" The dichotomy of love and disdain living side by side is what surprises me "", and that was the core of the book for me. LANGUAGE, DIALECT and DIFFERENT VOICES From the very first sentence, you are aware of Aibileen's voice and dialect, ""on a early Sunday"". She is an ageing maid who cares for white children when they are young, then moves on. Her own son died in an industrial accident at 24 and from then ""A bitter seed was planted inside me. And I just didn't feel so accepting any more"". Is this dialect accurate, patronising appropriation, or both? Minny is the other black voice: a maid and church friend of Aibileen's, but with a young family and violent husband. She speaks her mind, so has often been fired. The final voice is Skeeter, the daughter of a plantation owner who has returned from college and is shocked to discover that the beloved maid who raised her has gone, and no one will tell her why. OTHER IRRITATIONS * My knowledge of US history is scanty and I didn't know when it was set until page 22, though even then I was only able to work it out by looking up Stevie Wonder's year of birth. * Despite being initially vague about the date, some subsequent mentions of period detail seem rather forced, e.g. ""To Kill a Mockingbird"", Rosa Parks and Bob Dylan. It should have been possible to mention them in a more natural way. * Did anyone say they needed ""space"" and ""time"" away from a relationship in Mississippi in 1963?",3.0,neutral,The Help,4667024
