review,rating,sentiment,book_title,book_id
"2 1/2 stars. Maybe my rating comes as a surprise or even - if you care - a disappointment, but let me assure you: no one is more surprised or disappointed than I am. I've had this book on my TBR ever since it appeared on Goodreads without a title, cover or description. I started reading it as soon as it became available and the array of positive reviews from my friends and strangers alike made me feel sure I would love it. But I didn't. It is possible I expected all the wrong things from , and maybe my review can prevent others from doing the same. Here's what I expected: an intricate fantasy world, supernatural politics and alliances, fast-paced action, a sensual romance - perhaps similar to and other Beauty and the Beast retellings, and a flawed but likable heroine. But this book is, if you ask me, nothing more or less than softcore erotica . Which is fine, if that's what you're looking for. I personally thought that the fantasy aspect felt like trimmings around a story that was all about a romance between Feyre (the narrator) and Tamlin (a High Lord of the Fae). There are some titillating scenes where Tamlin bites Feyre's neck and they have sex - undoubtedly the best bits of the book and I won't pretend I didn't feel a little hot under the collar myself. But the ""ancient wicked shadow"" promised in the blurb is only really a source of more romantic angst for Feyre and Tamlin. However, I *do* like a good romance as much as anyone, so there are other reasons this book didn't quite work for me. In order to express what I mean, I'm going to compare to , which is, in my opinion, a better book. In CB, I felt the chemistry between Nyx and Ignifex as soon as their loaded banter started to fill the pages. They were sexy together, Ignifex was an evil ruler (which was a real problem for their relationship) with blood-red eyes, and the supernatural part of the book was creepy, weird and completely unique. Despite enjoying the actual non-PG scenes in , I never felt any real chemistry between Feyre and Tamlin or any realistic challenge to their relationship. What makes Beauty and the Beast such a compelling romance? One that demands to be told over and over again in so many different ways? I'll tell you what it is: it's the obstacles, the challenges, the improbability... how can a young woman come to love an ugly beast? We ask. I'll prove it's possible! The author replies. That's why readers fall in love with the beast again and again, even when he is furry and has horns like the Disney version. I loved the Disney beast. And that badass fox in Robin Hood so it's possible I have issues. Tamlin is not a beast. “Even as he bit out the words, I couldn’t ignore the sheer male beauty of that strong jaw, the richness of his golden-tan skin.” Oh my, how could a poor young woman ever love a pretty-faced, golden-haired, completely not evil Fae prince? How weird. Maas is a good writer and the beginning - before Feyre is taken to the Fae world - made me believe a great book was on the way. When Maas writes action, she writes action really well. But there was far too little of it in this book. It came in behind the descriptions of beautiful Fae men and the Fae palace. In short: It just wasn't nasty enough. In truth, this felt more like an extended Cinderella retelling than what it was supposed to be. A girl lives in poverty and looks after her rather annoying sisters until one day she is swept up by a prince who takes her to his beautiful palace (after about three chapters). I just find it hard to recommend this when I think is similar and yet so much better. | | | |",2.0,negative,"A Court of Thorns and Roses (A Court of Thorns and Roses, #1)",50659467
"4.45/5 ⭐ Full review on my Blog: 🐺 This book’s mood song match – mum : *enters kitchen at 3 am* What the hell are you doing? me : *with a bowl of ice cream in one hand and ACOTAR in the other* I'm starting another SJM series mum : Hang on, I have a bottle of vodka here somewhere * And if this is not some relatable shit when facing Sarah J. Maas’s books then I don’t know what to tell you anymore. You puzzle me. So, there you go – another great universe erected by SJM just in front of our humble eyes. She is building her own fucking multiverse and we are here to witness the power of a goddess at work. I will make three sacrifices for that. This is, so far, for me, the best Beauty and the Beast reimagination. HER EXECUTION STYLE IS THE AIR TO MY LUNGS. And this one is not even the best of her works. “Magic – everything was magic, and it broke my heart.” Mainly, our action is happening at the Spring Court where our main character finds herself in front of a new intriguing life. Or at least as intriguing as a Court of flowery gardens can be. As I always say about SJM’s books, the characters are the ones who make the action . It’s like they are the very engine of a plot. I kind of like Feyre . She definitely has her own personal issues, mainly because she is broken and lonely and desperate to beat her status. She is human and miserable, mainly because her family is horrible. Her whole family was created to look like the typical fairytale family – an absent coward of a father, an uninterested mother, a sister full of wicked hatred and another one caught up in her own world, sensitive and naïve. Until her sisters do something worthy of my affection, I ain’t changing my mind about them. Lucien (the Emissary of the Spring Court), I must say, I liked from the very beginning, but he somehow managed to grow on me. There was something likeable about him at first and he only proved that to me more as the action went on. Tamlin , the High Lord of the Spring Court, on the other hand, seemed a bit stiff the whole book, even though I sometimes appreciated the occasional softness of his heart. But full-on honesty now – the best thing about this book, the one thing that made it 110% better was Rhysand . He won for this book a full star from me with all of his domineering prick moves. He played the bad boy role so good that my traitorous heart enjoyed him whole. I might have a problem but oh, what a perfect problem he is. “His voice was a lover’s purr that sent shivers through me, caressing every muscle and bone and nerve.” Sexy. Rhysand and Feyre certainly have a sort of total chemistry that it seems Feyre doesn’t have with Tamlin; not even after they supposedly fell in love with each other. I don’t buy that love for more than a second and by the end when everything seemed to try to make me believe their relationship I was still not convinced. I recognise fabulous chemistry when I see one and that ain’t it. Rhysand, you’d better act up, love, I have expectations. You’re more than just a cruel, beautiful ruffian, I know it. There’s a certain cruelty in this book, so very Maas. I sometimes feel like I’m reading the words of a psychopath, but then I remind myself how much I enjoy this cruelty in these books and I temperate myself. That crazy wretch Amarantha is definitely the embodiment of cold murder and torture in this book and this is visible when it comes to how much her actions affect the other characters’ moods and movements. It’s terribly interesting though to see how terrified all of them can become when facing her. But by the end, there was this sliver of hope that lingered. And that broke the evil to pieces. “This wasn’t music to dance to – it was music to worship, music to feel in the gaps of my soul, to bring me to a place where there was no pain.” Even though I think this is not the best of SJM’s works, I still believe is so very good that just makes you want to know more. It leaves you craving. And in my humble opinion, that’s a bonus factor in books. All and all, my first step into the ACOTAR universe has been a success. More steps to come. Until I fall in love. Wholly and irrevocably.",4.0,positive,"A Court of Thorns and Roses (A Court of Thorns and Roses, #1)",50659467
"I cannot remember ever being this conflicted over a book. There are parts of A Court of Thorns and Roses I really loved, but a lot of parts I really hated. I went into this book fully expecting to love it. Beauty and the Beast is one of my favorite fairy tales, and I was interested to see how SJM made the story her own. First off, my biggest problem with this story was Feyre as a character. I have never been so irritated. Her character development and personality, for the most part, didn't make sense to me. She was the caretaker of her entire family for years, supposedly a hunter with a strong survival instinct. And yet, she proceeded to make the stupidest decisions and put herself in danger time and time again. I didn't get the sense that she did this out of bravery, but more out of stupidity. It didn't mesh with what her character was supposed to be. Examples of these idiotic choices: 1. Repeatedly plotting to escape into a faerie land that she knew to be deadly, when she was asleep on the way to the manor and obviously wouldn't know her way back to the mortal lands 2. Running after the illusion of her CRIPPLED father at NIGHT, when she has been told and witnessed how deceptive fae can be 3. Trapping a Suriel with little more than a snare, in the deadly part of the forest, after she has been told, and AGAIN, SEEN how dangerous these creatures are 4. Going to Fire Night after being told how dangerous it is, not leaving after being almost raped by 3 faeries, and then proceeding to leave her room AGAIN afterwards 5. Drinking the faerie wine at the Solstice, even after Lucien of all people warned her not to 6. Leaving the manor when the Suriel flat out TOLD her not to and that she would be safe with Tamlin, and deciding to not mention that to ANYONE before he forced her to leave In addition to all of these idiotic choices, she also is incredibly inconsistent. She'll go from hating Fae to sympathizing with them to loving them back to fearing them at the drop of a hat. These inconsistencies are probably the most irritating, as there are scenes that I absolutely adore with Feyre, but then she goes back to doing the next pain in the ass thing on the next page. I also found her relationship with Tamlin to be problematic. Yes, I do enjoy problematic things (especially ships from time to time) but there were a lot of things I couldn't excuse with them. Again, more inconsistencies in characters' behavior. Tamlin's hot and cold behavior was eventually explained, but not until 70% of the way through the book. It was too little too late. Also, I found the Fire Night scene to be a problem for me. I do enjoy volatile relationships and bad boy characters. But only when we are told from the beginning that one of the characters is ""bad"". Tamlin we are led to believe is a saint, then he bites her and gets possessive, but all is forgiven the next morning. Because he's a ""nice guy."" No. The world building I found to be lackluster in a lot of ways. While I really enjoyed the wide variety of Fae creatures we got to see, I thought that a lot of the back story was revealed in a lazy way. Instead of having Feyre figure anything out for herself, important things are told to her through long monologues from a number of characters throughout the book. This happens numerous times. Additionally, few side characters have any development and most felt like blank slates. With that being said, the ones that were developed I adored. Lucien and Rhys saved the book for me in a lot of ways. I found them both to be complex and interesting characters. The last 10-15% of the book saved it for me. I found the plot to finally be interesting, and I found Feyre's decisions in those chapters to actually make sense. A lot of things were set up for future books that have me very intrigued, and I'm looking forward to the rest of the series. Many things that I disliked in this book, may in fact be remedied due to some of the occurrences in this last small section of the book. Overall, I was disappointed by this first installment. While there were elements I really enjoyed, they didn't make up for the elements I didn't. I'm hoping future installments will prove to be better. I will also be doing a full video review and spoiler-filled discussion on my in the future if you want to know more of my thoughts.",2.0,negative,"A Court of Thorns and Roses (A Court of Thorns and Roses, #1)",50659467
"4.8 /5 Stars ⭐️ ⭐️ ⭐️ ⭐️ ⭐️ “Don't feel bad for one moment about doing what brings you joy.” I'm speechless. What am I supposed to say after this? Am I supposed to write a coherent review with vital points as to why this book WAS FUCKING AMAZING??? I CAN'T EVEN TALK RIGHT NOW I'M SPEECHLESS. I WANT THE SECOND BOOK IN MY HANDS BUT MY ORDER STILL HASN'T COME. I'M READY TO GO TO FUCKING ENGLAND MYSELF AND PURCHASE IT. KIDS I'M LITERALLY DYING HERE. The Beauty and the Beast-esque fantasy drama tells the story of Feyre, who finds herself entwined with faeries after unknowingly killing one. When the 19-year-old huntress kills a wolf in the woods, a beast-like creature arrives to demand retribution for it. Dragged to a treacherous magical land she only knows about from legends, Feyre discovers that her captor is not an animal, but Tamlin, one of the lethal, immortal faeries who once ruled their world. Feyre must find a way to stop it or doom Tamlin and his world forever. I'm not a fantasy fan. I love fantasy in film and tv but not in books. I picked up this book cause I wanted to use it for my thesis for uni (don't even ask) and now after I graduated I decided to give it a go. My favorite genres to read are historical fiction and contemporary, and fantasy falls on a very different category. But the fantasy in this book man... it gripped me tight and didn't let me go. First I started off this book a bit confused. The language confused me a bit, the terms, all the information. I'm reading books in English while my native language is Greek so fantasy fell a bit harsh on me. As I said, I'm not a fantasy fan, and with fantasy comes many weird words and shit like that. But I kept going and after a while I got used to everything and started to enjoy the plot and the characters. I enjoyed very much the factor that there weren't many characters in this book. I don't like when a book is crowded with characters, it doesn't give me the space to love them all. This book succeeded in making all the characters lovable for me... even Rhysand. I fucking love Rhysand man. Unexpected feelings happening. The world created is so rich and dark and gloomy but also happy and hopeful and full of light, I truly enjoyed reading about it. I always get bored, to be honest, with descriptions and politics of different worlds but this one excited me. Even the fucking politics were exciting. I want to delve more into this world wHEN MY FUCKING BOOK ARRIVES. Now to the juicy shit... the romance. Holy fucking shit. I ship these two so hard I can't even breathe. When he sent her away I wanted to scream! He gave her a good fucking and left her hanging. Why am I laughing at this? But honestly, the romance was amazing. At first, I felt like the entire book was only gonna be about the romance and I didn't quite enjoy that but after all the revelations and the twists in the plot, the romance was used wisely. And I didn't expect that, because I have heard lots of things about this book. And now we have Rhysand... this dark, handsome motherfucker who has a gloomy past. This will become a triangle, I can feel it in my bones. But I'm here for it, for some reason. I love the heat Maas's romances convey in me. To sum it all up, this book took me a while to get into but it was all worth it. Maybe after this book I will start reading more fantasy. Maybe. Maybe not. As I'm waiting for the sequel to arrive, I will drawn my sorrow into crying about how amazing this first book was. Or maybe reread some parts. Maybe. Anyway, till the next one K BYE!!!",5.0,positive,"A Court of Thorns and Roses (A Court of Thorns and Roses, #1)",50659467
"Feyre is hunting in the middle of the woods to keep her useless starving family alive (Hunger Games, anyone?). A chance encounter with a wolf - who wasn't entirely a wolf - leaves Feyre on the wrong end of an ancient treaty. She is forced to go to the fairy realm to live out the remaining years of her human life - no friends, no family and no freedom. “Has anyone ever taken care of you?” he asked quietly. “No.” I’d long since stopped feeling sorry for myself about it. At first, she cannot think of anything but escape. Slowly (but surely), she is swept into the fairy realm - in its magic & intrigue, in its danger & hopelessness, and in its wonder & glory. “Spring, Summer, Autumn, Winter, Dawn, Day, and Night,” it mused, as if I hadn’t even answered. “The seven Courts of Prythian, each ruled by a High Lord, all of them deadly in their own way. They are not merely powerful—they are Power.” Feyre lands in the Spring court - which is under a masquerade curse for nearly fifty years. The court is being attacked by all manner of terrible creatures and there is a blight upon the land . This blight will soon cross to the human realm - threatening everyone Feyre holds dear. The first half sucks but keep reading There's no way around it. From page 1 to about 200, Feyre is annoying and obstinate. I nearly put this book down half a dozen times (it was like reading ). BUT, there was something about it that kept me interested. AND THANK GOODNESS FOR THAT. Because wow. Seriously wow. Midway through the book, things turned around magnificently. It was like a whole new book. Sarah J Maas is a devious little thing. Suddenly, all the plot holes, nonsensical actions of her fairy captors (Tamlin and Lucien) and Feyre's complete idiocy flipped on their heads. Everything makes sense now. I literally could not put this down. Though, and maybe it's just me, but the Tamlin-Feyre arc felt a bit rushed/forced. Her constant love declarations really had me questioning their relationship. But then again, I had a friend who accidentally spilled the beans on that one. Without giving any spoilers, I sure hope book 2 does a complete character shift on you-know-who (NOT voldemort) because I am not pleased with the way the love interest was hinted at during the end of the book. (He's such a jerk!) Overall, I am amazed by how much effort Sarah J. Maas put into constructing this story. I'm this close || to rereading the book solely to better appreciate all those little clues that I must have passed over. So, if you pick this up and just aren't feeling it - keep reading - trust me. The Finer Books Club - 2018 Reading Challenge: A book recommended by a friend | | | | | Snapchat @miranda_reads",4.0,positive,"A Court of Thorns and Roses (A Court of Thorns and Roses, #1)",50659467
"2.5 Stars Once again, I find myself the odd man out when it comes to a massively popular book... I went into this really excited and and really wanting to love this thing. After seeing this book and its successors paint my feed with its courts and thorns and wings and ruin, I knew there was a lot of hype surrounding this series in general. And this first installment just didn't live up to it for me, sadly. There, there, Court Thornians... Quite frankly, the first 60% of this book dragged like a U-Haul trailer with no wheels. Nothing really happened and the things that did didn't even make sense until after the book was over. And I'm just not a fan of that. I like to enjoy books while I'm reading them, not only for the last 25-35% when everything that was murky throughout the whole book becomes clear. I also found myself WAY more interested in Rhysand than the actual love interest, Tamlin. Whoops! THAT SAID. I did enjoy the writing and the ending. And while those things aren't enough to prompt me to rate this thing any higher, I AM going to read the second book . I trust my peeps and all of you are saying that, while the first book drags, the second book is ""OMG amazeballs."" And I have faith in ya'll. Plus, I am getting it free from the library, so why not, no?",3.0,neutral,"A Court of Thorns and Roses (A Court of Thorns and Roses, #1)",50659467
"I approached this book with an open mind and wanted to enjoy it. Despite not being a fan of the superfluous writing style or the lackluster world-building, I was still willing to rate it 3 stars by viewing it as an easy guilty pleasure romance book. The relationship seems harmless and I still don't see how it's as problematic as people dramatize it to be. The first half of the book is a standard Beauty and the Beast retelling — not awful, but not special either — and then the second half really dips in quality, which lowered my rating to 2 stars. A couple glaring issues that stood out to me: 1) The background story of the curse is literally told instead of shown via a side character's lengthy monologue. This was disappointing since I was intrigued to find this out by piecing clues together, not by being told it straightforwardly like a regurgitated wikipedia article. 2) The main character seems relatively smart but consistently has leaps of logic that are clearly there for the sake of plot. 9 out of 10 times she won't follow the advice of another character. 3) The antagonist is SO cartoonish — like mustache-twirling cartoonish. She gives a bunch of arbitrary challenges and rules for no reason other than for the sake of stringing along a story. It feels like she's hosting a game show or some overly complex scavenger hunt. There's no reason why she'd bother setting up any of these superfluous rules. I think this is the worst antagonist I've ever read. I'm willing to overlook the writing style and bland romance, but once I got to the part where Feyre answers the riddle, I had to drop it down to 2 stars because it was so ridiculous and lazy. I've heard that the sequel is much better though, so I am willing to give it another try, just not any time soon haha.",2.0,negative,"A Court of Thorns and Roses (A Court of Thorns and Roses, #1)",50659467
"First read: May 2015 Second read: May 2016 Third read: April 2017 Fourth read: February 2018 Fifth read: June 2019 — I think this is my most read series alongside Harry Potter and Mistborn. Sixth reread: Feb 2021 Seventh reread: September 2023 Every reread of this book has somewhat differed but nothing too drastic. It’s still my least favourite in the series. There’s nostalgia involved since this was my first book by Sarah J Maas. I’ve become really familiar with these books now. Or maybe I should say attached. It’s a great Beauty and the Beast retelling. It’s a great setup for the books to come, especially where Feyre is concerned and her character development, which is where Maas excels at. I quite frankly hated how loyal Feyre was to her family, though it’s understandable. But it’s this level of loyalty without any concern for her own well-being that leads to her downfall. Her loyalty to Tamlin when it came to the events that happen towards the end of the book destroy her. It was uncomfortable to read and see Feyre come to this realisation herself. This seems to straddle the line of YA and NA fantasy, which is why I’m assuming the world-building feels so lacklustre, and at times, juvenile. Amarantha read like a spoiled child, though she’s the villain. I just didn’t care for the magic and world-building in this book because of how underdeveloped they felt. Thank the stars this improves leaps and bounds in the sequels. Everything improves drastically in the sequels.",3.0,neutral,"A Court of Thorns and Roses (A Court of Thorns and Roses, #1)",50659467
"An illiterate 19 year old straight up kills a guy and is outraged when there are consequences. Her punishment is living in a mansion with a hot mayor and hanging out with his friend, the nicest guy in the world and the only character I care about in this series. This is a tragic turn of events for Feyre, as it separates her from her life as an indentured servant to her shitty family. Who’s going to take care of her deadbeat dad, her personality-proof younger sister, and Nesta, Satan’s apprentice? One day a generically handsome man appears and all of BookTok developed a bat fetish overnight. Some stuff happens as Feyre ends up in the Tri-Wizard Tournament from hell where she has to outsmart a worm. Feyre struggles but eventually triumphs due to severe interference from outside sources. This goes on for five books. The fanbase for this series is the size of a large-ish army and if you say something negative about Cassian, they will hunt you down and ruin your life. And honestly, good for them. 1/17/24: I have just reread this book and stand by my 3 stars with the addition of how on earth did she figure out the Tamlin-heart thing and not the riddle, which could have appeared on a Bazooka Joe wrapper meant for children? And she fell in love with Fiddle Boy when Lucien is RIGHT THERE? HE’S RIGHT THERE. Whatever Feyre, learn to read. Edit: “Elain isn’t the youngest blah blah blah” you know what? I’m not changing it. She’s the youngest now. Deal with it.",3.0,neutral,"A Court of Thorns and Roses (A Court of Thorns and Roses, #1)",50659467
