review,rating,sentiment,book_title,book_id
"One of my absolute favourite books, which I have read multiple times. A major classic. If at all possible, get an edition with the original illustrations. ___________________________________ (Expanded review based on conversation with ) Here in Switzerland, l'affaire du mot N hasn't quite had the high profile it's received on its home territory. In fact, I'm embarrassed to admit that I hadn't even heard of it until Jordan gave me a few pointers earlier today. So, no doubt all this has been said before, but I still can't resist the temptation to add my two centimes worth. In case you're as ignorant as I was about hot topics in the literary world, the furore concerns an edition of Huckleberry Finn in which the word 'nigger' has been systematically replaced with 'slave'. My initial response was plain surprise. One of the aspects of the book I enjoy most is Twain's appallingly exact ear for dialogue. He's reproducing the language actually used in the American South of the 1840s, and this, above all, is what gives the novel its force; so why on earth would anyone want to change it? For example, here's Huck's Paw in full flow: ""Oh, yes, this is a wonderful govment, wonderful. Why, looky here. There was a free nigger there from Ohio -- a mulatter, most as white as a white man. He had the whitest shirt on you ever see, too, and the shiniest hat; and there ain't a man in that town that's got as fine clothes as what he had; and he had a gold watch and chain, and a silver-headed cane -- the awfulest old gray-headed nabob in the State. And what do you think? They said he was a p'fessor in a college, and could talk all kinds of languages, and knowed everything. And that ain't the wust. They said he could vote when he was at home. Well, that let me out. Thinks I, what is the country a-coming to? It was 'lection day, and I was just about to go and vote myself if I warn't too drunk to get there; but when they told me there was a State in this country where they'd let that nigger vote, I drawed out. I says I'll never vote agin. Them's the very words I said; they all heard me; and the country may rot for all me -- I'll never vote agin as long as I live. And to see the cool way of that nigger -- why, he wouldn't a give me the road if I hadn't shoved him out o' the way. I says to the people, why ain't this nigger put up at auction and sold? -- that's what I want to know. And what do you reckon they said? Why, they said he couldn't be sold till he'd been in the State six months, and he hadn't been there that long yet. There, now -- that's a specimen. They call that a govment that can't sell a free nigger till he's been in the State six months. Here's a govment that calls itself a govment, and lets on to be a govment, and thinks it is a govment, and yet's got to set stock-still for six whole months before it can take a hold of a prowling, thieving, infernal, white-shirted free nigger. I'm sorry, but I'm honestly unable to see how anyone could think the above passage was racist or might be improved by substituting 'slave' for 'nigger'. It's incidents like this which create the popular European myth that Americans don't understand the concept of irony. If you're curious to know more about the tradition of improving great works of literature by removing dubious words, you might want to take a quick look at which Jordan and I were giggling over. Bowdler, it turns out, had acted from the best of motives. When he was young, his father had entertained him by reading aloud from Shakespeare; but Later, Bowdler realised his father had been extemporaneously omitting or altering passages he felt unsuitable for the ears of his wife and children. Bowdler felt it would be worthwhile to present an edition which might be used in a family whose father was not a sufficiently ""circumspect and judicious reader"" to accomplish this expurgation himself. He undertook to create a suitably amended version. Or, to be exact, he got his sister to do it and then gave out the books under his own name. Again, his reasons were unimpeachable: it would have reflected badly on her to admit that she had understood the naughtier passages. I won't criticise Dr Bowdler or his equally well-meaning modern followers. I just think it's a shame Mark Twain never had the opportunity to write a story about them.",5.0,positive,The Adventures of Huckleberry Finn,40375652
كله يدلع نفسه..بالعقل و بالاصول اوعى تدلعها زيادة دايما بتفكرني هذه الأغنية ب هاكلبيري فين ذلك الصبي الأشقر المطالب للابد بحق الانسان في ان يكون ملكا لنفسه مهما كلفه ذلك من مشاق و صراعات صبي افاق شريد.. يكره العمل المنتظم و الذهاب للمدرسة او الكنيسة !! لا يبغى سوى : حرية منفلتة بلا حساب او عقاب..فيه لمحات من بيتر بان الصبي الابدي نصيبه من العلم محدود..و من التربية معدوم♨ ..ترق له ارملة و تتبناه ..و لكنه يتبطر على حياة الدعة و الشبع المصحوب بالادب و النظام بالطبع..و يهرب مع عبد اسمر هارب. .ليلعبا لعبة الحياة الكبرى ..الصراع لنيل حريتك و عبر رحلتهما في الميسيسيبي⛵ ..يسخر توين بقلم لاذع لا يضاهى من تقاليد المجتمع الأمريكي بطبقاته.. من الكذب و الخرافات ..الجهل و التعليم..الثار و العبودية قيمة الرواية تأتي من انها تفرق بين المبادىء الانسانية الصحيحة و القيم الزائفة التي تستمد بقاءها من تقاليد بالية تتسلط على الجموع و العقول و تصبح لها قوة قاهرة لأي تفكير فردي حر يحتفي الأمريكيون بهذه الرواية بشكل لايصدق⭐ . . فهي الرواية الوحيدة التي تصلح ليقرأها المرء في العاشرة ..ثم يقرأها سنويا و تمنحه شيئا جديدا,3.0,neutral,The Adventures of Huckleberry Finn,40375652
"THE Greatest American Novel? Well... No wonder the Spanish think themselves intellectually/culturally superior with their Quixote, undoubtedly a blueprint for this mischievous Every Boy! Huck Finn is the full embodiment of THE American Fantasy: mainly that dire misconception that the protagonist of the world is you and that everything gravitates around that essential nucleus. Everyone in town thinks Huck dead, and what does he do but follow the tradition of a plot folding unto itself (as Don Q finds his story become medieval pop culture in Part II of that superior novel) as he disguises himself as a little girl and tries to squeeze information out of some lady about his myth-in-the-making trek. It seems everyone cares for this vagrant, a perpetual Sancho P to Tom Sawyer's Quixote, whose redeemable features include (a pre-transcendental) openmindedness and an inclination to live only in the NOW. But the narrator, a very unreliable one at that, surrounds himself with bad bad men, playing the role of accomplice often, always safe and sound under the dragon's wing. Very American in his lemming mentality & in his misconceptions (though about his hometown and wilderness he knows much indeed). So: disguise used as an integral plot device several times throughout; brawny men taking a boy hostage; nakedness by the riverbed; costume changes, improvised Shakespearean shows, men almost always described as ""beautiful"" (and women solely as ""lovely"").... ***GAY!!*** Yeah, it really is hard to discern the allegory behind all of this hype. The humor is obvious, but I have to admit that this picaresque novel about a boy who avoids ""sivilization"" at all costs is beaten mercilessly by a more modern, therefore more RELEVANT tale of the South, ""Confederacy of Dunces."" Although it must be admitted that ""Huck Finn"" does manage to surpass other often-praised classics, like the droll ""Wuthering Heights.""",4.0,positive,The Adventures of Huckleberry Finn,40375652
"Pretty good, kinda silly - but I think that is what Twain was going for - 3.5 stars. Twain is the king of the Yarn. Huckleberry Finn is a collection of outlandish tales all with lies and trickery at their heart. At the time of its release I am sure it became a bible for scoundrels and mischevious teens. This book is controversial, and even frequently banned, because of its portrayal of black slaves and the use of the N-word. I venture into shaky ground here by offering my opinion as I am white, but I don't think I will cause too much trouble. I can accept that at the time of writing the words and language were fairly normal so as a time period piece it is true. However, I can't say I have read a book that takes place in that time period that so flippantly tosses the n-word around. Regarding banning of this book - I can definitely tell why some parents might be concerned about their kids reading this book. I think a lot of it depends on how it is being taught - I would hope the teacher would put an emphasis on explaining the language being used. Summary: - A good book - Kind of silly - A handbook for deception - An understandably controversial reflection of the prejudices at the time it was written - Some may need guidance regarding the the way racial differences are portrayed in this book.",3.0,neutral,The Adventures of Huckleberry Finn,40375652
ماجراهای هاکلبری فین نوشته مارک تواین گرچه به ظاهر یک داستان ماجراجویانه‌ است اما در آن موضوعاتی مانند نژادپرستی و برده‌داری از دید یک نوجوان در جنوب آمریکا اواخر قرن نوزده را می توان دید . نویسنده داستان را از نگاه یک نوجوان سرکش و بی‌خانمان روایت کرده که هنوز صداقت کودکانه ، صداقتی که هنوز آلوده نشده را دارد . هم چنین تواین با استفاده از زبان محاوره‌ای و روایت اول‌شخص، جامعه‌ای را نشان داده که در آن قانون و اخلاق، گویی در تضاد با یکدیگر قرار گرفته اند . رمان ماجراهای هاکلبری فین در جنوب آمریکا ، مرکز برده‌داری و نژادپرستی اتفاق می‌افتد ، در امتداد رودخانهٔ می‌سی‌سی‌پی، که یکی از نمادهای جغرافیایی و فرهنگی جنوب آمریکاست . نقطه عطف داستان را باید از جایی دانست که سفر هکلبری فین با برده ای فراری به نام جیم شروع می شود ، هکلبری که اطلاعی از نژاد پرستی و برده داری ندارد و این مفاهیم در ذات او و هر جنوبی دیگر نهادینه شده ، به جیم کمک می کند تا با سفر بر روی می سی سی پی و رسیدن به ایالات شمالی ، هم خود آزاد شود و هم بتواند برای آزادی خانواده اسیرش کاری کند . شاید این سفر هکلبری به سمت شمال را به توان گریزی از جامعه جنوب دانست که جامعه‌ای به ظاهر اخلاق‌مدار اما به شدت تبعیض گذار است . بنابراین ، این سفر شاید هم نماد فرار از ساختارهای فاسد جنوب باشد و هم بستری برای تحول اخلاقی. آیا هک متحول می شود ؟ هاک در آغاز داستان، فردی بی‌تفاوت و ناآگاه نسبت به مسائل اخلاقی و اجتماعی پیرامون خود است. او جیم را صرفاً همراهی در مسیر فرار می داند و همچنان تحت تأثیر باورهای نژادپرستانهٔ رایج جامعهٔ زمان خود قرار دارد. با این حال، در طول سفر، و به‌ویژه در مواجهه با خطرات و چالش ها ، نگرش او به‌تدریج دگرگون می‌شود. نقطهٔ اوج این تحول را باید زمانی‌دانست که هاک تصمیم می‌گیرد برخلاف آموزه‌های رسمی و قوانین موجود، به جیم کمک کند ، گرچه کمک او به‌زعم جامعه غیرقانونی است. تحول هکلبری فین ، گرچه از نظر ظاهری محدود و تدریجی‌ست، اما از نظر معنایی شاید عمیق و تأثیرگذار باشد. هاک، با وجود سن کم و نداشتن سواد ، به درکی انسانی و اخلاقی از آزادی، عدالت، و همدلی می رسد که بیشتر جنوبی ها به آن نرسیده اند . در پایان، ماجراهای هاکلبری فین تنها یک داستان ماجراجویانهٔ نوجوانانه نیست بلکه کتابی است که با صداقت و جسارت، وجدان فرد را در برابر ساختارهای تبعیض آمیز قرار می‌دهد. مارک تواین با استفاده از زبانی ساده و نگاه کودکانه، تاریخ پرتنش آمریکا در قرن نوزدهم را به تصویر کشیده .,3.0,neutral,The Adventures of Huckleberry Finn,40375652
"""All right, then, I'll GO to hell"" -- This is Huck's decision, rather than turn in his friend, Jim. They had been through many things together. Here's the story.... Huck faked his death and ran away from his drunken father. On Jackson’s Island, in the middle of the Mississippi River, Huck encounters Jim, a runaway slave and his friend. Jim fled because he overheard his owner, Miss Watson, planning to sell him to a plantation. Huck and Jim ultimately must escape the island because their campfire is spotted. Later in their adventures Huck reports... I got a piece of paper and a pencil, all glad and excited, and set down and wrote: ‘Miss Watson, your runaway nigger Jim is down here two mile below Pikesville, and Mr. Phelps has got him and he will give him up for the reward if you send.’ I felt good and all washed clean of sin for the first time I had ever felt so in my life, and I knowed I could pray now. But I didn't do it straight off, but laid the paper down and set there thinking -- thinking how good it was all this happened so, and how near I come to being lost and going to hell. And went on thinking. And got to thinking over our trip down the river; and I see Jim before me all the time: in the day and in the night-time, sometimes moonlight, sometimes storms, and we a-floating along, talking and singing and laughing. But somehow I couldn't seem to strike no places to harden me against him, but only the other kind. I'd see him standing my watch on top of his'n, 'stead of calling me, so I could go on sleeping; and see him how glad he was when I come back out of the fog; and when I come to him again in the swamp, up there where the feud was; and such-like times; and would always call me honey, and pet me and do everything he could think of for me, and how good he always was; and at last I struck the time I saved him by telling the men we had small-pox aboard, and he was so grateful, and said I was the best friend old Jim ever had in the world, and the ONLY one he's got now; and then I happened to look around and see that paper. It was a close place. I took it up, and held it in my hand. I was a-trembling, because I'd got to decide, forever, betwixt two things, and I knowed it. I studied a minute, sort of holding my breath, and then says to myself: ""All right, then, I'll GO to hell"" -- and tore it up.’ Huck's epiphany is that Jim is a human being, no matter what people call him or how they treat him, and Huck is willing to risk his soul to help him. =========== I don't listen to many audiobooks, but if you like them may I suggest the brilliantly narrated version by Elijah Wood. He captures the colloquial speech brilliantly in a way I never got from the written page.",5.0,positive,The Adventures of Huckleberry Finn,40375652
"Finally got to this after about 50 years. A fun read and continuation of the Tom Sawyer story. Not politically correct for our times. But who cares. It's Mark Twain, by golly.",4.0,positive,The Adventures of Huckleberry Finn,40375652
