review,rating,sentiment,book_title,book_id
"Brave New World is a young man's novel, written in the interwar years. Huxley was then living in a collapsing world: a world where the optimist 19th-century dreams of progress, of improved humanity, of a new and superior man, had been shattered in the trench warfare of World War I and were about to be burned amidst the horrors of the concentration camps. Huxley seems to be sensing that grave danger is looming on the horizon, and he imagines a utopia where a single superstate is ruling the whole planet. The dream of a “superior humanity” has eventually come true, thanks to the extensive use of eugenics and mass cloning (babies in bottles). Not all people get the best genetic formula, however: some of these manufactured humans are reduced to imbecility, perform the lowest functions, and are nonetheless content with their lot. Children, of course, are all brainwashed and conditioned with hypnotic techniques (sleep teaching). There are no families anymore, and sexual promiscuity is pervasive. Adults get a further supply of silly entertainment (Feelies) and drugs (Soma) that renders them docile, keeps them young, and make them love their voluntary servitude. People have lost interest in art and science, and religion has been replaced by Henry Ford’s cult (i.e. assembly line applied to human beings) and occasional orgiastic ceremonies (orgy-porgies). In short, humanity has achieved happiness and reached the End of History. To some extent, Huxley’s prophecies have become a reality, less than a century later: rational, hierarchical, hyper-efficient and optimised capitalism and cheery consumerism have conquered most of the world. The sexual revolution has indeed taken place — although full sexual libertarianism is still a pipe dream. Pharmacopoeia, narcotics, antidepressants, tranquillisers and rejuvenating treatments are broadly available; as well as irrelevant and mind-numbing 3D entertainment, peppered with commercial slogans. Genetic engineering and biotechnology are everywhere (although not used to select humans as yet). Brave New World is a novel structured around a set of (rather crude) characters and plots; there is, however, no clear protagonist. Huxley has a witty tongue-in-cheek sense of humour throughout. Some passages even have a purely poetic or musical quality: particularly through the use of ’s lines for the character of John Savage, or the cross-cutting technique employed in chapter 3. But by and large, the book feels like a philosophical essay or social satire, in the style of Voltaire’s or Swift’s . Obviously, Huxley had Plato’s in mind, when designing his Alpha / Bêta / Gamma / Delta / Epsilon caste system (he was probably also referring to the school grades: A+ to F, already in use when he was a pupil at Eton College, or even to the caste system in India). Certainly, he remembered Nietzsche’s “ Letzte Mensch ” from ’s prologue: a human type that has indeed invented happiness, comfort and social stability, but ultimately a petty and lethargic sort of humankind. A type of humanity that might well be appealing to us right now, who knows… Brave New World is obviously a fascinating political statement that spoke to the European crisis of the 1930s. But its visionary impact and influence on speculative fiction cannot be overstated, from Orwell’s to Bradbury’s , to Atwood's , and to Houellebecq’s . See also my review of . Edit : Watched Universal’s 2020 . It is by and large faithful to the novel’s plot and characters, but ends up taking more and more liberties as the episodes go by. It’s also focusing way more on the entertainment potential of the book (especially the erotica aspects of the orgy-porgies) than on the political debate around the problem of happiness vs freedom. All references to Shakespeare have been removed as well, although the romance is a central part of the show (not so much in the book). Ultimately, Huxley’s philosophical novel serves as the rib cage of the series, but its heart is more like Black Mirror , Westworld , The Matrix or even Fritz Lang’s Metropolis . Nonetheless, a pleasant “feely” with some nice eye candy!",4.0,positive,Brave New World,31124837
"‎ I am I, and I wish I weren't. إن كان راي برادبوري في روايته الأشهر قد اخترع عالما تُحرق فيه الكتب فهسكلي قبله بسنوات طويلة توصل إلى فكرة أشد شناعة ففي عالمه الناس لا تُمنع من القراءة ‏ فهم أصلا لا يرغبوا فيها ‏ ولا يعرفوا لها قيمة أو معنى ‏ ::::::::::::::: تخيل نفسك تعيش هنا في هذا العالم‏‎ عالم السعادة الزائفة .. سعادة العقاقير عالم يبتسم فيه الجميع ‏ عالم ألمه مخدر وعقله مغيب‏ عالم بلا مشاعر أو علاقات إنسانية‏ عالم يقوم على التقسيم الطبقي البحث ‏ عالم خال من العاطفة والجمال‏ تصور أننا صرنا أجنة مرصوصين في القوارير‏ ننتظر ترتيبنا إلى واحدة من الطبقات الخمس والتي يحددوها لنا من قبل حتى أن ننشأ ‏ لا خيار لك في أن تكون واحد من الخمسة التاليين ‏*الفا ثم بيتا والذين هما الأعلى مستوى اجتماعيا وفكريا ‏ فمن ألفا يأتي قادة العالم وأعضاء الحكومة ‏*ثم جاما وهو من يقومون بالأعمال المكتبية والإدارية ‏*ثم دلتا وهم من يقومون بالأعمال اليدوية التي لا تتطلب مجهودا ‏فكريا ‏*وأخيرا إبسيلون‎ ‎ الأغبى والأدنى مرتبة –عمال نظافة وما شابه وهم يشكلون أغلبية الشعب لا تحاول أن تختار ليس لديك هذا الحق أصلا ! ::::::::::::::: ‏"" ولكنني لا أريد الراحة..‏ أنا أريد الرب..أريد الشِعر..أريد خطرا حقيقيا..أريد الحرية أريد الخير..أريد الخطيئة"" !‏ إنه عالم ينشد سعادة آلية ‏ همست بها أزار إلكترونية في أذنيه منذ مولده فبات لا يعلم عن شيء سواها لا فن لا دين لا أدب لا حب لا أسرة وأيضا لا حزن لا ألم لا معاناة لا فقر هذه أشياء لا يفهم لها معنى ::::::::::::::: وعلى الجانب الآخر هناك مجتمع الهمج المنبوذ الذي يتكاثر بطريقة ‏طبيعية ويعرف عن معنى الله والأسرة والحب والخوف والذي منه يطل أمل يائس فلربما تتغير الأوضاع يوما أو تحدث ثورة من نوع ما على الأقل هذا ما يدور في ذهنك أثناء القراءة ولكن أملك يخيب مع نظرة هكسلي اليائسة وتنتهي الرواية بنهاية أكثر بؤسا من أحداث الرواية ::::::::::::::: ‏ فالمدينة الفاضلة الخالية من الروح المغرقة في المادة لا تزال هنا مبتسمة في سخرية وهي ترمق جثة جون المشنوقة والشعب لا يزال يبتسم فحبوب السعادة تكفي لإلهائهم عن الحقيقة إنه شعب لا يحتاج قوة ليُحكم ‏ لقد تم تكييفهم منذ البداية على الاستسلام‏ ولكن الباب لم يغلق بعد علك تريد الهروب من هذه الآلة الكبرى علك تريد العودة إلى كل ما هو حار وحقيقي ومؤل علّك .. وإن كان الثمن موتك ‏ ‏------------------‏ على الهامش ‏#1‏ ‏=يستمد المؤلف عنوانه من أبيات شكسبير في العاصفة How many goodly creatures are there here How beauteous mankind is! O brave new world That has such people in 't! ‏#2‏ في عام 1958 كتب هكسلي كتابه Brave New World Revisited ‎ مبديا فيه في عدة مقالات أراؤه التي أودعها الرواية السابقة إن أحب أحدكم المزيد من الإطلاع ‏#3‏‎ ‏ المرة الأولى التي قرأتُ فيها الرواية كنت في نحو السادسة عشر كان كتيب مختصر ضمن سلسلة مكتبة الأسرة للناشئين تحت عنوان عالم رائع جديد وهي مترجمة أيضا بعنوان العالم الطريف –دار المدى كاملة دون اختصار ‏ ولكني لم أقرؤها ولا أعرف هل ترجمتها طيبة ام لا",4.0,positive,Brave New World,31124837
"As a teenager I went through a period of reading a vast number of distopian novels - probably all the teenage angst. This is the one that has continued to haunt me however, long after the my youthful cynicism has died it's death. It's basically a book about the utopian ideal - everyone's happy, everyone has what they want and EVERYTHING is based on logical principles. However, there is something very rotten at the heart. It's about how what we want isn't always what we should get. It looks at how state sponsered ""happiness"" can entirely miss the point. Perhaps, most importantly, it makes the case for individual freedom rather than authoritarian diktat. It should be read hand in hand with Mill's Utilitarianism to get a good idea of the philosophy that inspired it. Incidentally, I gave this book to my boyfriend as a present for his 18th birthday ( a rather depressing gift I know). At the time he wasn't particularly freaked out by it and said that it didn't hold the same level of dread as say, 1984 or ""The Handmaid's Tale"". As he's got older however, he's found the idea more and more frightening. Six years later it has more of a sting in the tail for him. I don't know why this should be but I'll hazard a guess that as you get older you're idea of ""happiness"" becomes perhaps more complex, making the ideal of ""Brave New World"" even more disturbing.",5.0,positive,Brave New World,31124837
"Libros así valen la pena leerlos mil veces. La mejor distopía de todas. ¡Magnífico libro, ha sido una gran sorpresa! Personalmente, pienso que Un mundo feliz es un libro que supera en todos los aspectos posibles a cualquier distopía publicada hasta el día de hoy, incluyendo al famosísimo 1984 de George Orwell. Sí, decir este tipo de declaraciones puede tomarse como una gran imprudencia de mi parte, pero, después de analizar cada aspecto de este libro he llegado a esa conclusión y estoy completamente seguro de lo que digo. En Un mundo feliz, Aldoux Huxley, nos presenta un hipotético futuro en el que prácticamente todo lo que conocemos ha sido alterado de una forma muy radical. No hay religiones, familias, nacimientos, emociones, amor, silencio, soledad, se desconoce el pasado, la ciencia ha sido eliminada, el conocimiento ya no es importante, etc.; pero también es un mundo donde no existe el sufrimiento, ni la pobreza, ni el hambre, ni las guerras, y en el cual las personas tienen mejor salud —incluso viven muchos años más—, no le temen a la muerte, etc. Esas características convierten este libro en una distopía y utopía a la vez, por lo que por momentos sentiremos que es un futuro horrible el que nos presenta Aldoux, pero también observaremos que vivir en un mundo en el que no existe la miseria tampoco es tan malo como parece. Por lo tanto, la premisa que nos ofrece el autor es muy interesante porque nos hace preguntarnos: ¿Preferirías vivir en un mundo con ciencia y conocimiento pero atiborrado de guerras, muerte y tragedia, o preferirías vivir en un mundo pacífico y estable, pero totalitario y lleno de ignorancia? Como pueden notar, elegir cualquier opción nos brindaría muy buenos privilegios pero asimismo grandes desventajas. Y no, no se puede erradicar todo lo negativo de un futuro porque se necesita un equilibrio, por lo que por ejemplo para que existan los milagros se necesita que exista el sufrimiento, o la presencia de la ciencia llevaría irremediablemente a la desconfianza, miedo, guerras y autodestrucción: Es algo inevitable. En cuanto a los personajes, son seres que están completamente trastornados pero que viven plácidamente en esa época. Esto ocurre porque todos sus pensamientos y comportamientos son manipulados desde antes de ser creados, por lo que son como un estilo de «máquinas programadas» que fueron hechas para pensar y actuar de una manera específica: Son personajes muy bien diseñados a pesar de su excentricidad y anormalidad. Naturalmente no me encariñé con ninguno pero tampoco los aborrecí porque es comprensible su forma de vivir. Puede que para nosotros ese estilo de vida pueda ser contraproducente, pero cada generación de seres humanos ha crecido bajo un entorno, vocabulario, cultura, profesiones y sueños diferentes, por lo que es natural ese rechazo hacia un estilo de vida contrario al que llevamos. Es por esta razón por la que nuestros abuelos se quejan de nuestro mundo actual, pero a la vez subrayan las virtudes de la época en que nacieron, y de esa misma forma nosotros actuaremos en el futuro cuando tengamos más de cincuenta años. La humanidad nunca dejará de cambiar por lo que seguramente para cada generación Un mundo feliz será diferente. Los personajes de este libro viven en Un mundo feliz, los piratas vivieron felices en el mar, quienes creen en Dios viven felices orando, los reyes vivieron felices con sus comodidades y su poder, los campesinos no cambiarían el campo por nada del mundo, los guerreros sin una espada serían desdichados, etc. Por ello, el nombre del libro me parece súper correcto porque presenta justamente lo que anuncia: Un mundo feliz. Algo curioso de este libro es que la trama principal pasa a un segundo plano. Es tan atrapante conocer más y más detalles sobre el lugar donde viven los personajes, que en realidad el destino de ellos importa muy poco. El argumento es simple y predecible, y quizás podría ser el punto más bajo de esta nóvela, pero en una distopía/utopía eso es algo normal porque en este tipo de libros lo verdaderamente interesante es la visión futurista que nos presenta el autor. En este caso, esa visión futurista el autor la realiza de manera magistral, y lo mejor, es que el autor no escribe con odio. ¡Eso me encantó! Recuerdo que cuando leí 1984 el libro me pareció muy interesante, pero el autor escribió con tanto odio hacia la sociedad, que irremediablemente asocie esas similitudes con tantas protestas e inconformidad que se vive actualmente en la mayor parte del planeta; pero aquí, Aldoux presenta un libro sin una pizca de rencor u odio, a pesar de reconocer en el prólogo que está completamente en contra del totalitarismo. Y ya que menciono el prólogo, tengo que reconocer que esa parte del libro es excelente. En esa sección el autor realiza una gran explicación sobre la creación de su historia, errores, personajes, etc., pero contiene spoilers por lo que recomiendo que lo lean al finalizar el libro y no antes. La prosa también ha sido adecuada lo que permite que esta novela se lea rapidísimo; aunque, el inicio fue un poco lento y confuso debido a la terminología relacionada a los genes que personalmente me pareció muy difícil de asimilar: La genética no es mi especialidad. Aun así, Aldoux ha sabido jugar muy bien con el estilo de la obra y me ha gustado mucho la forma como lo ha hecho. Mi parte favorita de la prosa fue una sección donde se presentan tres conversaciones simultáneas y tan solo separándolas por párrafos, logra un efecto de adrenalina y un ritmo frenético que puede dar a entender que efectivamente si nos repiten excesivamente una información, puede que empecemos a usar esas ideas como si fueran nuestras, a pesar de que solo las han implantado en nuestra mente. Asimismo, la parte final ha sido espectacular porque nos da una cátedra sobre la sociedad impresionante. Prácticamente cada una de las frases usadas allí son dignas de destacar porque son muy profundas, sencillas de entender y pueden convertirse en una información muy importante para cada uno de los individuos de una sociedad, es decir, para todos nosotros. Entre esa información, se destaca la necesidad de que exista en una sociedad las clases sociales, ya que sin ellas lo único que ocurriría sería un caos total. Hay muchísimas frases para destacar, pero solo haré mención de dos porque descubrir esas frases hace parte del premio de quien se anima a leer esta obra: «Bueno, si usted quiere, puede llamarlo un experimento de reenvasado. Se inició en el año 73 d.F. Los Interventores limpiaron la isla de Chipre de todos sus habitantes anteriores y la colonizaron de nuevo con una hornada especialmente preparada de veintidós mil Alfas. Se les otorgó toda clase de utillaje agrícola e industrial y se les dejó que se las arreglaran por sí mismo. El resultado cumplió exactamente todas las previsiones teóricas. La tierra no fue trabajada como se debía; había huelgas en las fábricas, las leyes no se cumplían, las órdenes no se obedecían; las personas destinadas a trabajos inferiores intrigaban constantemente por conseguir altos empleos, y las que ocupaban estos cargos intrigaban a su vez para mantenerse en ellos a toda costa. Al cabo de seis años se enzarzaron en una auténtica guerra civil. Cuando ya habían muerto diecinueve mil de los veintidós mil habitantes, los supervivientes, unánimemente, pidieron a los Interventores Mundiales que volvieran a asumir el gobierno de la isla, cosa que éstos hicieron. Y así acabó la única sociedad de Alfas que ha existido en el mundo.» El párrafo anterior no hace referencia a conformarnos con la vida que nos tocó, sino hace referencia a que cada individuo en una sociedad es igual de importante, y todos seremos felices cuando encontremos nuestro verdadero lugar en ella. Los seres humanos somos sociables por naturaleza, y aunque nos duela aceptarlo, somos más felices cuando encontramos personas con quien hablar sobre nuestros gustos, sueños, etc. De la misma forma como una construcción necesita de buenas columnas, bases y muros estables, una sociedad necesita de todas las clases sociales para que exista un equilibrio, pero para que exista ese equilibrio se necesita que el pueblo se sienta satisfecho constantemente para que no afecte la estabilidad de la nación. No es bueno tener muchos líderes, pero tampoco es positivo no tenerlos. «Actualmente el mundo es estable. La gente es feliz; tiene lo que desea, y nunca desea lo que no puede obtener. Está a gusto; está a salvo; nunca está enferma; no teme a la muerte; ignora la pasión y la vejez; no hay padres ni madres que estorben; no hay esposas, ni hijos, ni amores excesivamente fuertes. Nuestros hombres están condicionados de modo que apenas pueden obrar de otro modo que como deben obrar. Y si algo marcha mal, siempre queda el soma. El soma que usted arroja por la ventana en nombre de la libertad.» Al iniciar el libro creí que sería una obra recomendada para que los adictos a las drogas dejaran de consumir esas porquerías, pero después de avanzar entendí que sería malísimo que una persona adicta leyera este libro porque justamente se sentiría orgulloso de su proceder. Por lo tanto, si tienen un familiar o amigo que en este momento tiene problemas de ese tipo, por nada del mundo les mencionen este libro porque podrían terminar de corromperse. En resumen, un libro corto pero muy profundo e interesante sobre el comportamiento humano, la sociedad, las clases sociales y la religión, que seguramente no olvidarán nunca y querrán repetir varias veces porque sinceramente es una obra maestra en todo el sentido de la palabra. Es una novela que me ha encantado en todo momento, la volveré a leer en el futuro, quiero seguir analizándola, e incluso siento el deseo de realizar un podcast sobre este libro —a pesar de que nunca he hecho uno— para seguir profundizando y hablando sobre esta obra, que me ha parecido bastante, pero bastante interesante. Libro súper recomendado, excepto si tienes una adicción y quieres superarla, en ese caso, léelo en otro momento.",5.0,positive,Brave New World,31124837
آیا دنیای ما بیشتر شبیه 1984 جورج اورول است، یا دنیای قشنگ نوی آلدوس هاکسلی؟ اورول از آدم هایی می ترسید که کتاب ها را ممنوع می کنند. اما هاکسلی از این می ترسید که دلیلی برای ممنوع کردن کتاب وجود نداشته باشد، چون اصلاً کسی خودش نخواهد که بخواند. اورول از کسانی می ترسید که ما را از دسترسی به اطلاعات محروم کنند. اما هاکسلی از این می ترسید که کسانی آن قدر ما را غرق در اطلاعات کنند که ذهن ما مصرف کنندۀ غیرفعّال اطلاعات شود، یا تبدیل به آدم های سطحی خودشیفته شویم. اورول از این می ترسید که حقیقت از ما پنهان شود. هاکسلی هراس داشت که حقیقت در انبوهی از اخبار بی اهمیت دیگر پنهان شود. اورول می ترسید که ملت ها اسیر و دربند شوند. اما هاکسلی از مبتذل شدن و کم مایه شدن فرهنگ ها می ترسید، از این که عواطف انسانی خود را از دست بدهیم و کم ارزش ترین محتواهای فرهنگی را مصرف کنیم. در 1984 مردم با زور کنترل می شدند. در دنیای قشنگ نو مردم با ترفندِ دادنِ لذت های خوشایند سطحی کنترل می شدند. اورول هراس داشت که چیزهایی که از آن ها متنفر هستیم نابودمان کنند. هاکسلی می ترسید که چیزهایی که دوستشان داریم باعث تباهی ما شوند. عکس بد باز می شد، ناچار لینکش رو گذاشتم! متن ریویو مال من نیست و مال اون عکسه و عکس از من نیست. فکر کنم از کانال صدانت، یا کانال مشابه دیگه گرفتمش. یادم نیست حقیقتش!,3.0,neutral,Brave New World,31124837
"Brave New World is a classic written to make its readers uncomfortable. It accomplishes its point well. Still, it is only getting 3 stars from me, as I rate books based on my personal level of enjoyment rather than literary value. The characters of this book were not meant to be likeable - I am fine with that concept. The first few chapters made me want to curl up in the corner and cry - that's how repulsive the design of this universe was (mission accomplished, Mr. Huxley). But as we plunge into the depths of the neverending moral message of the story (basically the entire last third of the book), I felt my patience stretching thin . I get the message, no need to beat me over the head with it . I did chuckle at the ridiculous consumerism of this world (inspired by America of the turn of the century) in which, unexpectedly, most characters have distinct socialist names - Lenina, Trotsky, Marx, Bernard (as in G.B.Shaw). I just think it's funny how both of the enemies of Huxley's ideal world - the competing ideologies of socialism and rampant consumerism - were dealt with in one blow. Good try - but come on ! I liked the description of the effects of soma drug on the mind. No wonder, as this was written by the author of about mescaline effects on the mind - an interesting read, by the way. Of the classic trio of dystopian books (this one, Orwell's Nineteen Eighty-Four and Zamyatin's We ) this one is my least favorite ( We is the best, in my opinion, and may have actually inspired this one). Brave New World succeeds at portraying dystopia at its worst and making the reader think, but stilted language and moral heavy-handedness take away from the enjoyment. Yet it's a classic, and should be read, even if not for fun. 3 stars.",3.0,neutral,Brave New World,31124837
"DNF @ 50% I know, I know. I'm a peabrain pleb and this is truly a classic and how dare I? I understand what it's trying to do. I understand the over-enthusiasm for science and the depersonalization. I understand how showing a thriving world devoid of relationships and emotions feels counterintuitive and wrong. ( 'That's the point!' I understand that's the part that's supposed to 'make you think!' ) I understand how the conditioning and predestination of this ""utopia"" sacrifices individuality for compliance and just whoaaaa I even understand that the frickin orgies and the special drug (""Soma"") are representative of the way the people shed their own identities and continue to live a unified existence. I understand how ground-breaking this was. I understand it raises all sorts of questions and opens discussions about free will, societal control, the role of government and what humanity is. But it's not for me. This is incredibly dense as the entire first half has been dedicated to showing the science and structure of this 'brave new world.' There's not really a plot and there's not really even characters? (I mean kinda? ) It all feels dedicated to driving the same few points home. I understand. But I'm bored. And I'm tired of the shock-factor of orgies and children engaging in ""erotic play"" (This really could have been a short-story and it would have accomplished the same things)",1.0,negative,Brave New World,31124837
