review,rating,sentiment,book_title,book_id
"”It is our choices, Harry, that show what we truly are, far more than our abilities.” And here I go with another one of my short “My thoughts about this book” reviews. I can’t believe that I forgot so many things. Like for instance the fact that Dumbledore actually was a Transfiguration teacher before he became headmaster. Kinda suitable that this is McGonagall’s role now. ;-) 1.) ”Harry Potter asks if he can help Dobby … Dobby has heard of your greatness, sir, but of your goodness, Dobby never knew…” Aww Dobby! It was so good to see him again! He’s really one of the best HP characters ever and this even though he made it kind of tough to like him. *lol* Well, at least at the beginning. Poor Harry! XD 2.) ”Your sons flew that car to Harry’s house and back last night!” shouted Mrs Weasley. “What have you got to say about that, eh?” “Did you really?” said Mr Weasley eagerly. “Did it go all right? I-I mean,” he faltered, as sparks flew from Mrs Weasley’s eyes, “that-that was very wrong, boys – very wrong indeed …” I’ll always love how Mr Weasley is more interested in finding out if the car flew well than in his kids actually flying the car! *lol* Also Molly Weasley giving him hell for not reacting the way a responsible parent is supposed to is just epic! Haha! Those two. You can see they have a great marriage! ;-P 3.) ”Mr Weasley had a cut lip and Mr Malfoy had been hit in the eye by an Encyclopedia of Toadstools.” How could I forget that Mr Weasley threw himself at Malfoy? One of the best things in this book ever! Not that I support violence (I’m a pacifist) but even I can’t help appreciating that Lucius Malfoy for once, actually had his ass handed to him. XD 4.) ”That vanishing cabinet was extremely valuable!” he was saying gleefully to Mrs Norris. “We’ll have Peeves out this time, my sweet.” How come I never noticed this before?! The foreboding!!! OMG! Like damn, there are so many things that are mentioned only briefly and rather casually and then when you continue to read the series they reappear with a vengeance! O_o With every book I read I’m more and more awed by J.K Rowling’s genius! 5.) ”Homework: compose a poem about my defeat of the Wagga Wagga werewolf! Signed copies of Magical Me to the author of the best one!” Gilderoy Lockhart is so full of himself! I swear he must have been the worst DADA teacher they ever had. And they had many over the years which even Dumbledore can’t deny. Loved that bit at the ending when he said he’d have to write an ad because they “seem to run through them”. *lol* 6.) ”You are Muggle-born?” “Half-blood, sir,” said Riddle. “Muggle father, witch mother.” There definitely was a history lesson hidden in there. It’s fascinating how Riddle of all people could be a half-blood and then go against Muggle born wizards! I’m sure J.K. Rowling thought about World War II when she wrote this, because all the pure-blood and half-blood etc. stuff reminds me of a very dark chapter in German history… >_< 7.) ”But why’s she got to go to the library?” “Because that’s what Hermione does,” said Ron, shrugging. “When in doubt, go to the library.” Did anyone notice how well Ron knows Hermione? And how often he defended her in this book? I mean he actually would have fought Malfoy with his bare hands if Harry and Dean would have allowed it! It’s so obvious that Ron cares about her deeply! To vomit snails without complaining about it should count as the ultimate indication of eternal love and affection! *LOL* 8.) ”Of course,” she said, and Harry, amazed, saw a tear glistening in her beady eye. McGonagall losing it was another great moment in this book! When you least expect it she always shows some kindness and heart and to be honest this never ceases to amaze me! XD She’s a great teacher and I’m not surprised that she always takes over when Dumbledore isn’t around. 9.) ”You’re in luck,” said Harry, forcing Lockhart to his feet at wandpoint. “We think we know where it is. And what’s inside it. Let’s go.” I just love Harry, okay?! *lol* For such a young kid he certainly has a lot of guts and courage! The way he dealt with Lockhart? I think not even an adult wizard could have done it any better. XD The sheer audacity to demand aid from him like that. YES! Haha! <3 10.) ”Voldemort put a bit of himself in me?” Harry said, thunderstruck.” I CAN’T BELIEVE ROWLING ALREADY MENTIONED THIS IN BOOK TWO!!! I mean Harry quite literally said that Voldemort put a bit of himself in him!!! A part of his soul!!! It’s so obvious that Harry is a Horcrux!!! GAH!!! It’s all there and I never saw it!!! That’s just brilliant! Dumbledore must have known all along! I really need to reread the entire series because I can’t remember if he already knew it right from the beginning or if it was just a theory at first. I can’t wait to read “The Prisoner of Azkaban” ! I’m afraid it might have to wait until next year though! So many books, so little time! ;-) ______________________________ As always I loved this! <3 And boy there were so many hints! The foreboding is real in this one! *lol* Also I kinda like that every book ends with the school year and that there’s no cliff-hanger! I never thought about this but HP is so successful and this even though there are never cliff-hangers. XD (Well, at least not in the strict sense...) Must be magic! ;-P ______________________________ I’m already reading 6 books, BUT this is Harry Potter and it’s autumn close to Halloween and I just need another comfort read? *lol* Plus 2 of my six books will be finished soon so this means that I’ll be down to 5 again which is my usual amount. XD Look at me being all reasonable and responsible. Haha! ;-P But honestly, do I even need a reason to read Harry Potter? No, HP can be read anytime! =))",5.0,positive,"Harry Potter and the Chamber of Secrets (Harry Potter, #2)",15881
"ENGLISH ( ) / ITALIANO Bedtime reading for my daughter (and second reading for me). It is once again exciting to wander across the Hogwarts halls, observing the mysterious facts that involve the protagonists, just like we were there too. This is Rowling's rare gift: making sure that we see through the eyes of Harry, Ron and Hermione. The summer holidays have passed, and the new school year is about to start at Hogwarts School of Witchcraft and Wizardry. Harry's power is still immature, but Dumbledore's teaching is adamant: «It is our choices, Harry, that show what we truly are, far more than our abilities» This time, our young wizards are struggling with the new professor of defense against the dark arts, the dork and vein Gilderoy Lockhart, called to replace Professor Quirrell (died in the previous adventure). However, the joyful atmosphere is soon ruined: strange events begin to happen... Far be it from me to spoiler something of this mystery-fantasy. gives us another masterpiece to live, rather than to read. Actually, I do not know if my daughter was more pleased than me to hear this novel, or if I was happier than her to read it and literally interpret it (I even modulated the voices of the different characters). Any excuse to read Harry Potter. Vote: 9 Lettura serale per mia figlia (e seconda rilettura per me). E' ancora una volta emozionante vagare per le sale di Hogwarts e osservare i fatti misteriosi che coinvolgono i protagonisti, proprio come se fossimo lì anche noi. Questo è il raro dono della Rowling. Fare in modo che vediamo con gli occhi di Harry, Ron ed Hermione. Trascorse le vacanze estive, alla scuola di magia e stregoneria di Hogwarts sta per iniziare il nuovo anno. Il potere di Harry è ancora immaturo, ma l'insegnamento di Silente è categorico: «Sono le scelte che facciamo, Harry, che dimostrano quel che siamo veramente, molto più delle nostre capacità» Stavolta, i nostri giovani maghi sono alle prese con il nuovo insegnante di difesa dalle arti oscure, il Professor Gilderoy Lockhart, tanto imbranato quanto vanitoso, chiamato a sostituire il Professor Quirrell, deceduto nella precedente avventura. L'atmosfera gioiosa è presto rovinata, però: strani eventi cominciano ad accadere, associati ad una certa camera dei segreti... Lungi da me spoilerare qualcosa di questo fantasy del mistero. ci regala un'altro capolavoro da vivere, più che da leggere. A conti fatti, non so se sia stata più contenta mia figlia di sentirselo raccontare, o se sia stato più contento io di leggerlo e letteralmente interpretarlo (ho perfino modulato le voci dei diversi personaggi). La scusa è buona, in ogni caso. Voto: 9",5.0,positive,"Harry Potter and the Chamber of Secrets (Harry Potter, #2)",15881
"I sat down to ""read a few pages"" of this before bed two nights ago and had to force myself to stop at page 100...then picked it up and flew through the rest the next day. I really enjoyed this one (as did millions of others, obviously) and, with this installment, I am definitely seeing why this is such a beloved series. The magical wizarding world of Harry, his friends, and the folks at Hogwart's is just FUN to read about. I am in LOVE with Fawkes the phoenix and I adore Dumbledore...And now I am so worried something bad is going to happen to one of them over the course of the remaining books. And, yes, I know it's probably made you gasp in shock that - in addition to never having read the books before now - I have also never seen any of the movies...and I truly have no idea what happens throughout the remainder of the series. I guess it IS possible to blissfully ignore spoilers for over two decades...unless we are talking about Game of Thrones . Good luck making it a fucking day with all the assholes posting every single scene on Twitter. Not that I'm on Twitter... But I digress. So yeah, firstly, loved this book and looking forward to the next one. And secondly, now more of the art on the HP mug I got from OwlCrate a few months ago makes more sense and I totally love it more now, so there's that. Winning all around.",5.0,positive,"Harry Potter and the Chamber of Secrets (Harry Potter, #2)",15881
4th read (April - June 2019): 5 stars Physical re-read 3rd read (May - June 2018): 5 stars Listened to the audiobook (Stephen Fry) and again it was amazing. amazing. amazing. Especially his narration of the howler from Molly Weasley. Priceless.,5.0,positive,"Harry Potter and the Chamber of Secrets (Harry Potter, #2)",15881
"Welcome to my re-read of the magical series “Harry Potter”. 🤓⚡️My journey this time around is a hybrid of reading the books, listening to a fun (adult) podcast and watching the movies. ❤️📚🎧🎬 ⚠️Spoiler Warning: stop reading now, if you’re unfamiliar with the world of Hogwarts.⚠️ Personal Opinion Note: I’m terribly sad for you, if you’ve never read the books (or at least watched the movies). 😉📚🎧🎬 I’ll be updating this review as I progress through the series, so, be prepared for a long review. 🤗 📚Chapter 1: The Worst Birthdays The Dursley’s have not changed. They’re still terrible muggles. Harry has not heard from anyone all summer. Uncle Vernon’s boss is coming to dinner and Harry’s been told to stay upstairs and not make a sound. 📚Chapter 2: Dobby’s Warning Dobby the house elf really makes a bad first impression. Dobby had been taking all of Harry’s letters all summer, in hopes that Harry wouldn’t want to go back to school. Dobby does a spell and Harry gets the blame, soon after a letter arrives from the ministry of magic giving Harry a warning. Uncle Vernon puts bars on his window and says he can’t go back to Hogwarts. 📚Chapter 3: The Burrow The Weasley’s really are the best! Them showing up in a flying car to rescue Harry is the best scene ever. Harry tells them about Dobby. Fred and George tell him house elves usually belong to rich wizard families. Harry believes Malfoy sent him. Ron is embarrassed by his home, but Harry thinks it’s brilliant. 📚Chapter 4: At Flourish and Blotts I love that Hagrid breaks up a fight between two grown wizards! Harry and the Weasley’s head to Diagon Alley to gather school supplies. Gilderoy Lockhart is signing books and announces that he’ll be the new defense against the dark arts teacher. Mr. Weasley gets into a rumble with Mr. Malfoy. 📚Chapter 5: The Whomping Willow That’s one mean tree!! Harry and Ron are unable to get through platform 9 3/4. So, they fly the car, along the train, to Hogwarts. But the crash the car into a very old and angry tree when they arrive. Ron breaks his wand. 🎧Podcast: Binge Mode: Chapters 1-5 ***Warning: podcast has adult content*** Ummm… did you read that warning? If you’re easily offended by things like: swears, wanking jokes, milf’s, etc. etc. do not listen to this podcast. To all my fellow heathens out there, this is not only entertaining- but also very spot on! 📚Chapter 6: Gilderoy Lockhart Oooooo…. Weasley got a Howler!! Needless to say, Mrs. Weasley was none-to-pleased with the car disappearing from the station. Lockhart takes his moment to brag more, but only proves he has no idea what he’s doing. Ron’s wand is malfunctioning. Harry’s got a fan in a first year named Colin. 📚Chapter 7: Mudbloods and Murmurs Poor Ron can’t catch a break with that wand. He tried to curse Malfoy for calling Hermione “mudblood” and it backfired, resulting in him puking slugs. Speaking of Malfoy, his father bought his way onto the Slytherin Quidditch team. Harry hears a chilling voice. 📚Chapter 8: The Deathday Party Harry is nice to everyone, even ghosts. Nearly Headless Nick invites Harry to his deathday party. He foregoes the Halloween feast, to attend. Rotten food, cold room, screeching music… not exactly a warm blooded good time. While leaving the party, Harry heard the voice again. This time he follows it to find a message scrolled on a wall, about the chamber of secrets. 📚Chapter 9: The Writing on the Wall Filch’s cat got frozen, aka petrified. Professor Binn’s explains the history of the chamber of secrets, which supposedly contains a Slytherin monster that would wipe out all non-pure-blood wizards. The trio speculate that Malfoy may be the heir of Slytherin. 📚Chapter 10: The Rogue Bludger Freaking Lockhart… such a dumb dumb!! First Quidditch game against Slytherin and a bludger is targeting Harry. He end up with a broken arm, which Lockhart tries to fish, resulting in the removal of Harry’s bones. As he sits in the hospital, Harry overhears the Colin was petrified as well. 🎧Podcast: Binge Mode: Chapters 6-10 ***Warning: podcast has adult content*** I love the why? why? why? We all think it and none of us know. It’s all very intriguing! Like Tom’s trophy still being displayed at Hogwarts… why?? Given who he is and what he’s done, you’d think that thing would be hidden or destroyed. 📚Chapter 11: The Dueling Club Polyjuice Potion in Moaning Myrtle’s bathroom. Hermione’s working on the potion. The whole school has heard about Colin. Lockhart starts dueling club, to keep everyone safe. Harry and Malfoy are matched up. Malfoy congers a snake and Harry speaks parseltongue in front of everyone. Another student and ghost are petrified. 📚Chapter 12: The Polyjuice Potion Harry’s called to Dumbledore’s office, where he meets Fawkes the pheonix. The trio takes the polyjuice potion, Harry/Ron become Crabbe/Goyle, pointlessly, as they discovered nothing. Hermione became a cat. 📚Chapter 13: The Very Secret Diary Harry and Ron find a diary with TM Riddle on it. Ron remembers the name from a trophy. Harry discovers the diary writes back and allows him inside memories. He sees why Hagrid was expelled. 📚Chapter 14: Cornelius Fudge Harry’s room was broken into and the diary stolen. Quidditch is cancelled and everyone is told the school is on lockdown. The Minister of Magic shows up to take Hagrid to Azkaban (wizard jail) and calls for Dumbledore to step down as head master. 🎧Podcast: Binge Mode: Chapters 11-14 ***Warning: podcast has adult content*** It’s really funny how they point out things, like Ginny being upset, so Fred and George scare her… Dumbledore asking Harry point blank if he has anything to tell him and he chooses not to. Truth. Hurts. 📚Chapter 15: Aragog Per Hagrid’s request, Harry and Ron follow spiders into the forest. They find Hagrid’s friend spider, Aragog, who is the size of a horse. The spider tells his family to eat them, but the old flying car rescued them in time. 📚Chapter 16: The Chamber of Secrets Ginny is still acting strange. The boys visit petrified Hermione, to find a note in her frozen hand, which identifies the monster as a type of snake. They run to tell, but overhear that Ginny was taken. They go into the pipes to find her. 📚Chapter 17: The Heir of Slytherin Harry find Ginny in the chamber, with a ghostly Tom Riddle nearby. Tom shares about Ginny and his diary and his identity… Voldemort. Dumbledore’s bird Fawkes appears, carrying the sorting hat. Harry uses a sword from the hat, to kill the snake, gets bit, uses the snake fang to destroy the diary, causing Tom to disappear. 📚Chapter 18: Dobby’s Reward Harry talks to Dumbledore about Voldemort. Mr. Malfoy shows up with Dobby on his heals. Harry confronts him about slipping Riddles diary to Ginny. He slips a sock into it and chucks it to Mr. Malfoy. He unknowingly freed Dobby. Lockhart and his wiped memory are no longer an issue. All the petrified get woken up. Gryffindor wins the house cup. 🎧Podcast: Binge Mode: Chapters 15-18 ***Warning: podcast has adult content*** They covered so much- but these last chapters covered a ton too! Main points: Why doesn’t Harry replace Ron’s wand for him? He has the money! But treats from the cart will have to do… lol…. Why does the school take so long to wake the petrified? Like those are the only Mandrakes in the world…. Dumbledore assures Harry he’s a true Gryffindor, because of his CHOICE to be in Gryffindor. 🎬Movie #2 I wish they had depicted the fist fight between Mr. Malfoy and Mr. Weasley in the movie. But alas, it was left out. But there was a lot still there, that I loved seeing come to life. Travel by floo powder…. the Mandrakes…. Harry going into the diary. I also love how Ron’s voice cracks all the time. It’s really great. 🎧Podcast: Binge Mode: Movie ***Warning: podcast has adult content*** Hedwig!! Poor Hedwig. She does need a bigger cage and boy, oh boy, she had a rough time. Sadly the movie does skip quite a bit. Our choices define us, not our blood- what a great message overall. Hogwarts!! The safest place in the world, lol, where Voldemort has attacked Harry, twice now. I love that they manage to sum up all the thoughts with humor. Checking Chamber of Secrets off my list. Thanks for following along on my journey. Now… onto book 3! ❤️📚",5.0,positive,"Harry Potter and the Chamber of Secrets (Harry Potter, #2)",15881
"Overall, I loved this, and I can't wait to start today. Quick thoughts on the things that stood out to me: Wow, the Dursleys were even more loathsome in this book than the first. I love the Weasleys even more than I already did. I am so glad my mother never sent me a Howler. I thought Dobby was annoying in the movie (which I saw when it came out over a decade ago, not having read the book) but I thought he was awesome in the book. In fact, we rewatched the movie last night, and not only was it as unsatisfying as I remember it, it's just a shit adaptation of this book. I thought it was delightful that the flying car went into the Forbidden Forest and went feral . Tom Riddle's diary was really, really awesome. The entire idea and execution were fantastic. I loved it when Dumbledore told Harry, ""It is our choices, Harry, that show what we truly are, far more than our abilities."" I hope that, as the series goes on, we have more scenes with him, because I really love his wisdom. My minor complaints seem a little nitpicky, and I suppose that if I'm going to suspend disbelief to accept that wizards are real, I should be able to accept that none of the adults at Hogwarts would look in Hermione's fist to see the paper that Harry and Ron found after she was Petrified and Fawkes somehow just found his way into the Chamber of Secrets , but I'm an adult and if I'd read this as a kid I wouldn't have cared for a single moment.",4.0,positive,"Harry Potter and the Chamber of Secrets (Harry Potter, #2)",15881
I read this all in one 8 hour sitting... I need a life,5.0,positive,"Harry Potter and the Chamber of Secrets (Harry Potter, #2)",15881
"4/5 ⊹₊⟡⋆ i kind of shot myself in the foot by taking 16 days to read this because I was in a littleeee bit of a slump, but overall it’s just enjoyable and fun. there’s no obvious faults or things that I had an issue with (except for my inability to follow the story but that might be a ME issue). reading this as an adult holds up 100%, and the reveals and plot twists are so good. the world is just so rich it’s a perfect fantasy series to get lost in. i don’t think i can quite give it 5 stars because i didn’t get that *5 star feeling* where it leaves such an imprint on you, but nevertheless i will be reading the next one 🤩 ₊˚⊹♡ reading log i took too long a break and now i’m paying the price 🥺 ₊˚⊹♡ pre-reading i am not taking breaks in between series anymore!! i need to keep that momentum going to be pulled into the world - i am loving this<3",4.0,positive,"Harry Potter and the Chamber of Secrets (Harry Potter, #2)",15881
"5 Golden Stars Complete! & thousands more this one is Beyond AMAZING! Delightful! Mysterious! & Cute! My favourite book in the middle grade-ish side (1, 2, 3) of HP. I enjoyed every moment of it, every time. every page has something new. & I'm always wondering why this beautiful, cute, exciting, mysterious, full of backstories & plot-twist book is so many people's least favourite one in the series, we have the history of Hogwarts (now, now, not ""Hogwarts, a History"", people) we have some other important backstory, Voldemort & his past we have Weasleys, & we have Dobby! it is the cutest & no one can tell me otherwise. tbh all of them are magical & wonderful! my heart beats for them. <3 - Second book, starting with a blow. Can I appreciate the beginning of the book, the first chapter, the title, how it is started, how it summarized the events of the last book & let us swim in this world once again. craving for magic. every HP book started with a Recap of the last book(s), probably the only series I saw to mentioned previous events. very unique & fun. for example: ""... Harry Potter wasn't a normal boy. As a matter of fact, he was as not normal as it is possible to be."" & how suddenly everything goes wrong! in this book, wizarding world expanded. more into this world. how a wizard family actually live; the amazing Weasleys. we meet new great characters we didn't know in the first book like Mr. Weasley. also more Fred & George & Mrs. Weasley.... full of intriguing Backstories, Mysteries, Histories, Riddles & plot twists! Mystery & Horror! many fun moments thanks to Ron. don't forget young Harry being sassy. how could everyone (characters I mean, idk about the fans, but I know I, myself, couldn't believe that) think of Harry like that!? being the one who attacked students? just because he is a parseltongue? he's not pureblood mania, like Malfoy. Dammit! his friend is a muggleborn. he is a good guy. tho I always enjoy to see my favourite characters under pressure, gives me the excitement. guilty pleasure. & I think I'm the only one who likes Lockhart (not much, but still), I mean he was annoying & everything a liar & actually a fraud , sure, but hilarious & stupid, he made the scenes funny because of his nonsense megalomaniac & of course Harry & Ron's expression toward him. oh one more thing, I love Tom too! I love villains in disguise & we didn't know until the end of the book that he was fooling us all! brave young Harry, saved the day. I'm proud of him. - World building: ★★★★★/5 Characters: ★★★★★/5 Written style: ★★★★★/5 / Fun: ★★★★★/5 / Feelz: ★★★★★/5 (Harry is so brave & caring for his friends & the others... *tears of Joy & pride*) plot: ★★★★★/5 General idea: ★★★★★/5",5.0,positive,"Harry Potter and the Chamber of Secrets (Harry Potter, #2)",15881
