review,rating,sentiment,book_title,book_id
"(A-) 83% | Very Good Notes: A clever conjuration, it's a cozy castle mystery, a creature-fest, and Ripper-esque: lit by monsters, ghosts, and history. *Check out progress updates for detailed commentary: Progress updates: - Preamble (1) Having finished ""Harry Potter and the Philosopher's Stone,"" I'm sticking with the Stephen Fry narration. Firstly, I'm awfully OCD about having everything match. Secondly, I can't abide by British characters speaking American English. (2) Unrelated, but that glitch where we can't post reviews is back! As such, I'll be grouchy until it's fixed. - 7% Notes: (1) “Jiggery pokery!” said Harry in a fierce voice. “Hocus pocus — squiggly wiggly —” “MUUUUUUM!” howled Dudley, “He’s doing you know what!” - I like that Harry scares Dudley with nonsense reduplication. It's more humiliating. (2) Harry gets his expulsion letter from the Ministry instantaneously. If only muggle bureaucracy worked so efficiently. - 12% (1) Fred re lock-picking: ""A lot of wizards think it's a waste of time, knowing this sort of Muggle trick."" - I wonder if ""muggle tricks"" are performed at parties? (2) Ron: ""[Dad] works in the most boring department... The Misuse of Muggle Artifacts Office."" - Boring? Using memory charms on muggles who've seen magic... sounds like ""Men in Black"". - 25% (1) ""Percy walked in. He was already dressed, his Hogwarts prefect badge pinned to his knitted tank top."" - ""Knitted tank top""? Are you hot or are you cold, Percy? Pick one. - On second thought, I suppose that's just British for sweater vest. (2) Arthur Weasley fist fights Lucius Malfoy, mirroring Ron's fist fight with Draco in the first book. - 29% (1) ""'Why,' demanded Ron, seizing [Hermione's] timetable, 'have you outlined all Lockhart’s lessons in little hearts?'"" - Either Ron doesn't understand girls at all, or he's jealous. (2) Rowling says a lot with names. Justin Finch-Fletchley has a double-barreled surname, and as such is a mannered aristocrat. Others have emphatically ethnic names. - 35% (1) Notably different from the film, Hermione doesn't know what ""mudblood"" means. Ron's actually the only one of the three who's offended by Malfoy’s slur. (2) My theory on the Ron-Hermione relationship is that Hermione's feelings for him began when he slugged himself defending her honor against Malfoy. Before that, she was all about Lockhart. - 39% (1) Ron: ""Why would anyone want to celebrate the day they died ... Sounds dead depressing to me."" - Ron with the puns and the common sense. (2) I think the ""Deathday"" chapter is intentionally depressing. It's all about people not getting what they want. Nick can't join the Headless Hunt, Filch can't do magic, HRH can't attend the Halloween feast. - 50% (1) Hermione's blind to Lockhart's incompetence. Ron's known all along. (2) Harry: ""D’you think I should have told them about that voice I heard?"" Ron: ""No ... Hearing voices no one else can hear isn’t a good sign, even in the wizarding world."" - Another prudent Ron line said by Hermione in the film. Film-Hermione's given book-Ron's common sense! - 53% (1) ""Dobby is used to death threats, sir. Dobby gets them five times a day at home."" - The empty death threats give him thicker skin, ironically. (2) ""Hidden from the teachers, a roaring trade in talismans, amulets and other protective devices was sweeping the school."" - Sort of like trading contraband in prison... wonder how they're smuggled in? - 58% (1) Nearly all of Ron's explanation to Harry about parselmouths is once again given to Hermione in the film. (2) Another fun name introduced here is ""Millicent Bulstrode,"" who is described very much like the striding bull her name evokes. (3) Harry's gone and become Hufflepuff enemy number one. Bad move ... badgers are deceptively vicious. - 65% (1) Nice of Harry and Ron to return Crabbe and Goyle's shoes when they're done. (2) Malfoy insults Hermione, Ron wants to punch Malfoy. It's a law of nature. (3) Myrtle to Hermione: ""Wait till everyone finds out you’ve got a tail!"" - This line was given to Ron in the film, but changed to, ""Look at your tail!"" Which, to me, sounds fairly risqué. - 69% (1) Ron: ""If I’d sprouted whiskers, I’d take a break from work."" - Future Ron should shave often. (2) If Hagrid was expelled in third-year, and that was 50 years ago, then he'd be 63 years-old in the present, Tom Riddle would be 65, and Dumbledore around 150. I wonder if it's genetics or a side-effect of magic use that makes wizards live so long. - 74% (1) Harry: ""But why’s she got to go to the library?"" Ron: ""Because that’s what Hermione does ... When in doubt, go to the library."" (2) ""[Harry] chose the same new subjects as Ron, feeling that if he was rubbish at them, at least he’d have someone friendly to help him."" - And with Hermione taking everything, it guarantees they're always together. - 77% (1) Fudge sort of treats Dumbledore like a nuclear weapon: better engaged at Hogwarts than loose in the world. (2) Malfoy calls Hermione a mudblood: 'Let me at him,' Ron growled, as Harry and Dean hung onto his arms. 'I don’t care, I don’t need my wand, I’m going to kill him with my bare hands!' - Fist fights seem an aptly muggle reflex response. - 81% (1) ""The creature that was lurking somewhere in the castle, [Harry] thought, sounded like a sort of monster Voldemort – even other monsters didn’t want to name it."" - Wonder if its name's just ""basilisk,"" or if it has a personal name? (2) The enchanted car reminds me of Nymeria from ""A Song of Ice and Fire"". A domestic, set free, and turned wild. - 85% (1) Percy: ""Ginny, er, walked in on me the other day when I was – well, never mind – the point is, she spotted me doing something and I, um, I asked her not to mention it to anybody."" - Percy should lock his door... (2) I love how, despite personal differences, the teachers all encourage Lockhart to go monster hunting, to get him out of the way. - 90% (1) Myrtle: ""'I was floating away ...' She looked dreamily at Harry. 'And then I came back again. I was determined to haunt Olive Hornby, you see. Oh, she was sorry she’d ever laughed at my glasses.'"" - That's just short-term thinking. (2) Hermione's incapacitated, Ron stays behind. It was the reversed in the last book. They mirror each other. - 97% ""The Chamber of Secrets,"" as a title, always felt like a misnomer. There's nothing really secret in there. Salazar Slytherin told everyone what it was built for, what he housed in there, how to open it, and what happens if it's opened. The only thing secret about it is its location, in which case it should be called ""The Secret Chamber.""",4.0,positive,"Harry Potter and the Chamber of Secrets (Harry Potter, #2)",15881
"“It is our choices, Harry, that show what we truly are, far more than our abilities.” CHILLS. (REREAD) Okay DUH 5/5 stars. I actually liked this book more than I remembered! This used to be my least favorite of the Harry Potter books and, while that still might be true, I was more entertained than I expected! I always forget how different Book Ginny is from Movie Ginny (way better all around) and how she has such a bigger role in the books than the films. NOW ONTO HP AND THE PRISONER OF AZKABAN!",5.0,positive,"Harry Potter and the Chamber of Secrets (Harry Potter, #2)",15881
"JK Rowling really knows how to write a great book, thats for sure! Although this wasn't my favorite book in the series, it definitely wasn't because it was bad. I loved the plot and conflict, even though it wasn't as intense as the others were. I was definitely shocked at the end...so epic and mind blowing!",5.0,positive,"Harry Potter and the Chamber of Secrets (Harry Potter, #2)",15881
"(A-) 83% | Very Good Notes: A bit bland at times, with less wonder and discovery than before, but finishes well with a more satisfying conclusion.",4.0,positive,"Harry Potter and the Chamber of Secrets (Harry Potter, #2)",15881
"Continuing my reread with the illustrated editions! Gotta get through this one so that my daughter can start it next. <3 ********************* ""It is our choices, Harry, that show what we truly are, far more than our abilities."" What can I say that hasn't been said before about this series? What words can do this book justice? I've felt at a loss on how to explain my feelings for these books as I've read them. I didn't experience them as a child and therefore my experience is clearly different than most others on here, but in some ways I think it's just as magical to read these for the first time as an adult as it was for everyone who devoured these as they were published in their childhood. I have kids, so I was constantly wondering how my 5 year old will accept these books when she's a bit older and tried to view the story through her eyes. The holidays are always a busy, stressful time for us. All of our family is a hefty distance to travel to and, on top of that, we're moving into our new place this month. All I could think about was how desperately I wanted to escape all of my adult responsibilities for just a bit each day, and this was the perfect book to do so with. No matter your age, the magical world of Hogwarts is truly spectacular; the characters are such that they stay with you even after the final page is turned and the writing takes you back to a place you weren't sure existed for us old farts anymore. If you have been hiding under a rock for the past 20 years like I have, I highly encourage you pick these books up and get swept away like I did. Time is a precious commodity these days, and you couldn't spend it in a better way than with these precious kiddos.",5.0,positive,"Harry Potter and the Chamber of Secrets (Harry Potter, #2)",15881
"I love this book, of course I do, but the fact remains that this book prominently featured two of my most hated Harry Potter characters. Ginny Weasley and Dobby. There, I said it. I hate them both. In my Harry Potter hate list, Ginny and Dobby probably rank somewhere below Umbridge and Peter Pettigrew. Yeah, you heard me. I hate them that much. The reason I hate Ginny is---well, never mind. I don't want to start another shipping war here, the last one was terrible enough, so let the reason for my hatred be implicit and unsaid. Dobby is freaking annoying, yo. All his eagerness and shit - and yeah, I know what happens in the end. Doesn't matter. I still hate Dobby. Dobby is the equivalent of fingernails on chalkboard for me. If he had been my elf, I'd have given him a sock already so he could his whimpering, sniveling ass out of my life. He means well, I know he does, it's just that he's such a frustratingly well-meaning bumbling idiot. “You know what, Harry? If he doesn’t stop trying to save your life he’s going to kill you.” Aaaaaaaand one final note. “Ginny!” said Mr. Weasley, flabbergasted. “Haven’t I taught you anything. What have I always told you? Never trust anything that can think for itself if you can’t see where it keeps its brain?"" No particular reason I included that, except for the fact that it reminded me of my ex-boyfriend :3",5.0,positive,"Harry Potter and the Chamber of Secrets (Harry Potter, #2)",15881
"The Harry Potter Saga continues when The Chamber of Secrets is opened at Hogwarts, landing some of Harry’s classmates in danger. Will Harry Potter be able to save the day? The reading of the Harry Potter series has been quite interesting because I really liked the first movie but didn’t really care for the rest. It becomes too dark, but what does that mean exactly? So it has been an exciting process to document exactly how my feelings for the Harry Potter series evolved since the first book. In the beginning of the book, Harry is whining and doing nothing to improve his situation. He is complaining about not hearing from his friends, complaining about the Dursleys, complaining about no magic, complaining about no quidditch. Instead of cross training for quidditch, he just complains. If I wanted to hear complaints, I wouldn’t need to pick up a book. Also, I feel that some of the extraordinariness was missing from the second book. One of the scenes that I loved in the first book was when Harry was receiving all his letters to attend Hogwarts, but this book didn’t have that. There was some animal cruelty in this book involving a firecracker, and I thought that Harry was incredibly impatient with Colin Creevey, the little boy who was asking questions. Harry, wasn’t that you just last year? There were some portions of the book that I did enjoy, and I am grateful that the author didn’t force us into another Hogwarts Express ride and another sorting ceremony. My favorite character (although a bit overused) was Professor Gilderoy Lockheart. I was laughing so much when I saw this note, “To Miss Granger, wishing you a speedy recovery, from your concerned teacher, Professor Gilderoy Lockheart, Order of Merlin, Third Class, Honorary Member of the Dark Force Defense League, and five-time winner of Witch Weekly Most-Charming-Smile Award.” His various titles took up most of the note! It reminds of people who have PhD’s who try to get you to call them Doctor. Big eyeroll. Yeah. I’ll get right on that. I also loved when Gilderoy said thanks for the 46 Valentine’s Day cards, very similar to when people send themselves flowers for Valentine’s (Remember Clueless?). The author also overly relied on fan favorites, heavily leveraging Hogwarts and the former cast of characters. I am more impressed with some other fantasy writers when they developed an entirely new set of characters and wove them into the storyline. This is a test for greatness from authors. Can they write a subsequent book without leaning so heavily on the fan favorites? In my opinion, JK Rowling didn’t meet that challenge. Overall, it is a decent fantasy book with a system that isn’t too hard to understand. It isn’t embarrassing, but it isn’t great. 2025 Reading Schedule Jan	A Town Like Alice Feb	Birdsong Mar	Captain Corelli's Mandolin - Louis De Berniere Apr	War and Peace May	The Woman in White Jun	Atonement Jul	The Shadow of the Wind Aug	Jude the Obscure Sep	Ulysses Oct	Vanity Fair Nov	A Fine Balance Dec	Germinal Connect With Me!",4.0,positive,"Harry Potter and the Chamber of Secrets (Harry Potter, #2)",15881
"This was a cute middle grade book. Even though it was slow, I liked it a little more than the first book since at this point the world has already been established and now we get to see more of the characters and the setting. Ron and his family, especially the twins, are endearing. I also thought it was interesting seeing Harry’s internal struggle with whether he was truly Gryffindor or Slytherin, and the payoff later on about how it is our choices that show what we truly are. I didn’t like how the mystery was conveniently solved, the monologue of explanation from the villain at the end, and how Hermione was literally petrified throughout most of the book just so that she wouldn’t have figured everything out right away. But I’m glad to finally be done with this book so that, just like Dobby, I am free.",3.0,neutral,"Harry Potter and the Chamber of Secrets (Harry Potter, #2)",15881
"""My late lamented lords, ladies, and gentlemen,"" ""The best of us must sometimes eat our words,"" Every time you loved the first book of a series, and then start reading the second - eagerly waiting for the story to continue - there's always the apprehension, that things might not be as great as the first. Well, Chamber of Secrets will convince you otherwise: everything keeps getting better. ""Have you ever heard of a plan where so many things could go wrong?"" I was glad to find everything I loved about the first book still applicable to the second. It'll be a bit redundant if all those plus points were to be repeated here, but still, I cannot refrain from mentioning how easy it is to read the story. In no way I'm implying that the narration is plain or just too simple - for it is definitely not the case - but it is just one smooth flow. The story itself is much more detailed than the first one, mainly because setting up of environment and characters were done in the original. Though I didn't feel so before, in retrospect, the first book now feels like an introduction to the series, and this as the first real adventure. ""It is our choices, Harry, that show what we truly are, far more than our abilities."" And again, it's impossible not to start reading the next one immediately. ""Regrowing bones is a nasty business.""",5.0,positive,"Harry Potter and the Chamber of Secrets (Harry Potter, #2)",15881
2022: 5/5 2021: To była kiedyś moja ukochana część… w sumie wciąż ją uwielbiam!,5.0,positive,"Harry Potter and the Chamber of Secrets (Harry Potter, #2)",15881
"Re-read audio 2017 ♥ Okay, I'm going to do a little *spoilery* in this review so those of you that haven't read the book then you might just want to look at the pictures. I have picked a ton of pictures from the book but believe me, there are plenty more beautiful ones in the book. Plus, if your a Harry Potter fan you will be getting the book anyway if you haven't already! So poor Harry is stuck back with the Dursley's on Privet Drive. And even though Harry is a relative, they still treat him like poo because he's magical. Ewwwwww. Harry is depressed because he has be cut off from talking to his friends or getting any kind of correspondence. Even poor Hedwig has been locked in her cage and hasn't been able to fly around. CRUEL! But Harry can't use magic inside the muggle world. Then Harry meets Doby - the little house-elf that is waiting for him in his room. It turns out that Doby has been intercepting his correspondence because he fears for Harry's life and doesn't want him to return to Hogwarts. So Doby causes some problems at the house that get Harry in trouble. I had to add this cute little picture of Doby running off, look at his little butt. lol ↓ Then one night, Ron, George and Fred pull up outside Harry's window in their dads flying car to save Harry. It's pretty funny how they get it all going but that is okay as long as Harry gets away from his evil relatives. Of course, Mrs. Weasley is not pleased when they get back home. The sneaking out part didn't work very well, but she welcomed Harry with open arms and he stayed with them until it was time for them all to go back to school. I love that picture of the Weasley house =) Life at The Burrow was as different as possible from life in Privet Drive. The Dursleys liked everything neat and ordered; the Weasleys' house burst with the strange and unexpected. Harry got a shock the first time he looked in the mirror over the kitchen mantlepiece and it shouted, 'Tuck your shirt in, scruffy!' The ghoul in the attic howled and dropped pipes whenever he felt things were getting too quiet, and small explosions from Fred and George's bedroom were considered perfectly normal. What Harry found most unusual about life at Ron's, however, wasn't the talking mirror or the clanking ghoul: it was the fact that everybody there seemed to like him Poor sweet Harry and I would love to live with the Weasleys' for a bit =) Look at cute, fat little Scabbers ↓ The kids are going to meet Hermione to get some shopping done. But ole Harry takes a wrong turn down the chimney hole and ends up in some creepy shop. He hides and gets to hear some things Malfoy and his father are talking about. Finally Harry makes it out of the store and Hagrid finds him and gets him to the right place with his friends. Then Ron and Harry are blocked from getting on the train soooooo back to stealing the flying car. AND of course they get into trouble when they get to Hogwarts but it wasn't anything too bad. Snape looked as though Christmas had been cancelled. He cleared his throat and said. 'Professor Dumbledore, these boys have flouted the Decree for the Restriction of Underage Wizardry, caused serious damage to an old and valuable tree . . . surely acts of this nature . . . 'It will be for Professor McGonagall to decide on these boys' punishments, Severus,' said Dumbledore calmly. 'They are in her house and are therefore her responsibility.' He turned to Professor McGonagall. 'I must go back to the feast, Minerva, I've got to give out a few notices. Come, Severus, there's a delicious-looking custard tart I want to sample.' There is a new Defence Against the Dark Arts professor named Gideroy Lockhart. He's a bit off but still . . . Anyway things are not right at Hogwarts. (are they ever?) And Harry and the gang must figure out what's going on. Poor ole Hagrid gets sent off to Azkaban for something he didn't do! Malfoy is a jerk, as if we didn't know that. lol Harry and Ron go out in the woods to meet Aragog the spider that is friends of Hagrid to find out some truth behind some stuff. Comes to find out there is this diary of a person named Tom Riddle. I'm not telling you who this person really is but they are the one causing all kinds of trouble for a lot of people. In the end Harry has to end up fighting a Basilisk to set things right. He has the help of the sorting hat for reasons, Dumbledore's Phoenix and a sword. Oh happy day! There is loads more to the book then the things I have described but you can just read it and if you haven't, why haven't you? Harry Potter rocks and always will. There is another happy ending for sweet Doby! ♥ Harry gives Dobby his stinky sock so this releases Doby. He now has his freedom from the evil Lucius Malfoy! Woot! 'Come, Dobby, I said, Come!' But Dobby didn't move. He was holding up Harry's disgusting, slimy sock, and looking at it as though it were a priceless treasure. 'Master has given Dobby a sock,' said the elf in wonderment. 'Master gave it to Dobby.' 'What's that?' spat Mr. Malfoy. 'What did you say?' 'Dobby has got a sock,' said Dobby in disbelief. 'Master threw it, and Dobby caught it, and Dobby-Dobby is free.' Lucius Malfoy stood frozen, staring at the elf. Then he lunged for Harry. 'You've lost me my servant, boy!' But Dobby shouted, 'You shall not harm Harry Potter!' There was a loud bang, and Mr. Malfoy was thrown backwards. He crashed down the stairs, three at a time, landing in a crumbled heap on the landing below. He got up, his face livid, and pulled out his wand, but Dobby raised a long threatening finger. 'You shall go now,' he said fiercely, pointing down at Mr. Malfoy. 'You shall not touch Harry Potter. You shall go now.' Lucius Malfoy had no choice. With a last, incensed stare at the pair of them, he swung his cloak around him ad hurried out of sight. This book is wonderful, it always has been and always will, and the graphics in this book make it even better. ♥ MY BLOG:",5.0,positive,"Harry Potter and the Chamber of Secrets (Harry Potter, #2)",15881
