review,rating,sentiment,book_title,book_id
"4.5 stars Tamlin is going to set your loins aflame. Phew! My cheeks are still flushed. I'm also fairly confident this book is going to help change the face of new adult fiction. How awesome to see gifted writers shaping non-contemporary stories that have the coming of age/youthful perspective and vibe of YA books and combine that with the freedom that writing for an older target audience affords them. If you liked the mood and romance of (the excellent) CRUEL BEAUTY but perhaps mourned the missed opportunities of such a seductive premise, ACOTAR more than satisfies. BITE MY NECK SOME MORE, SIR. Plus stunning action and gorgeous imagery and interesting characters, including a fascinating anti-hero I'm looking forward to learning more about. Serious Darkling vibes, my friends. Maybe more of a review closer to release. If I can calm my racing pulse before then.",4.0,positive,"A Court of Thorns and Roses (A Court of Thorns and Roses, #1)",50659467
"Ladies and gentlemen, welcome to the ACOTAR Drinking Game What you need ∙ a copy of ACOTAR ∙ an alcoholic beverage of your choice ∙ one or more friends to play with (seriously, don't do this alone) How it works Drink every time you read the words: ∙ a shiver went down my spine ∙ my knees buckled ∙ in a heartbeat/a heartbeat later ∙ I would never be able to paint it ∙ male/female ∙ smirk/snarl/prowl/purr Take a shot every time: ∙ Tamlin or Rhysand's overwhelming sexiness is mentioned ∙ the word 'claim' is used in connection to sex ∙ Feyre uses ableist slurs or blames her dad for being disabled Bonus - finish your drink when: ∙ Feyre is harassed by Tamlin or Rhysand (but in a sexy way, so it's okay) ∙ Feyre complains about how difficult that ridiculous riddle is Feel free to add new rules as you go! Enjoy the game, and drink responsibly.",1.0,negative,"A Court of Thorns and Roses (A Court of Thorns and Roses, #1)",50659467
"As others mentioned this feels like Bella Swan trying to act like Katniss Everdeen so basically, this was Twilight with fairies instead of vampires and some cringy love/sex scenes... In the beginning, I was giving it a shot, trying to focus on the world that was intriguing but not even half way through the book I couldn't stop rolling my eyes. I literally said ""oh come on"" a couple times out loud... I have honestly no idea how to review this book. *Adding here that YES I will read the second book since everyone is saying it's much better but to be honest I don't have very high expectations.*",2.0,negative,"A Court of Thorns and Roses (A Court of Thorns and Roses, #1)",50659467
"i did it, i finally did it! i have officially lost my sarah j maas and ACOTAR virginity! i can’t believe i put this off so long. wow, just wow. i'm obsessed with faerie men this entire book. give me the next book immediately and let me have my heart ripped out.❤️ ""i gave myself again to that fire, threw myself into him, and let myself burn.""",4.0,positive,"A Court of Thorns and Roses (A Court of Thorns and Roses, #1)",50659467
SPOILER FREE REVIEW: *Reread April 2016 Took me centuries to reread this but it was worth it! TEAM TAMLIN THIS WAS FABULOUS s j maas can do no wrong i swear to god,5.0,positive,"A Court of Thorns and Roses (A Court of Thorns and Roses, #1)",50659467
"This was a solid start to this new series! I'm really interested to see where things go. I did find a few things to be a bit questionable, but I can't say what they are because HELLO SPOILERS. I'll be doing a full review/discussion on this sooooooon!",4.0,positive,"A Court of Thorns and Roses (A Court of Thorns and Roses, #1)",50659467
wow. Just wow. Sarah has done it again! This book was amazing! The romance was borderline new adult which I loved but it was also greatly paced. The plot was so well thought out and executed as well. I HIGHLY RECOMMEND A COURT OF THORNS AND ROSES!,5.0,positive,"A Court of Thorns and Roses (A Court of Thorns and Roses, #1)",50659467
"Oh my God I want to cry this was so bad and that cringey Tamlin made me want to double cry. ""I was as unburdened as a piece of dandelion fluff, and he was the wind that stirred me about the world.” Get outta here, dumbass.",2.0,negative,"A Court of Thorns and Roses (A Court of Thorns and Roses, #1)",50659467
"i'm just gonna stick with my 2017 rating. i am a girl of simple, slutty tastes.",5.0,positive,"A Court of Thorns and Roses (A Court of Thorns and Roses, #1)",50659467
This is it. This is the stupidest book I've ever read.,1.0,negative,"A Court of Thorns and Roses (A Court of Thorns and Roses, #1)",50659467
I’m a second away from dousing myself in gasoline and lighting myself on fire just so I never have to look at this book again.,1.0,negative,"A Court of Thorns and Roses (A Court of Thorns and Roses, #1)",50659467
This is my 8th time reading this book and I realized I have never written a review for it... illiterate human saves immortal pussy boyfriend from eternal damnation. 10/10,5.0,positive,"A Court of Thorns and Roses (A Court of Thorns and Roses, #1)",50659467
rhys really just said: i could be a better boyfriend than him,5.0,positive,"A Court of Thorns and Roses (A Court of Thorns and Roses, #1)",50659467
this is howl’s moving castle fanfiction and no one can convince me otherwise,2.0,negative,"A Court of Thorns and Roses (A Court of Thorns and Roses, #1)",50659467
