review,rating,sentiment,book_title,book_id
"NOTICE PERSONS attempting to find a motive in this narrative will be prosecuted; persons attempting to find a moral in it will be banished; persons attempting to find a plot in it will be shot. BY ORDER OF THE AUTHOR ... Jim said that bees won't sting idiots, but I didn't believe that, because I tried them lots of times myself and they wouldn't sting me. ... Human beings can be awful cruel to one another. The Adventures of Huckleberry Finn opens in the aftermath of , and for a time, it has the same joyous feel as the boys continue their antics of rebellious 12-year-olds. But the return of Huck Finn’s drunk of a father, Pap, hints at the darker, more serious themes of this novel. After being kidnapped and beaten, Huck escapes his father by faking his own death and then going on the run. He soon crosses paths with a runaway slave, Jim, and together they raft their way down the Mississippi. Like its predecessor, The Adventures of Huckleberry Finn is largely a series of vignettes with a very loose overarching plot. Huck and Jim travel from Missouri through Kentucky and Arkansas and into the antebellum South, getting into scrapes and making escapes along the way. There’s some great humor in their conversations on the raft; their argument about the wisdom of King Solomon is priceless. And there’s classic Twain satire and exposing of hypocrisy here, from the feuding Grangerford and Shepardson families to the con men known as the Duke and the King. So why was I reading this classic novel during Banned Books Week? For that, we have to talk about race and racism. The characters here (and the author, for that matter) are products of their 19th century time. The n-word is used relentlessly in this book, even by the slaves themselves, and it is jarring. Huck says casually racist things here that are heartbreakingly awful; on one occasion, for example, he compliments Jim by thinking “I knowed he was white inside.” And some critics fairly read this book as irredeemably problematic, reinforcing racist stereotypes and repeatedly deriving humor from a variation of a minstrel show. But I come down on the side of those who read The Adventures of Huckleberry Finn as transcending and challenging the racist stereotypes of the time. Huck has been taught by society all his life to view blacks as slaves, as less than. And at a pivotal moment, he writes a letter to report where Jim can be found by his master, and at first he thinks the letter is the right thing to do: I felt good and all washed clean of sin for the first time I had ever felt so in my life, and I knowed I could pray now. But I didn’t do it straight off, but laid the paper down and set there thinking—thinking how good it was all this happened so, and how near I come to being lost and going to hell. And went on thinking. And got to thinking over our trip down the river; and I see Jim before me all the time: in the day and in the night-time, sometimes moonlight, sometimes storms, and we a-floating along, talking and singing and laughing. But somehow I couldn’t seem to strike no places to harden me against him, but only the other kind. I’d see him standing my watch on top of his’n, ‘stead of calling me, so I could go on sleeping; and see him how glad he was when I come back out of the fog; and when I come to him again in the swamp, up there where the feud was; and such-like times; and would always call me honey, and pet me and do everything he could think of for me, and how good he always was; and at last I struck the time I saved him by telling the men we had small-pox aboard, and he was so grateful, and said I was the best friend old Jim ever had in the world, and the only one he’s got now; and then I happened to look around and see that paper. It was a close place. I took it up, and held it in my hand. I was a-trembling, because I’d got to decide, forever, betwixt two things, and I knowed it. I studied a minute, sort of holding my breath, and then says to myself: “All right, then, I’ll go to hell”—and tore it up. Huck says the wrong thing, and uses racist language, again and again throughout this book. But he ultimately recognizes and acts on his and Jim’s shared humanity and equality. That might be the best we can realistically expect from a book published in the 1880s. And some days, it’s obvious that our society has not come nearly as far on this score as we’d like to think we have. Is The Adventures of Huckleberry Finn the Great American Novel? It’s written by an immortal, epically talented writer. It was one of the first books to truly capture the course, plain spoken language of its time. And by focusing on racism and slavery, it speaks to America’s original sin. So yeah, it just might be, even though I prefer . Highly recommended.",4.0,positive,The Adventures of Huckleberry Finn,40375652
"Why have I never read Adventures Of Huckleberry Finn before? Was it Twain’s copious use of the N word? (I vaguely recall a primary school teacher abruptly halting a class read-aloud session, perhaps because of that.) Was it the air of earnest solemnity that surrounds so-called classics? Sheer laziness? No matter. I’ve read it now, and I’ll never be the same again. Hemingway was right when he said (and I’m paraphrasing) all American literature comes from Huck Finn. While it’d be entertaining to read as a kid, it’s even more rewarding to approach as an adult. Savour that wonderful opening paragraph (and tell me you can't hear Holden Caulfield in the cadences): You don’t know about me without you have read a book by the name of The Adventures Of Tom Sawyer; but that ain’t no matter. That book was made by Mr. Mark Twain, and he told the truth, mainly. There was things which he stretched, but mainly he told the truth. That is nothing. I never seen anybody but lied one time or another, without it was Aunt Polly, or the widow, or maybe Mary. Aunt Polly – Tom’s Aunt Polly, she is – and Mary, and the Widow Douglas is all told about in that book, which is mostly a true book, with some stretchers, as I said before. Everything to come is in those opening lines, penned in that distinct, nearly illiterate yet crudely poetic voice. You get a sense of Huck’s humility (compared to Tom Sawyer’s braggadocio); his intelligence; a cute postmodern nod to the author; the idea that storytelling contains “stretchers” but can also tell “the truth”; and the fact that everyone lies, including Huck. Especially Huck. He gets into so many tight spots that part of the joy is wondering how he’ll get out of them. The outlines of the plot should be familiar: Huck, a scrappy, barely literate boy, flees his abusive, alcoholic father by faking his death and travelling the Mississippi and Ohio Rivers with Jim, an escaped slave, on a raft. Huck's gradual awakening to Jim's plight is subtle and touching, never sentimental. In a sense the book chronicles his growing conscience. And the colourful characters he and Jim meet and the adventures they have add up to a fascinating, at times disturbing look at a conflicted, pre-Civil War nation. We meet a Hatfields vs. McCoys type situation; a group of rapscallions who put on a vaudeville-style act and try to fleece rubes; a scene of desperation and danger on a collapsed boat. We witness greed, anger and most of the other deadly sins – all from a little raft on the Mississipi. And before the midway point, we see the toll that a cruel joke can have on someone’s feelings. To a contemporary reader, some of the humour can feel a little forced, and the gags do get repetitive, particularly when Huck’s savvier, better-read friend Tom enters the scene. And then comes a passage like this: When I got there it was all still and Sunday-like, and hot and sun-shiny; the hands was gone to the fields; and there was them kind of faint dronings of bugs and flies in the air that makes it seem so lonesome and like everybody's dead and gone; and if a breeze fans along and quivers the leaves it makes you feel mournful, because you feel like it's spirits whispering – spirits that's been dead ever so many years – and you always think they're talking about YOU. Wow. You can see, hear and feel what he's describing. Hard to believe this was written more than 150 years ago. In the book's closing pages, Huck tells us this: If I’d a knowed what a trouble it was to make a book I wouldn’t a tackled it, and ain’t a-going to no more. Well, gosh, Huck, it war worth all yer trouble. We’re darn glad you dunnit. Yessir.",5.0,positive,The Adventures of Huckleberry Finn,40375652
"""وأيقنت ألا جدوى من إضاعة الوقت هباء, فأنت لا تستطيع أن تعلم زنجياً كيف يجادل. وعندئذ كففت عن الحديث"" هاكلبري فين, بعد أن رفض الزنجي أن الاختلاف بين الأمريكي والفرنسي مثل الاختلاف بين القطة والبقرة إذا لم تستطع هذه الرواية أن توصل لك قيمة العلم والمنطق, وخطر العلم الزائف فما الذي سيفعل؟ إذا لم تشعرك الرواية بكمية الخطر والخداع الذي يتحتم عليك أن تحتمي منه في هذا العالم المحيط بك, فما الذي تبقى لنشلك من سذاجة الطفولة؟ فكما يقول ""بريان ديوننج"": ""قد يكون مارك توين أكثر النقاد فاعلية عند نقده لجهل البشر وخدعهم حتى الآن, بالرغم من مظهرها فهي تبدو وكأنها قصص مغامرات, فهي بالحقيقة مجموعة من إفشاءات صادمة للضعف البشري, والتي تقودها الخرافات, العنصرية, الجشع, والجهل"" في تحدثت عن روعته الرواية كقصة مغامرات مسلية, ولكن في الجزء الثاني منها, والذي يُحكى لنا على لسان صديق توم سوير ""هاكلبري فين"", نشهد تحولا كبيراً واضحاً في موضوع المغامرات منذ الصفحات الأولى من الرواية: -	فدية؟ وما هي الفدية؟ -	لست أدري! ولكن هذا ما يفعله المغامرون دائماً! ولقد قرأت عن الفدية في الكتب. ومن ثم فهذا هو ما يجب علينا أن نفعله!! -	ولكن كيف يمكننا أن نفعل ذلك ونحن لا نعرفه؟ -	مهما يكن من أمر, فإنه يجب علينا أن ""نفعل"" ذلك! ألم أقل لك إنه مذكور في الكتب؟ هل تريد أن تأتي عملاً يخالف ما ورد في الكتب؟ وأن تفسد كل مغامرتنا بذلك؟ ... -	ولماذا لا يلتقط الإنسان هراوة و ""يفتديهم"" بمجرد مجيئهم إلى هنا؟!! -	لأن ذلك ليس مذكوراً في الكتب!..هذا هو السبب يا ""بن روجرز"".. هل تريد أن تعالج الأمور حسب النظام المتبع أم بطريقة مخالفة؟ -هذه هي المسألة ..ألا تظن أن أولئك الذين وضعوا الكتب يعرفون الإجراءات الصحيحة التي ينبغي اتخاذها؟ هل تظن ""أنك"" تستطيع أن تعلمهم شيئاً؟ كلا يا سيدي! سوف ""نفتدي"" هؤلاء الأشخاص بالطريقة المتبعة -	.. وهل نفتدي النساء أيضا؟ -	لا, فان أحداً لم يقرأ عن مثل هذا في الكتب! ====================== الرواية هي إحدى الكلاسيكيات الخالدة, وعندما نقول أنها كلاسيكية ليس فقط معناها أنها قديمة, بل لأنها أيضاً أصيلة في أفكارها التي يتداولها اللاحقون تحت غطاء مسميات أخرى, فمثلا عندما تقرأ هذا المشهد: -	إن ما يجعلني أشعر بالحزن هذه المرة , هو أنني سمعت صوت باب يغلق بعنف منذ قليل , فذكرني ذلك بالمعاملة السيئة التي عاملت بها ابنتي اليزابيث الصغيرة في أحد الأيام ! لم تكن حينذاك قد بلغت الرابعة من عمرها , وأصيبت بالحمى القرمزية , وكانت إصابتها شديدة الوطأة ولكنها شفيت . واتفق ذات يوم أن كانت تقف أمام المنزل فقلت لها : -	أغلقي الباب. ولكنها لم تفعل , وابتسمت لي فجن جنوني , فقلت لها مرة أخرى بصوت مرتفع: -	ألا تسمعيني ؟ أغلقي الباب . فوقفت جامدة في مكانها , والابتسامة على شفتيها , فازددت سخطاً وغيظاً وصحت : -	سأجعلك تطيعين ما أقوله لك . وهويت بيدي فوق رأسها , فسقطت على الأرض . ثم تركتها ودخلت المنزل وقضيت هناك عشر دقائق .. وعندما خرجت , كان الباب لا يزال مفتوحا والطفلة واقفة وقد خفضت رأسها والدموع تنهمر من عينيها .. وقد زادني ذلك جنونا ؛ وهممت بالانقضاض عليها , لولا أن الريح هبت في تلك اللحظة فأغلقت الباب خلف الطفلة .. ولمنها لم تتحرك من مكانها . فأحسست بأن قلبي يكاد يفلت من بين ضلوعي , وتقدمت نحو الباب وفتحته بلطف وهدوء وأبرزت رأسي من خلفه , فإذا بالطفلة لا تزال واقفة في مكانها ؛ وعندئذ صحت فيها صيحة مدوية مفاجئة , ولكنها لم تتحرك .. أواه يا هاك .. لقد انفجرت باكيا , وحملت الطفلة بين ذراعي وقلت لها : أيتها الطفلة المسكينة , فليغفر الله العظيم لجيم المسكين ما أتاه من أثر عظيم , لأن جيم لن يغتفر لنفسه هذا الإثم طالما بقي على قيد الحياة"" .. يا الهي يا ""هاك"" .. لقد كانت الطفلة التعسة بكماء صماء .. ومع ذلك عاملتها لك خشونة.! تذكرت مشهد مشابه سرده ستيفن كوفي في كتاب العادات السبع الأكثر فعالية, رغم أنه سرده كمشهد حقيقي. ==== وقالت لي الآنسة واطسون انه ينبغي علي أن أصلي كل يوم حتى أستطيع على كل ما أطلبه في صلاتي! ولقد جربت ذلك, ولكن الصلاة لم تحقق لي أي مطلب! ... لقد كنت أحدث قائلاً: ""إذا كان الناس يستطيعون الحصول على ما يريدون بالصلاة فلماذا لا يستعيد ""ويكون وين"" النقود التي فقدها في تربية الخنازير؟ ولماذا لا تستطيع الأرملة دوجلاس أن تسترد علية ""السعوط"" الفضية التي سرقت منها؟ ولماذا لا تستطيع الآنسة واطسون أن تزيد من وزنها"" وعندئذ أيقنت أنه ليس في الإمكان أن يحقق الإنسان أمنيته بالصلاة! وذهبت إلى الأرملة وقلت لها رأيي, فقالت أن الشيء الذي يستطيع الإنسان الحصول عليه من الصلاة هو ""الهبات الروحية"" لا الهبات المادية!! ==== في الغالب ستخرج من هذه التجربة متشكك يعمل عقله في كل الاحتمالات, فطوبى للمتشككين. ""فأجبت : أكبر الظن أن هؤلاء الجن أغبياء لأنهم لا يحتفظون بالقصر لأنفسهم بدلاً من أن يشيدوه لغيرهم ! فلو أنني كنت واحداً منهم , لما لبيت نداء أي شخص يحك مصباحاً قديماً من الصفيح !! بل لو أنني كنت واحداً من هؤلاء الجن, لتخليت عن عملي !""",5.0,positive,The Adventures of Huckleberry Finn,40375652
tom sawyer was a vexation on my spirit and I’m so glad I finished this so I never have to hear from him again,,,The Adventures of Huckleberry Finn,40375652
"I had to read The Adventures of Tom Sawyer in middle school, and I fervently wish that they had made us read Huck Finn instead. I mean, I understand why they didn't (giving middle schoolers an excuse to throw around racial slurs in a classroom setting is just asking for a lawsuit from somebody's parents), but Huck Finn is better. It's smarter, it's funnier, and Huck's adventures stay with you a lot longer than Tom's, because Huck's experiences were richer and more interesting, whereas The Adventures of Tom Sawyer could easily have been titled The Adventures of an Entitled Little Asshole . If Tom had to go through half of what happens to Huck in this story, he'd be balled up in the corner crying after five minutes. The action of Huck Finn is set in motion when Huck's father shows up and decides that he's going to be responsible for his son now (the story picks up right where Tom Sawyer left off, with Huck and Tom becoming rich, hence Finn Sr.'s sudden involvement in his kid's life). Huck's father essentially kidnaps him, taking him to a cabin in the middle of nowhere and getting drunk and beating his son. Huck escapes by faking his own death (and it's awesome ) and begins traveling up the Mississippi river. He runs into Jim, a slave who belonged to the Widow Douglas's sister. Jim overheard his owner talking about selling him, so he decided to run away and try to go north. Huck, after some hesitation, goes with him. From this point, the structure of the book closely mirrors Don Quixote : a mismatched pair of companions travels the country, having unrelated adventures and comic intervals. On their travels, Huck and Jim encounter con men, criminals, slave traders, and (in the best mini-story in the book) a family involved in a Hatfields-and-McCoys-like feud with a neighboring clan. The story comes full circle when Tom Sawyer shows up and joins Jim and Huck for the last of their adventures, and the best part of this is that Tom Sawyer's overall ridiculousness becomes obvious once we see him through Huck's eyes. Huck is a great narrator, and I think one of the reasons I liked this book more than its counterpart was because it's narrated in first person, and so Huck's voice is able to come through clearly in every word. In addition to the great stories, there are also some really beautiful descriptions of the Mississippi river, as seen in this passage about the sun rising on the river: ""The first thing to see, looking away over the water, was a kind of dull line - that was the woods on t'other side - you couldn't make nothing else out; then a pale place in the sky; then more paleness, spreading around; then the river softened up, away off, and warn't black any more, but grey; you could see little dark spots drifting along, ever so far away - trading scows, and such things; and long black streaks - rafts; sometimes you could hear a sweep screaking, or jumbled up voices; it was so still, and sounds come so far; and by and by you could see a streak on the water which you know by the look of the streak that there's a snag there in a swift current which breaks on it and makes that streak look that way; and you see the mist curl up off of the water, and the east reddens up, and the river, and you make out a log cabin on the edge of the woods, away on the bank on t'other side of the river, being a wood-yard, likely, and pulled by them cheats so you can throw a dog through it anywheres; then the nice breeze springs up, and comes fanning you from over there, so cool and fresh, and sweet to smell, on account of the woods and the flowers; but sometimes not that way, because they've left dead fish laying around, gars and such, and they do get pretty rank; and next you've got the full day, and everything smiling in the sun, and the song-birds just going it!"" (also that was one single sentence. Damn, Mark Twain.) A fun, deceptively light series of stories that's funny and sad when you least expect it. Well done, The List - you picked a good one, for once. ...why are you still here? The review's over. Oh, I get it. You want me to talk about the racism, right? You want me to discuss how Huck views Jim as stolen property instead of a person and criticize the frequent use of the N-Word and say ""problematic"" a lot, right? Well, tough titties. I'm not getting involved in that, because it's stupid and pointless, and I'm just going to let Mark Twain's introduction to The Adventures of Huckleberry Finn speak for itself, and the work as a whole: ""Persons attempting to find a motive in this narrative will be prosecuted; persons attempting to find a moral in it will be banished; persons attempting to find a plot in it will be shot.""",4.0,positive,The Adventures of Huckleberry Finn,40375652
"-احدى امتع القصص التي قرأتها ابدا. تصلح لكل الأعمار، فكلما نضج القارئ نضجت الرواية معه واستقى معان جديدة منها. - القصة على لسان صبي مراهق؛ تنطلق ببطئ في الفصول الأولى لكن سحرها يبدأ في الكوخ المنعزل مع الفكرة المجنونة للفتى، وتنطلق الرحلة الساحرة. -الشخصيات كانت ممتازة، ف ""هاكلبري"" مغامر ذكي وفطن وطيب، ""جيم"" العبد وقصة تلاقيهما والصفات المعطاة له من ""توين"" كانت مذهلة، ""الدوق""و ""الملك"" من افضل الشخصيات التي وجدتها في رواية يوماً لما يمتلكاه من اساليب شيطانية. - لم يطل توين الأحداث، لكنه جعلها متواترة بطريقة لا تشعرك بالملل وتجعلك تعيش في القصة منتظراً ما الذي سيحصل تالياً، والتنويع الحاصل بين اصناف المغامرات ومواقعها (غابة، نهر، قرية، سيرك، مزرعة...) اتى ليعزز التشويق في هذه الرواية. -الأسلوب سلس على عادة ""مارك توين""، ساخر ومبطن في العديد من الأماكن ومن هنا فمهما كان عمر القارئ سيستقي معنى جديد مبطن بين سطور الرواية. - ""هاكلبري"" ليس بطلاً امريكيا كما اعتادت هوليوود تصويره، فهو ليس مع اعطاء الحرية للعبيد، لكنه طيب القلب وكان جميلاً ان نرى وجهة النظر هذه من دون المزايدات المتعارف عليها!! - ""توين"" يقوم بالسخرية من ""سوير""في نهاية الرواية، ويصوره ككائن جليدي لا يهتم سوى بأفكاره دون اخذ ادنى اعتبار لمشاعر الآخرين. - الترجمة ممتازة وسلسة، واللغة المستعملة بسيطة. - أنصح الجميع بقرأتها لأنها ستضحككم من الصميم في العديد من الأماكن (خصوصا مع ""الملك""و""الدوق"")، وستقرأون فيها العديد من اللمسات الإنسانية، العاطفية وبعض الحبكات المشوقة جداً.",4.0,positive,The Adventures of Huckleberry Finn,40375652
