review,rating,sentiment,book_title,book_id
"Update.....I found a copy in my notes from last year --- Here is the review I wrote right after I read it. I realize - almost a year later I can still remember so much about this story: ELEANOR is a terrific character ... and this book is great!!! Even GROWS on you!!! Eleanor Oliphant, almost 30 years old, is one of those odd characters we think we may have seen before in our books --- lonely - awkward - lacking social skills. She doesn't have filters when it comes to saying what she's thinking. Yet....Eleanor Oliphant has a uniqueness that only she can claim. Eleanor goes to the same office job - M-F 8:30 to 5:30 every day. She works as a finance clerk. She takes an hour lunch break. We know her weekday supper routines and her weekend menu. Weekends are frozen pizza, vodka, and phone chats with Mummy. Eleanor's life changes after she meets Raymond, a co-worker IT guy. His sloppy -unkempt style doesn't bother Eleanor-she never had any friends to begin with and she wasn't a fashion queen herself. Raymond and Eleanor help a man, Sammy, who took a fall -- and the three of them become allies for each other. They begin to unleash from their individual isolated lives and bond together in a heartwarming friendship. This story really makes you realize how valuable one friend can be. Eleanor had been stuck in ways she didn't even have the eyes to see - let alone do anything about it. But it's Raymond -his goodness- that ultimately helps Eleanor mend her broken heart....by helping her face areas of her painful childhood she has avoided. The story is broken down into three sections:. Good Days Bad Days Better Days Tender- touching - and plenty of heart. This is another book that I read last year… The book was given to me last summer. I wrote a review but I have no idea where it is. I do remember enjoying it!! I still have the book in my house. I'm walking now, I can research the review or look through the book later but it was quirky and enjoyable.......NEVER FOUND IT THROUGH GR's .... but I had a copy!",5.0,positive,Eleanor Oliphant Is Completely Fine,35127681
"I dare you not to think Elephant when you hear this title. This writer is so clever! We've got the first part of elephant at the beginning of her first name, and the rest of the elephant in the last name. No, of course this book is not about elephants, but the writer sometimes plays with words--and that alone is a selling point for me. Maybe it's sort of like subliminal advertising, except the author isn't trying to sell us elephants. Eleanor Oliphant. Elephant elephant elephant! I can get all analytical and talk about how Eleanor--the fact that half of her face is badly scarred and that no one knows (or dares to ask) how she got that way—is the elephant in the room. (In fact, the author makes a pun once, referring to an Oliphant in the room.) And like an elephant, Eleanor Oliphant indeed fills the room, even though she would prefer that no one see her, that everyone leave her alone. The world is too scary to her and she is the poster child for anti-social behavior. In one venture she is completely delusional--she thinks her crush on a famous person will lead to marriage. She is a riot, but she has no idea she is. It's also true that she's sad and feels isolated and unlovable. Formal, literal, awkward, and very very funny in her skewed world view, are also part of her package. Routines, crossword puzzles, and vodka are her mainstays. I usually like oddball characters; Eleanor is definitely one of my favorites. Her character is so well-drawn, I'll remember her I'm sure. This book sure isn't all laughs and all light by any means. This is also a dark book. Something awful happened to Eleanor when she was a kid, and throughout the book we get hints about what it is. The ending had a very clever surprise that made me shake my head in wonder. I loved it. The middle of the book dragged a little for me, which made me call it a 4-star read at first. (I just had to change my rating to 5 stars, though--the book is just too damn good and I can't get Eleanor out of my head.) Eleanor has a hilarious adventure in a salon early on (one I just have to reread), and there's a lot of other funny energy. Absurd situations described in language that hopped, gave me the feeling that I was on an amusement ride. The author seemed “on”, jazzed up, and I couldn’t get off the ride even if I wanted to. Of course, I wanted the book to keep up that level of hilarity, and it didn't. Still, Eleanor was relentlessly fascinating, both her public, regular side (that’s a poor choice of words because there is nothing regular about Eleanor) and her private, dark side. I recommend this book wholeheartedly. I'm shocked that this is a debut--it's so well-written, and the lovable, weird heroine is so so vivid. I'll be in line for the author's next book, although this book will be a hard act to follow.",5.0,positive,Eleanor Oliphant Is Completely Fine,35127681
"Eleanor Oliphant is a thirty year old accounts receivable clerk who has a humdrum existence. She calls herself a self contained entity, eating lunch alone while doing crossword puzzles and spending every weekend alone with bottles of vodka. She feels freakish and ugly since she has scar tissue across her right cheek, a result of third degree burns suffered during childhood. She speaks to Mummy by phone every Wednesday. Eleanor lives with the only item to have survived her childhood, her parrot plant, Polly. Having been raised from age ten in the foster care system, she has no appropriate social skills. Society has kept her fed, clothed and educated, but unloved. Mummy's phone calls are hurtful and abusive. Mummy tells Eleanor that she's let people down, can't be trusted and that her facial scars show the past living on her face. Despite this criticism, she embarks upon a mission to find a boyfriend or husband. This will keep Mummy happy. Eleanor decides to change her outward appearance to attract dreamy rock musician, Johnnie Lomond. Raymond,a co-worker from the IT department of her office, starts a budding friendship with Eleanor after both of them assist an accident victim. Through Raymond's kindness and ministrations, Eleanor's inner emotions and feelings slowly start to emerge. She revisits her childhood memories with help from Raymond, her first real friend. Confronting her past will enable her to change the trajectory of her life. Eleanor Oliphant had a tumultous, mindboggling upbringing. Her journey is one of hope for a better future, a future fought for and won by facing her demons and disassociating herself with the perpetrator(s) of abuse. ""Eleanor Oliphant Is Completely Fine"" by Gail Honeyman is an excellent debut novel. Thank you Viking-Pamela Dorman Books and First To Read for the opportunity to read and review ""Eleanor Oliphant Is Completely Fine"".",5.0,positive,Eleanor Oliphant Is Completely Fine,35127681
this was genuinely one of the worst things i've had the displeasure of listening to & i remain astounded that this is one of the 76 most popular books of the past decade.,1.0,negative,Eleanor Oliphant Is Completely Fine,35127681
(2.5) I really wanted to like this but considering it took me 4 years to actually finish it... it wasn't for me. Darker than I expected with a story that had good moments but overall left me uninterested.,2.0,negative,Eleanor Oliphant Is Completely Fine,35127681
"Wow! What a great read. Highly recommend. The first couple of tasks for a novelist when starting a book (among others) is to first establish the Fictive Dream and second endear the reader to the character. This author starts the book out with the character telling us how mundane her life is. Yikes. What a huge risk. But the voice of the character is so superb, the voice actually picks the story up on its back and carries it for the length of the book. This is not an easy task. I loved the voice. What the author also does so well is relate to the reader (this is what Stephan King does so well, his trademark that allows him to draw readers from across all genres), the reader can relate to similar instances where he/she has witnessed someone socially challenged trying to navigate a difficult world. I was stunned at the craft level, how the author could make me laugh at comments or situations that were both sad and at the same time humorous. In A Man Called Ov the author was able to do something similar. In the story, Raymond’s character is a peach of a guy the way he carries his love of Eleanor and for the way he keeps coming back time and again after he’s been socially dismissed. The story Arc centers around Eleanor’s love for a rock star who has no idea she even exists. Eleanor’s lack of realty going after her true love is like watching a slow-motion car accident only this accident has five cars and a gasoline truck involved. The waxing scene early on is a hoot. If you haven’t read this one, drop what you’re doing and pick it up, you won’t be disappointed. David Putnam author of the Bruno Johnson series.",5.0,positive,Eleanor Oliphant Is Completely Fine,35127681
"Eleanor Oliphant is one of the heroines of literature that I am sure I will remember always. She is brilliant, yet socially awkward. At the age of 10 she experienced a trauma that she never received any help with to sort through it. So, she repressed her memories and more importantly, she repressed her emotions. By the age of 30, she was so good at repression that it completely froze parts of her being and the underlying, unacknowledged fear of any of her repressions getting out were the root cause of her lack of social skills. When dealing with intellectual matters, she is formidable; her vocabulary and the facts at her fingertips are beyond many people’s comprehension. Yet even as she grew and matured, some parts of her remained in the stunted, closed-in world of her 10-year-old self. Despite everything she had experienced, with both physical scars and those on her psyche, not once does Eleanor feel self-pity or get caught up in, “I am a victim”. She simply does not see herself that way and it is one of the reasons I admire her as a character to be honoured and respected. At her workplace, she meets the new IT guy Raymond, and her critique of him is definitely offhand and dismissive. Although they do eventually become friends, Eleanor has her sights set on someone else – far more glamourous, exciting, and sophisticated. When her world takes a nose dive, she is wise enough to know it is because of her own poor decisions based on influences from her past, and she takes brave measures to turn her life around with help from her friend Raymond. Her long and slow recovery is a testament to the human soul’s willingness to strive and thrive against all odds. I found this book to be a compelling read, funny in places, deadly serious in other places, but always, always buoyed by Eleanor’s determination and resilience. It was rewarding to watch her friendship with Raymond grow, and his support of her is inspiring. I loved this book; it is yet another amazing debut novel by an author I hope to read more of in the future. This one is going straight to my Favourites shelf, and I know that if ever I need inspiration, all I need do is think about Eleanor Oliphant!",5.0,positive,Eleanor Oliphant Is Completely Fine,35127681
"4.5 stars! I just loved Eleanor! She is a loner and avoids social interactions and lives in isolation. She speaks out without thinking, to whatever pops in her mind. She has never received hugs, or held hands and has never felt loved, she never received anything when she was sad to cheer her up. Never received balloons and received a balloon from Raymond with Sponge Bob on it and it was so special to her. She never heard of Sponge Bob. She had an awful childhood with a scar on her face and bruises would show up all over her body. She had an emotional traumatic past. She was bought up in foster homes and then gets herself her own apartment from a social worker. Eleanor is now thirty years old and works in a office. She drinks a lot of vodka and spends time on the weekends talking to her Mummy on the telephone. She drinks her vodka so she can forget her traumatic past, all what she remembers is a fire. She then goes through counseling and things come together and she remembers everything that happened in her traumatic past She then meets Raymond and things start to change for her, she finally meets a friend. She is in love with a famous musician. That is how quirky she is, she actually wants a relationship with him. Her relationship with Raymond builds and it works for her. She then goes through counseling and things come together and she remembers everything that happened in her traumatic past. She is changing and turns out being very brave. She is so humorous. I just loved Eleanor. My Thoughts This book really made me feel so many emotions!! I laughed, I cried, tears running down my face. I cheered for Eleanor near the end. I loved this book. It really made me feel! I just loved Eleanor. It was a slow burn but the book started building suspense when I read about her scar on her face and had to find out why. Then it got me turning the pages to find out what happened. I was so surprised when I found out what happened. It was so sad and heartbreaking what she went through. While I was reading this I thought it was a whole different genre in what I usually read, it wasn't a thriller but it was the mystery of what happened that turned this into a page turner. Once all the pieces came together, I fell in love with this book. I can understand why it was a little slow, you needed to really get to know Eleanor. Once I started loving Eleanor that is when it started getting really good. I then couldn't put it down. Eleanor will make you laugh, she will make you cry, and she will have you cheering her on. If you love a book that will make you feel, this is the one for you!! I loved it. This book was an awesome character driven novel. I just loved Eleanor's character.",5.0,positive,Eleanor Oliphant Is Completely Fine,35127681
"4.5 stars! Oh Eleanor, I desperately wanted to reach into this story and hug you (even though a hug would be extremely awkward for you) and welcome your quirky self into my life! Eleanor’s journey took me on a roller coaster ride of emotions. Eleanor is obliviously socially awkward. She had me laughing out loud on one page and then holding back tears while breaking my heart on the next. Eleanor Oliphant is one of the most remarkable characters I have ever ‘met’! Eleanor’s inner thoughts (and often her outspoken words) had me giggling throughout every chapter. Her relationship with her mother and memories of her childhood had me cringing and shaking my head in disbelief. While reading this book, I couldn’t help comparing it to the quirkiness of The Rosie Project which I absolutely loved. I just couldn’t help but smile and melt at Eleanor’s rationalizations for each of her thoughts and actions. She is quite a woman! I thoroughly enjoyed this novel and would highly recommend it!",5.0,positive,Eleanor Oliphant Is Completely Fine,35127681
"I loved this book. It took a while, but I fell in love with it. I finished reading it whilst I was at a cafe and realised how much of a trance I was in when I looked up and noticed my surroundings. This is the story of Eleanor Oliphant, a 30 year old woman who's suffered a lot. The tone of the book is quiet, steady and slowly reveals her life to the reader. You can sense something traumatic has happened, but you're unsure, because Eleanor is unsure. Slowly, it is uncovered, and thus this is the journey we follow. In between all of that, we look at her life. We're inside her mind and perceive her world the way that she sees it, with humorous and witty observations about pretty much everything that catches her eye. You laugh, but also feel this sense of sadness for her, because she's alone most of the time. But she's fine, or so she thinks. The story looks at the concept of loneliness extremely well. It hurts to read, but the reality of the matter is, loneliness is not healthy as we all know. This is different to solitude, but the need to connect with another human being is strong and innate in this book, and if not met, can cause damage to ones psyche. It was painful to follow Eleanor on this realisation that she was alone. Has been for most of her life. So how does she fix this? How does she battle the demons that've been buried for so long? This book is a beautifully, written journey I became fixated on. There's pain, but growth and absolute attachment to Eleanor. I couldn't get enough of it.",4.0,positive,Eleanor Oliphant Is Completely Fine,35127681
