review,rating,sentiment,book_title,book_id
"(Note from 4/17/2023 So someone reported this for unmarked spoilers even tho I prefaced it lol so the spoilers will be marked where they are, even though they really aren't spoilers at all because they do not significantly affect the plot in any way but oh well. It's either do this or have the entire review hidden bc of spoilers) (Note from 2/21/2023 because I apparently have to spell it out: For those of you who don't read comments or check dates read, I read and reviewed this book in 2018. It has been about 5 years; as I have stated in a number of comments, I will not continue this series. In the intervening years since reading this, my feelings on the matter have not changed nor have I desired to continue. Please refrain from commenting about how I need to continue the series or that I did not understand the book. I receive too many of those comments and I'm tired of replying the same thing over and over again. This review is for me first and foremost, not you. Please move on if you do not like my take.) Me to Sarah J Maas: ""Do you lie awake at night to come up with all your witty replies for the following day?"" Oh dear, this is awful. The Writing The title of this book is stupid. It's stupid and flashy and unrelated to the actual content of the book. It's solely for the ~ wow ~ factor. The quotable line, "" I love you... Thorns and all "" is wholely ineffective because ""thorns"" had not been established as a motif and was only used in that context in that very scene, more than halfway through the book. The word ""thorn"" was only used a grand total of 9 times in this book. The original Beauty and the Beast story had established rose motifs—you can't borrow good writing, even for a retelling. That's just lazy. The writing itself was inconsistent and poorly done. I pushed and pulled, but the mud was too slick, and held fast. Are you aware of the definition of ""slick"", Sarah J Maas? I do not think it means what you think it means. Besides that, Amarantha's hair drastically changed color after about 90 pages: Her red-gold hair Her black hair Which is it, Maas? It can't be both unless she has unmentioned magical hair dyeing abilities. The atmosphere and the opening chapter were excellent and I was intrigued by the idea that was offered me, but the actual book did not deliver at all. This next point is a spoiler, but because I am disgusted with Sarah J Maas for including this, I am not going to mark it as such, since everyone should know what kind of morals this book is supporting before they read it especially when they are as filthy and vulgar as this was. The attempted rape of Feyre by Tamlin was brushed off as no more than a mere romantic, steamy encounter to further their lukewarm love story. The only conclusions I can logically draw from this are all rather victim blamey, tbh—she was warned several times to stay inside with the doors locked until dawn, but she leaves her room not once but twice before dawn because she ~ wants to go to the party ~ and then later, after she almost gets gang-raped and is saved and then creeped out by Rhysand the sociopath, she thinks she is totally safe to go eat a bunch of cookies because, well the drums stopped, so it's probably okay now, and then she gets sexually assaulted by Tamlin, who was still high with lust magic. I was about to pass out when he grabbed me, so fast I didn't see anything until he had me pinned against the wall. ""Let go,"" I said as evenly as I could. I [pushed] him away. He grabbed my hands again and bit my neck. I cried out as his teeth clamped onto the tender spot where my neck met my shoulder. I couldn't move—I couldn't think. Before, during and after the attack , she's thinking, Wow, he's really hot. I'm kinda uncomfortable with this, but I guess it's okay that he's drunk on lust magic, because I wanted to sleep with him anyway . That is a very wrong and dangerous way of thinking. No matter what, it is never okay for anyone to make someone else sexually uncomfortable or afraid, especially when they've given verbal disapproval. This entire scene left a bad taste in my mouth. And then there's Rhysand's behavior. He repeatedly violates her personal space and comfort, drugging her and forcing her to ""dance"" for him in front of a large crowd for weeks on end after stripping her all but naked. Like all Fae males, apparently, he uses brute force to get her to comply with his sexual wishes. "" But he didn't actually touch her; he kept his hands just on her waist! "" you say. Yeah, but did she say he could touch her at all? Did she actively encourage him to touch her? No, she did not. I pulled away, but his hands were like shackles. I would not have such an issue with this if Sarah J Maas didn't give the impression that she supports such behavior. That is what I find unconscionable. Besides that, the plot made no sense, even after exposition-Alis gave us the lowdown—in fact, it almost made less sense then. It was cheesy and cliché and frankly, boring. The ""riddle"" was extremely easy and only proved that Feyre is an absolute idiot with no logical abilities, as I was able to figure it out before Amarantha had even finished saying it, and I'm notoriously bad at riddles. The sex scenes were almost Empire of Storms levels of bad, cringey, and gross. I think Sarah J Maas doesn't know what YA means and isn't aware she's actually writing for NA. The Worldbuilding The Fae were, for one thing, almost exactly the same (primarily in appearance and personality) to the ones in the Throne of Glass series, and tbh I was disappointed. They're not even cleverly unique faeries. They're just Tolkien-esque elves that are actually vampires: fangs and biting, immortality, aetherial beauty, animalistic tendencies, superiority complex. They don't have any distinct differences from humans in their thought processes or emotional capacities—only the same degree of variety that exists in humans. The religious system and creation story was very interesting and I really liked that aspect. The Characters Faerie aka Belle: Sarah J Maas decided to try something new and have a first-person fixed perspective, but it didn't really work, because Feyre was a bland complacent character without much substance passed the surface level, and most of the interesting action took place where she couldn't see it. She suffered, like Celaena did in Crown of Midnight, from what I call Nehemia syndrome: the character that the MC has grown to trust, despite obvious suspicious behavior, turns out to be manipulative, and yet the MC completely overlooks that fact in favor of idolization of their lying friend. In this case, everyone in Prythian is keeping secrets from her and after almost getting her questions answered by the Suriel, Feyre decides to "" Stay with the High Lord. He will keep you safe, "" and just completely forgets that she wants answers about the blight. Also, whereas Belle left the Beast in the original story because her father was in mortal danger, in this book, Feyre leaves because Tamlin impies that she's gonna get ganked by Rhys or Amarantha, the evil Faerie Queen. She is not an active protagonist. Also, her painting skills aren't a part of her characterization; it just feels tacked on to make her ~ cool ~ and ~ unique ~ Tampon aka the Beast: I don't even care about this guy tbh. He's a confusing character who just feels like a Chaol-Rowan merge on steroids. He's violent, obsessive, and abusive, but also sweet, understanding, and caring, because that's not a contradiction. There's a difference between a complex character and a poorly written character. Lucien aka Lumiere/Cogsworth (his steampunk eye suggests Cogsworth but his personality suggests Lumiere): So apparently he ""hates"" Feyre even though I almost shipped them more since they consistently had better chemistry than her and Tammy, and that's saying a lot, because they didn't have chemistry. exposition-Alis aka Mrs Potts: She was okay. Just okay. She was fine. Reese's Cups aka also the Beast and kinda Gaston too: Is he supposed to be her love interest for the rest of the series or something, because the fan art definitely suggests that, but, uh, did everyone forget that he's a dangerous sociopath with a history of violence?? He has no regard for her emotional well-being and sees her body as literally nothing beyond a sexual plaything. He's a horrible person. Amarantha: Why did there have to be a ""big bad evil Faerie Queen"" in this at all? There's already one in the Throne of Glass series and I can only take so much female-against-female hate from a supposedly feminist fantasy writer. Amarantha was bland and predictable, and her motivations were extremely surface-level. Her fam: Nesta was like, supposed to have some kind of implied character arc but lol it wasn't very good. Elain was nice and I liked her. The dad was okay, I guess. Pretty forgettable tbh Isaac Hale aka fake-out Gaston: This character wasn't important at all, but I just wanted to say that I think this is the dumbest name choice in a high fantasy book that I've ever seen. Isaac Hale ?? Really, Sarah J Maas? Really? That's the Jason of fantasy names. This is a the-guy-who-went-to-high-school-with-my-older-sister kind of name. It's not a fantasy name. Conclusion While I managed to read it fairly quickly, I had to dnf it for several days before deciding to trudge through. It was horrendous. I may pick up the sequel at some point, idk, but for now, from what I predict and understand from various spoilers I've encountered on the internet, I don't really care about this series very much. Frankly, it's not good.",1.0,negative,"A Court of Thorns and Roses (A Court of Thorns and Roses, #1)",50659467
"That was both horrible and incredible at the same time, and my thoughts are a whirlwind. Note: The first part of this review is spoiler-free, but the second half is most definitely not. The spoilery section is blocked off by siren emojis (🚨). Skip to the end for bonus content, including an ACOTAR rap written by yours truly. This is the story of a mortal girl, Feyre, who kills a Fae in the woods one day. She’s whisked away to Prythian, home of the Fae, where she will live the rest of her days as punishment for murdering the wolf. Whoever said this was a Beauty and the Beast retelling is clearly not okay. This is far from a retelling, because it takes all the important themes out and leaves just the bare plotline: 1. The Beast (Tamlin) is not ugly or even a beast at all. He just has a mask stuck to his face forever as part of a curse that I will get into more in the spoilery section. 2. We are not aware of any good reason for Tamlin to keep Feyre until the very end, and it’s still a flimsy reason (this relates back to the curse). The problem with the plot is that the foreshadowing is so faint. The plot in the beginning and up until the 75 percent mark makes no sense at all. Tamlin takes Feyre to live in luxury, with good food and nice clothes and freedom, because she killed his fellow Fae? It’s just nonsensical. How is that a punishment at all? She no longer has to care for her spoiled sisters, she’s away from the poor village. However, it does make sense in the end, but Feyre is very naive for believing all of this. Something doesn’t add up. People who DNF this book will be very confused indeed. In Beauty and the Beast, we know of the curse beforehand, so we can find a good reason for the Beast to be kind to Belle. But Tamlin? It’s a mystery. So anyway, Feyre gets taken to a land of luxury to live out the rest of her days in comfort as “punishment,” but she’s still not happy because for some reason she misses her sisters, even though they treated her like dirt. She falls in love with Tamlin, which was expected because he’s not a Beast. There’s no barrier to overcome here. She isn’t forced to look past his ugly exterior because he has no ugly exterior. Along the way, another Fae named Lucien conveniently reveals everything Feyre needs to know right before it happens. This is supposed to be foreshadowing? I think? But in the end, he makes things so easy for Feyre and there’s no conflict whatsoever. The only problems arise from Feyre’s own stupidity. Their exchanges basically go like this: Lucien: The Suriel are super dangerous and even hard for the Fae to trap so stay away. Feyre: *makes simple snare* *kills chicken* oOpS I caught one, what a coincidence!! Everything is far too easy for Feyre. She’s supposed to be a responsible hunter, but instead she makes stupid, reckless decisions that don’t line up with her character. She follows an illusion of her father despite being told it’s fake, she goes outside on Fire Night, she chases the Suriel, she goes after Tamlin… etc. If you tell her not to do something, she will do it. Lucien: Stay in your room, it’s dangerous. Tamlin: Stay in your room, it’s dangerous. Literally everyone ever: Stay in your room, it’s dangerous. Feyre: *gets a midnight snack* Feyre is trying to figure out the details of this blight that’s supposed to be taking over Prythian, but luckily for her, Lucien and Tamlin give everything away with no struggle whatsoever. The result is that the danger does not feel genuine. It feels like a cheesy way to add angst to the relationship between Feyre and Tamlin. Speaking of Tamlin, everyone hates him so much but he’s such a sweetheart. I know that he gets worse in ACOMAF, but there’s nothing wrong with him in this book. He may be a little bland, but he’s much better than Rhysand. More details in the spoilery section. And then we have the writing, which is just bad. “...” is used in every other sentence, the poor em dashes are abused, and Feyre’s bones bark. A lot. Like, every time she falls down, she describes her barking bones. And what’s up with the phrase “my bowels turned watery?” It’s used at least twice and I don’t like it at all. This is not 🚨🚨🚨SPOILER ALERT🚨🚨🚨 So, what’s up with Amarantha? I really do like her. She’s a compelling villain because she’s (somewhat) realistic. Sure, she tortures people for fun, but her backstory makes this seem (somewhat) reasonable. (Somewhat.) Basically, she kidnaps Tamlin and Feyre runs after them because she has no self-preservation instinct. She challenges Amarantha, and in return, she is given three trials. If she wins them all, she and Tamlin will be free and his powers will return. If she loses… well, Amarantha keeps saying that there wouldn’t be enough left of Feyre to burn. However, Amarantha gives her a different option. She could solve a riddle. This is when things go downhill. First of all, why would Amarantha bet all her power and might on a simple riddle? It’s not even that hard to solve. The riddle itself is bad. The rhyming pattern isn’t great. And worst of all, the answer? It’s love. The answer is love. How does this make sense? Amarantha is a brutal, sadistic villain, so why would she write such a cliche, cheesy riddle? She should have made it oddly specific so Feyre would never get it. Anyway, Feyre answers it correctly at the last minute, Amarantha loses all her power, and Tamlin kills her. It was far too easy. Moving onto Rhysand. I hate him with a burning passion. He’s a greasy, crusty, dusty, musty old man. I can’t believe Feysand is the endgame ship. I’m suing. This is ridiculous. I don’t understand how people love him. He’s abusive, uncomfy, and weird. People keep telling me that I will love Rhysand in ACOMAF and hate Tamlin. First of all, I highly doubt it. Second of all, if you have to rely on making one character a villain just to get people to like the other character, that’s bad writing. Finally, the curse is so specific and random. Tamlin has to fall in love with a mortal girl who hates the Fae so much that she killed one in cold blood, and he has to wear a mask, and she can't know it's a curse. 🚨🚨🚨END OF SPOILERS🚨🚨🚨 In conclusion: Feyre is an idiot, Tamlin is precious, and Rhysand deserves to rot in a hole. Also, I wrote a rap. It’s called *prim coughing fit* Feyre Darling. Slight spoilers for ACOMAF. Feyre Darling By Sofia I let out a breath I didn't realize I was holding Rhys's hair is black but Tam's is golden Will my bones bark or will they meow Come along Suriel and sing with me now My name is Feyre Feyre And I'm a standard YA MC What stupid things will I do? Let's see You tell me one thing and I'll do the other I left my common sense back in the gutter There's a blight going ‘round but I don't care Tamlin follows me everywhere I think he might like me but idk I can have Rhysand any day I like to paint but who knows what I'm painting At the slightest touch from Tamlin I'll be a-fainting Oh no he's abusive what will I do Good that Rhys says it's a choice for you I can't read but that's okay Tamlin will save me anyway My name is Feyre Feyre And I'm a standard YA MC What stupid things will I do? Let's see I shot a shifted fae with an ash bow Lucien tried to kill me but Tamlin said no Amarantha is being pretty suspicious Rhys killed a fae, that's a little too vicious I could marry Nesta off with one of these dishes Tamlin's eyes look like greenish grass Nesta thinks I'm pretty crass My name is Feyre Feyre And I'm a standard YA MC What stupid things will I do? Let's see Sometimes... I... talk like... this... That won't stop me from taking big risks It's Fire Night? I'll walk outside Maybe if I'm lucky I'll nearly die My name is Feyre Feyre And I'm a standard YA MC What stupid things will I do? Let's see 2.5 stars, a true guilty pleasure ___ I'm having major FOMO so I guess it's time to read this? 🤷 Anyway, I need a good cry, so SJM is the right way to go.",2.0,negative,"A Court of Thorns and Roses (A Court of Thorns and Roses, #1)",50659467
"Clearly I'm in the minority here. DNF at 30% because I just got fed up with things moving at a snail's pace and NOT MAKING SENSE AT ALL. This was one of the most uncompelling versions of Beauty and the Beast that I have ever read. The writing is nothing outstanding, there was nothing that moved me. I felt Cruel Beauty among other B&B retellings I've read this year and last have done a far superior job at moving me emotionally. Look, I'm sure by the end of the book, all the things tie together and everything's just dandy and things will make sense, and I'd be like ""ooooooh, so that's why ____."" Me, I don't care. Ain't nobody got time for that. I have so many questions and I'm just fed up. This is not a retelling of Beauty and the Beast. This is a book about a girl who gets to live an easy life with a guy who's implied to be a gorgeous Fae underneath his mask. The original story makes sense: here's roughly how it goes. Handsome prince is cursed to be ugly unless he gets a chick to fall for him. Flash forward, there's Belle's dad. Belle's dad wanders into Beast's castle and touches his stuff. Beast doesn't like the fact that Belle's dad touched his stuff. Beast is going to kill Belle's dad unless he gets Beast some pussy. Belle's valiantly steps in to save dad, Beast is as nice to her as much as a hairy ugly, self-conscious, socially ostracized monster can be. Belle is treated like a princess because Beast really, really fucking needs her to save him and his people before the curse runs out! There's a reason Belle is treated like the queen! Things make sense! They have to learn to trust one another. Things are slowly developed an built over time. There is a hideous beast who is scarred emotionally, and a beauty who needs to look past the exterior. There is a point. Not so with this book. Things are far, far too easy with this book. Now here's this version of Beauty and the Beast, a retelling that tries to be bad-ass and fails completely, from the little that I have read. There's Feyre who has a pretty crappy life with an absentminded, worthless, spineless dad, and two of the most bitchy, ungrateful sisters in the entire world. She slaves for them, she hunts food for them, she works her ass off for them. Without her, their family would starve. They don't care. I feel some pity for her, but she acts like so much of a martyr that there's only so much I can take. While hunting one day, Feyre kills a wolf, well, surprise, surprise, that wolf turns out to be a Fae in disguise. In return for this kill, Feyre is taken by a wolf (who's a Fae in disguise) away from her family. “What is the payment the Treaty requires?” His eyes didn’t leave my face as he said, “A life for a life. Any unprovoked attacks on faerie-kind by humans are to be paid only by a human life in exchange.” A life for a life! Oh, no! Is she going to die?! That's what a life for a life means, right? WRONG . Feyre is taken off to magical Fairyland to live in luxury for the rest of her life while her family is taken care of back in their little village. “Some would say it’s unwise to insult a Fae in his home,” Tamlin ground out. “Some would say you should be grateful for me finding you before another one of my kind came to claim the debt, for sparing your life and then offering you the chance to live in comfort.” So what?! Why?! This makes no sense at all. Feyre kills one of their kind. A beloved brother. In exchange, there is absolutely no punishment whatsoever . She gets to live in a fantastically fabulous castle, waited on by servants. She gets beautiful clothes and delicious food. Another useless answer. I dug into my breakfast, savoring each rich sip of tea, and she slipped into the bathing chamber. When I was done eating and bathing, I refused Alis’s offer and dressed myself in another exquisite tunic—this one of purple so deep it could have been black. Clearly there is some kind of a setup involving The Treaty, since there seems to be a lot of secrecy between the Fae... but wait, whatever information she wants, the Fae reveals...they're revealing their own weakness to Feyre, who is constantly plotting her own escape. It doesn't make any sense! “There is … a sickness in these lands. Across Prythian. There has been for almost fifty years now. It is why this house and these lands are so empty: most have left. The blight spreads slowly, but it has made magic act … strangely. My own powers are diminished due to it. These masks”—he tapped on his—“are the result of a surge of it that occurred during a masquerade forty-nine years ago. Even now, we can’t remove them.” Over and over and over, the Fae reveal their secrets to her, including one that might help her escape . “So there are faeries who will actually answer any question if you trap them?” Maybe they’d know how to free me from the Treaty’s terms. “Yes,” he said tightly. “The Suriel. But they’re old and wicked, and not worth the danger of going out to find them. And then pretty much the next chapter, she goes out AND IMMEDIATELY FINDS THESE MYSTERIOUS CREATURES. WHAT THE FUCK. I do not like it when things come so easily to a main character, and everything comes easily to Feyre. There is no consequence whatsoever to her actions. There is no punishment to her deed of killing. The Fae are supposed to hate her...it doesn't feel like it, because she is ""inconsequential."" In fact, they're more of her playmates than her wardens. The Fae seem to have no other things to do besides play with her and hunt with her. “My morning work was postponed,” he said. Indeed, his usual tunic was off, the baldric gone, and the sleeves of his white shirt had been rolled up to the elbows to reveal tanned forearms corded with muscle. “If you want a ride across the grounds—if you’re interested in your new … residence, I can take you.” And teach her how to read and write...because Feyre cannot read or write, an ironic twist to the Disney Belle's love for reading. “I could help you write to them, if that’s why you’re in here.” Feyre is irreverent, ungrateful and insulting to her wardens...in a way that gets her no punishment whatsoever. “Do you ever stop being such a prick?” I snapped back. Dead—really, truly, I should have been dead for that. But Lucien grinned at me. “Much better.” As I said, I'm sure this book improves in the end, but from what I've read, this book makes no sense, the writing is emotionless, the characters are flat, the main character unrealistic, and I do not care to continue.",2.0,negative,"A Court of Thorns and Roses (A Court of Thorns and Roses, #1)",50659467
"INITIAL REACTION: WILL UPDATE WITH REVIEW LATER BUT KNOW I LOVED THIS. IT KILLED ME AND BROUGHT ME BACK TO LIFE Y'ALL. A REVIEW IN GIFs : Me when I received the book: When I started reading: When Feyre was introduced: When Tamlin as introduced: FEYLIN/TAMEY: LITERALLY ME WHENEVER THEY SPOKE TO/LOOKED AT EACH OTHER: THE PLOT WAS BASICALLY EVERYTHING I WANTED IT WAS... THEN THERE'S CHAPTER 27!!! AND I DIED SEVERAL TIMES Amarantha, Also Rhysand: (more like get off my SHIP, am I right??) Feyre's character development was ON POINT: BASICALLY THIS WAS ME AFTER READING IT:",4.0,positive,"A Court of Thorns and Roses (A Court of Thorns and Roses, #1)",50659467
