review,rating,sentiment,book_title,book_id
"Brave New World says as much about Aldous Huxley as it does about our modern world. Maybe more. *** When he wrote it, Huxley was in the process of losing his inner child. Darling of the Jet Set, he was the literary version of their current idol, Cole Porter. And in the end, the sophisticated public’s jaundiced taste for quick, fun and outré reads made him disposable - to us all. And worst of all, to his own deep, dreaming subconscious! Shy, lanky, shortsighted polymath Huxley was born to a family of Eminent Victorians, and was given ample leisure time to read any book he could get his hands on - which was them all. They would call him a nerd nowadays. But his reading and shyness disassociated him from the rough-and-tumble world. He had no fixed anchor. Like so many of us, he had lost his centre of gravity, or had never had one. But entre-deux-guerres Europe loved him, and adopted him as one of its own. The darling of the Smart Young Things - as the Catholic Waugh tartly put it - he was witty, caustic and irreverent. He could do no wrong - except in the eyes of social activists, on one side, and believers on the other. So it was at the midpoint of his career that he took up his pen against the future in Brave New World. If he couldn’t be serious, he could nevertheless shock. Problem is, he half-loved his own Utopia. And in later life he moved to the U.S.A. and became an early advocate of the Southern California Lifestyle with its casual gurus and myriad conveniences. When his beloved wife Maria died of cancer, disconsolate and without moorings, he turned to her much younger caregiver for love - a quality conspicuous by the rarity of its occurrence in his hyper-intellectual heart. They were married at a no-frills marriage boutique in Nevada. They explored Eastern religions through Vedanta, then a current fad. They attended séances and summoned the ghost of his late wife. But all was not well. His doctor told him some disturbing news: he was going blind. Losing his sight would be losing his most precious pleasure: reading. So his doctor advised him to frequently rest his eyes, by closing them and then applying light pressure from his palms, gently circling them in a counterclockwise motion. He was very much a faddish man without roots, and much akin in his casual though refined nature to the citizens of the Brave New World. He Needed to read and write. He was a sensual man who needed his pleasures. But with the approach of the sixties, he received another grim diagnosis. Cancer of the mouth. He started to compare notes with his friend Stravinsky about their planned abstinence from cigarettes: The weeds that killed him in the end. *** Carl Jung used to say that our Shadow will visit us in our dreams if we ignore it in our daily lives... Huxley bought into the mainstream Freudian POV that the asceticism of the great mystics was mere dumb sexual repression (witness his Late anti-Christian rant entitled The Devils of Loudon - now made newly available on Kindle). And late in life, close to the time of his own death, Huxley dreamt he was floating in a vast orb containing a marvellous city. But outside the bubble, brutish crowds were howling with derisive laughter at him - yes, him - the untouchable visionary who penned the great Brave New World! It’s like that late photo of him at his misunderstood California friend Stravinsky’s recording sessions for his own new severely serial and segmented short compositions. Huxley marvelled at the capacious mind of the composer of the Sacre, but his small-souled trivial brain had no clue of the older man’s unimpeachable moral integrity. A wannabe mystic, he was a no-show at the starting gate of Heaven because he could never focus his thoughts long enough to shore up enough justifications for a undying Faith. He awoke from that dream in a panic. Poor, dear lost soul that he was, there were times when even Soma wouldn't help... And in his quest for new utopias, he had left the rough and tumble Faith of ordinary poor workaday, believing sods out of his equation. For his advanced calculations noisily and brusquely precluded the one and only possible healing panacea for his soul - the Simplicity of the Holy Spirit. For that’s ALL he had ever needed, had he understood Stravinsky and the common folk well.",3.0,neutral,Brave New World,31124837
"Brave New World is the sort of book about which you have to speak for hours or hardly speak at all. It is jolting, disturbing, and fiercely dislocating. I didn’t want to read it half the time and was almost limp with relief when it was over. Yet, I suspect this is not a story one can ever completely shake loose. Huxley’s vision of the future in Brave New World is far from optimistic. The novel imagines us forward into a world that has brutally stamped out all challenges to the domineering processes of capitalism and oppression. A world not unlike our world, but rather, is the extreme of its logic. The future as Huxley imagines it spells an essential and cataclysmic rupture in the fundament of community and intimacy, determined as it is by a ruthless will to mute the suffering of others and fix them into inferiority and helplessness. It is a future so completely dehumanized that it corrodes freedom, so uncaring that it literally breaks us down, breaks our families apart, breaks our minds and bodies apart. This is a book so uncannily tuned to the present moment that it made me ill with fear at the thought of it. Huxley’s clarity of vision crosses more than ninety years to beg us to change the way we understand the world and treat each other. In Brave New World , Huxley engages a critical stance towards the very idea of “progress” and the destructive lies that lurk within its dominant discourses. Progress, the novel demonstrates, is never without human consequences. The history of progress, in fact, is one of specific and contextualized human destruction. Huxley’s engagement with the dangers attached to our dismissal of progress’s twin potential for hope and horror crystallizes the terrible danger hanging over our own world, distorted and dazzled by the forces of capitalism and white supremacy. Yet, the novel isn’t interested in tediously moralizing about the wrongs we do to each other and to the world. Instead, it is invested in something much deeper, much harder to parse. There is a strong sense, throughout Brave New World , of moral critique and intellectual complexity. The questions as raised by the novel may be put in this way: What happens when we disconnect ourselves from a past that still informs our present terrors—and obliterate history? What happens when we stop caring about the world and about each other? Huxley refines these questions—about the nature of history and life and being human—and makes knives of them. It is hard for many of us, I think, to understand and imagine beyond forms of being-in-the-world that are not completely encompassed by the narrative of “progress.” We are constantly pushed to shed the past and disregard history, to seek a surplus of comfort and be suspicious of the unknowable. But our biggest mistake, the novel tells us, has been accepting to be addressed only in this impoverished idiom, and to suffer quietly the resulting atrophy of the imagination. Brave New World begs us to struggle for alternative ways of life. In challenging our understanding of history and the past, it emboldens us to think more deeply about the deep-seated dialectic between progress and racism, between progress and the patriarchy, about the oppression of the individual through language, and the tenacity of the role of culture in social domination. In disturbing us, it reminds us of all we are in danger of losing: recognition and community and our very humanity. Through all the layers of large and small violences in Brave New World emerges a voice that testifies to the power of art, literature, and the imagination as defenses against the psychic costs of oppression and despair; emerges a kind of mutiny, a grasping at “God… poetry… real danger… freedom… goodness… sin” which is, at bottom, a grasping at our lives. “But I don't want comfort. I want God, I want poetry, I want real danger, I want freedom, I want goodness. I want sin.”",5.0,positive,Brave New World,31124837
"This set the stage about what a dystopian story should be or not be. “But I don't want comfort. I want God, I want poetry, I want real danger, I want freedom, I want goodness. I want sin.” First published in 1932, this is timeless and is as relevant today as when it was first written. Sixteen years before Orwell's but eleven years after by , this is a high water mark for the genre, many of its themes could be told today. Truth be said, this could be published today and would be just as good, it rises to the challenge and then towers above it. “If one's different, one's bound to be lonely.” Everyday life makes me think of this book all the time. Huxley does more than describe a bleak and cynical post-apocalyptic or dystopian world, he looks a dystopian resident in the eye and puts before him a mirror to flesh out what is real and unreal. Further, Huxley has turned that same mirror on the reader and we see in his far future fantasy a reality that could be today. Huxley reveals that the seeds of Mustafa Mond and his ilk have fertile ground in our culture and in our souls. “No social stability without individual stability.” Finally, Huxely provides a glimpse behind the curtain, we see the false wizard in his machinations. The world that has been crafted for the denizens of Huxley's nightmare landscape is explained fully and matter-of-factly by Mond. Huxley's sermon is delivered as stoically and deterministically as Jonathon Edwards ""Sinners in the Hands of an Angry God"". ""You all remember, I suppose, that beautiful and inspired saying of Our Ford's: History is bunk."" A must read. *** 2020 Re-read: Reading this brilliant work after a few years only just reminded me of not only what an exceptional book it is, but of also how important it is in literature. “In 1999, the Modern Library ranked Brave New World as #5 on its list of the 100 best English-language novels of the 20th century. In 2003, Robert McCrum, writing for The Observer, included Brave New World chronologically at #53 in ""the top 100 greatest novels of all time"", and the novel was listed at #87 on The Big Read survey by the BBC.” -	Wikipedia Huxley was greatly affected and influenced by economic events in the England of the 1920s and of the need for stability, but at what cost? A trip to America and an exploration of Henry Ford’s autobiography My Life and Work further led him towards the centralized and industrialized world that he created in BNW. Huxley, perhaps more so than Orwell, has crafted a domain wherein the individual has succumbed to the will of the state. But Huxley’s vision is more subtle and therefore more insidious – the citizens of Huxley’s dystopia are brainwashed and seem genuinely happy. The dehumanizing automation of births and families as well as the somnambulist / hypnotic effects of Soma further create a scenario where out traditional attitudes of right and wring have been displaced. Most of all in this reading is the characterization of John and of his juxtaposition with him as a product of the savage reservation and of his alienation in the London of the brave new world. In John, Huxley has created a shadow of Miranda from The Tempest, and the civilization he finds is one that he ultimately rejects in favor of the most extreme form of individual choice. Timeless and important.",5.0,positive,Brave New World,31124837
"I think I read it wrong. Because my first thought upon finishing this was this: Where the hell do I sign up for this Brave New World? Basically, this society is missing religion, shame, sin, misery, fear, disease, and classic books. Now, that's not to say life is perfect in this utopia. Nobody gets married and has kids anymore. I know, a lot of you are thinking that isn't quite the downside that the book thinks it is. No more monogamy? Gasp. Whatever would we do? The new people are grown in test tubes. There are the dumb ones who do the menial shit, the average ones who do the office stuff, and the smarter ones who run the show. After being conditioned genetically, everyone is raised in state-run lab/home/school facilities, brainwashed in their sleep, and given a teeny bit of shock therapy in the toddler years to ensure that folks are content with their lot in life. Can you imagine if people were actually set up to be in charge by nothing more than a coincidence of birth? Gosh. That's some crazy sci-fi caste shenanigans right there. So what we have here is job security, free drugs that don't have side effects and make you feel good, non-judgemental sex, no conflict, no health issues till you die, and no barky religious folks knocking on your door at 9 am on a Saturday . And what are you missing out on, pray tell? Shakespeare . I've read his stuff, and I can say without a doubt that I could skip it and make do with a Micheal Bay movie. Fair warning, no one has ever accused me of being someone they aspire to emulate. Even the evil overlord in charge of it all wasn't that bad of a dude. When these guys met him and confronted him with their doubts as to how well they actually enjoyed their place in society, he just sent them to an island full of like-minded individuals so they could do what they wanted without disrupting the flow of things. He was kind of like, yeah, this isn't for everyone and sent them off with a wave of his chill hand. For the entire book, I kept waiting for the Soylent Green is People moment, but it never really came. To me, that world did not appear worse than ours in any significant way. The only weird thing was that being a mother or father was shameful and no one was monogamous. That's not exactly the most horrifying thing I've ever heard happening in a dystopian novel. Especially if the other option is to be like John, who flogged himself every time he got a boner over cute little Lenina. On a related note, the part where he kept yelling STRUMPET! STRUMPET! STRUUUUMPET! had me laughing until the tears rolled down my face. I kept waiting for some sort of redemption arc for this savage wherein he stopped being a complete asshat, but that also didn't happen. He was creepy as fuck right up till the end. And what an ending it was. So John has had enough of polite society and runs out to some deserted little strip of land. Once there, he prays to some weird mash-up of Christian and Native American gods, flogs himself daily, and tries his darndest to make his life as hard and unbearable as he can. Because suffering for no reason whatsoever is what makes life good? Bottom line, he's so batshit that tourists start showing up at his doorstep to watch him act the fool. But it's not till Lenina gets there and tries to embrace him that he loses his damn mind. He tries to attack her with his nasty little flogger and when he doesn't succeed, he just starts beating the fuck out of himself. And if that wasn't weird enough, he AND all the tourists end up getting turned on by his self-flagellation and have a massive orgy. John wakes up after his night of debauchery, can't deal with having busted a nut, and hangs himself. The end. If you drew random scenarios out of a hat and put them down on paper in no particular order, you seriously could not have come up with a more bananas conclusion to this book. I'm still not sure what the moral of the story is here. Now, admittedly, I like the sound of the drugs and sex and fun holidays. I will say I think it was a bit of overkill to taze babies. Then again, sacrifices must be made for the greater good. I'm kidding! Don't zap toddlers, you idiot. Ok. At the end of the day, I didn't really care for this book. I personally thought it was sort of boring. Not much happened plotwise and I never really felt invested in any of the characters. It seemed (to me) a bit of a daffy book that had a lot of fuckwit ideas of what would happen if we ignore the strict moral codes about sex found in most religions. I know this is a beloved novel and I don't think you're stupid if you enjoyed it. Different strokes for different folks and all that. Michael York was the narrator of the audiobook I listened to, and I thought he did a fantastic job.",2.0,negative,Brave New World,31124837
"Now that´s how good fordshipping alphas, betas, and the unimportant, stupid, but still necessary other lower castes, like to roll. It don´t always have to be annoying secret police death squads kicking ones´ door at 3 am to usher one into torture prisons and detention, reeducation, and extermination camps, it can be much more subtle and less bloody too. Like in real, nowadays Western democracies for instance. Drugs Soma could be seen as a metaphor for everything, all the free and prescription drugs everyone from kid to grandpa is boosted with, or as all the coincidental side effects of all the chemicals and poisons food and environment provide for the modern human. Sex What´s better than getting horny high as hell so the government wants their citizens as fu**ed up as possible to let them better deal with life in general and absolutely not care about who is ruling over them. Best combined with flaming monogamy to stigmatize possible, alternative ways of finding happiness like love or a great, deep relationship with friends and family. Media All propaganda and forced into line, controlled by conglomerates and the military industrial complex with their sockpuppet politicians driveling manufacturing consent. But I began thinking about the fact that streaming and the incredible world of 4K and 8K old school media and VR is just the beginning and one can imagine how this might look in 100 or multi k years. People who are still free to choose will prefer the perfect, forever, simulated utopia to reality and many won´t even have the chance to realize that they´re manipulated or living in a kind of simulation, because the perfection of how the system is run leaves no room for bugs and glitches that could make them suspicious. That was a bit off topic, back to the show. Good upbringing To make sure that nobody avoids the first 3, special prenatal, baby, and child treatment methods are implemented to get what´s needed for the right purpose of breeding cheerful idiots. Not more or less of something that´s essential for the perfect functioning of the world government that once was a single state. Nice innuendo so socioeconomic status defining the worth of everyone and the lovely side effects of eugenics implemented, without biotech, but much medtech. Drugs, sex, media, and good upbringing together make good sheeps All together leads to the happy slave tragedy, that people are completely satisfied with their life and not even noticing what´s really going on. The perfect, forever dictatorship, one could also call it the end of history with, totally realistic, endless, exponential, economic growth in liberal democracies. Similar stuff I´ll add this to my somewhen, procrastination caused postponed, review of 1984 too. If you´re a time traveler, you might have already seen it. Besides Brave new world, Karel Capeks´ dark, disturbing masterpiece is possibly one of the best dystopian terror pieces. It´s focusing on the role of big money and industry, of innocence turned into the same evil it suffers, was written in 1936 and satirizes Germans, Japanese, Russians, societies, ideologies, and economy in general and is a timeless memorial against political and economic terrorism and extremism of any kind. Aldous Huxley, duh, was Orwells´ college professor and they definitively inspired and mentally inseminated another to form these brave new worlds. Zamyatin Yevgenys´ We is another, historical extremely interesting piece, although just not as famous and fancy as the others, kind of the same problem as with the underappreciated Capek. An extremely difficult to read one is Stand on Zanzibar by John Brunner which comes very close to Huxleys´ ideas, but is much darker. Some more dark and/ or satiric tones: A similar idea by the master of philosophical, satirical sci-fi, the great, unique Lem: There have been so many deep, detailed thoughts about how to install the best dictatorship ever, and give aspiring god emperors some tips on the way to total world domination, that don´t get appreciated enough because Huxley and Orwell are ruling the dystopic genre. How ironic. Tropes show how literature is conceptualized and created and which mixture of elements makes works and genres unique:",4.0,positive,Brave New World,31124837
"I would like to be an intellectual. In an ideal world, I wear a monocle, and I have a pocket watch on a chain, and all of my sweaters have elbow patches. In this world, I consume exclusively classics at a very slow pace (so as to examine every word), but somehow simultaneously I have read everything that's ever been called worth reading by any person who's ever been called pretentious. But that is not this world. To be fair, I AM trying. I read literary fiction the most of any genre. I used to have a quest where I would have to read at least one classic every month, but I retired it because I typically read more than that. (Last year, for example, I read 46. And granted I have a loose definition of ""classic,"" but still.) I tend to rate books from those two categories higher than others. But still, we find ourselves here. I didn't like this book. I can say there are a lot of reasons, and I can even tell the truth: I can say that the depiction of women in this was so offensive it turned around and became funny and absurd, or that this dystopian world is not nearly as prescient as , or the Handmaid's Tale's, or even goddamn The Hunger Games', and both of those would be fairly respectable criticisms that I do have. But that isn't completely accurate. I didn't like this because it felt silly and boring. That's really all. Bottom line: I'll try to be smart next time. ------------------ pre-review either i did not care for this or i was being intellectually stimulated. i'll figure it out later. review to come / 2.5 stars ------------------ tbr review personally being very brave by adding classics to my to read list clear ur sh*t book 49 quest 22: free space",3.0,neutral,Brave New World,31124837
