review,rating,sentiment,book_title,book_id
"5 STARS Thank you, Eleanor Oliphant. Thank you for picking me up out of my reading slump. Thank you for being so funny, so sad, so smart, so blunt. Thank you for being a literary character that will live forever in the hearts of (most) anyone that reads you. Oh, and a big thank you for enriching my own personal vocab. My Kindle dictionary has never had such a workout. What a nice perk!! Effortless writing that flows naturally fast, even though Eleanor O prefers to use crossword type clues as actual everyday language. She is a piece of work! And I adore her. I didn’t want this book to end. No, seriously did not want it to end, so why did I devour it as fast as ice cream melting at a picnic? Because it is that good! My black, black heart doesn't always have to read about murders and mysteries. I love a feel good story as much as the next guy. I just need it to be the right kind of writing (GOOD, NOT cheesy). The right kind of character (layered, quirky, UNIQUE). I have to admit, I wasn't a huge fan of A MAN CALLED OVE. Ove did not strike me as a real person. He felt artificial and a bit contrived. Made up. Eleanor O, on the other hand, is real. This is the right kind of everything. Thank you, Ms. Honeyman, for writing it. I actually feel sad for other books that try so hard to achieve the big feels and don't even come close to Eleanor Oliphant. I've meant to read this for at least a year now and finally was nudged into it by my bookclub IRL! If this is on your TBR and you haven't read it yet, ahhhhhhh, I envy you. Don't wait a minute longer. Do it now!",5.0,positive,Eleanor Oliphant Is Completely Fine,35127681
"4.5! What an incredible story! “These days, loneliness is the new cancer - a shameful, embarrassing thing, brought upon yourself in some obscure way. A fearful, incurable thing, so horrifying that you dare not mention it; other people don’t want to hear the word spoken aloud for fear that they might too be afflicted.” Eleanor’s story hit me so much harder than I expected it to. She is thirty years old, has worked at the same job since she left university, speaks on the phone to mummy once a week and drinks two litres of vodka every weekend. Eleanor Oliphant is fine. One day, Eleanor and a colleague help assist an elderly man who’d fallen over on the street. From there we follow Eleanor and Raymond’s budding friendship, and we realise just how ‘not fine’ Eleanor truly is. “I’d tried so hard, but something about me just didn’t fit. There was, it seemed, no Eleanor-shaped social hole for me to slot into.” Eleanor is painfully relatable, her awkwardness at social encounters, reliance on alcohol and the burying of all feelings and past grievances, is something I feel on a personal level. It’s as if her story came to me at just the right time in my life. It was heartbreaking, honest and powerful. “I was thirty years old, I realised, and I had never walked hand in hand with anyone. No one had ever rubbed my tired shoulders, or stroked my face.” All of us have felt alone at some point in our lives, Eleanor’s story serves as a reminder that we are a lot more alike than we realise. A bit of kindness can go such a long way, friendship can truly be life saving.",5.0,positive,Eleanor Oliphant Is Completely Fine,35127681
"As you can deduce from the title, Eleanor Oliphant is completely fine . Or, so she thinks. But, by most people’s standards, I’d say not. When you first meet her, it’s hard not to feel overwhelmingly sad for Eleanor. Maybe even to pity her a bit. Eleanor is simply existing in a lonely and somber life without friends or family. And let’s be honest, at times her bluntness is sort of off-putting. Eleanor is just fine living by her own self-imposed routine. The hour-long lunch spent with the same sandwich and the daily crossword puzzle. The nightly pesto dinner recipe. The Friday treat of frozen pizza and wine. And the vodka, lots and lots of vodka—her coping mechanism for the long and lonesome weekends. The epitome of socially awkward, Eleanor is oblivious to social cues and norms, uninhibited by a filter, quite literal, and extremely frugal. At thirty, she’s set with her one and only job—no ambition for anything better or more challenging on the horizon. Laying eyes on “husband material” sparks her desire for a metamorphosis of sorts. She figures landing her soulmate is going to require some work—new hair, clothes and maybe even a little makeup to hide her facial scarring. After all, being with a musician requires a certain poise. There are scars on my heart, just as thick, as disfiguring as those on my face. I know they're there. I hope some undamaged tissue remains, a patch through with love can come in and flow out. I hope. It’s actually a happenstance run-in with one of her coworkers and the ensuing friendship that inspires the most change in Eleanor—her outlook on life and interactions with people. It’s comical that Raymond doesn’t seem fazed by Eleanor’s stunted social skills. In fact, his mellow attitude and companionship go a long way to smooth her edges. When things don’t go to plan, Eleanor is forced to stare down her truth. To succumb to the reality that everyone has problems and no feeling is insurmountable. That eventually with time—not vodka—things will get better. It's the why behind it all that broke my heart. balances the heavy—and there’s a lot here, so be prepared— with humor and hope ; taking readers on a journey right along with Eleanor. My own feelings skewing from odd to charmed. Quirky Eleanor managed to chip off a piece of my heart, stowing it away in her trusty shopper for safekeeping. With a pair of pom-poms in hand, I stood on the sidelines cheering Eleanor on as she discovered what life is truly about— living . Connecting with others. Taking those much-needed pauses to drink in her surroundings. And the potential for more in each and every aspect of life. From broken soul to a woman on a mission to live life, Eleanor's is an inspiring story, one I know I’m better for reading. And naturally, the part that squeezed the awww out of me—the healing powers of Glen. =^..^=",4.0,positive,Eleanor Oliphant Is Completely Fine,35127681
"I feel like this book should be titled Eleanor Oliphant Is Completely Rude . Here I thought I was going to be reading a story about a lovable curmudgeon whose heart slowly thaws from the sweet people around her. But that's not Eleanor. Instead, she's mean, rude, and petty. In fact, she's dreadful in all the ways that would make a character unlikable. And since the story is written from her perspective, it was really hard to enjoy it. We spend so much time in her head as she passes judgement on every single person crossing her way, commenting on their fashion styles, their looks, how they choose to spend their time, and so much more. She's also disparaging when people attempt to make conversations with her, but then she laments how she has no contact with anyone. She doesn't tip and is quick to blame others when she doesn't get the service she wants, even when she's the one who misunderstands. She talks like she's the queen of holier-than-thou, with big words and obscure references. I understand she's well-read, but where could she possibly have picked up such a pompous style of conversation? And yet she doesn't understand the meaning of ""pulled a late night"" or how much to tip. I find it hard to believe that she hasn't come across that information in her readings, but she has come across Latin phrases and obscure references. And herein lies the crux of the issue: Eleanor doesn't ring true to me as a person. She knows both a lot and very little about the same subject. When she talks about emotions and loneliness, she's surprisingly insightful, yet she doesn't realize that they apply to her. She judges alcoholics harshly, but doesn't make the connection to her own alcohol issue. She works in finance, but doesn't know the difference between laptops, desktops, and tablets. She falls for a guy based entirely on his looks, yet goes on about how she hopes he will love her for who she is. This book does contain some touching and uplifting passages, mostly around Sammy, Raymond, and his mother. These supporting characters warm up their scenes with their sweetness and kind regard for Eleanor. And I found the mysteries around what happened to Eleanor during her younger years to be interesting, although I did see the smallish twist coming. Since this story completely revolves around Eleanor, finding her character to be frustrating really hampered my ability to enjoy it. However, my experience is an outlier and so many others loved the character and the book, so please don't rule it out just based on my experience.",3.0,neutral,Eleanor Oliphant Is Completely Fine,35127681
"I'd rate this 4.5 stars. I'll admit, when I started reading Gail Honeyman's debut novel, Eleanor Oliphant is Completely Fine , I thought about issuing a moratorium on quirky characters who can't seem to pick up social cues or are oblivious to how people usually behave when interacting with peers, coworkers, those who provide service, and others. Obviously these are colorful characters to write about—it seems as if the literary world is full of them. But the more time I spent with Eleanor Oliphant, I realized that her behavior was more the result of circumstance than will, nurture if you will, rather than nature. And then I thought about how boring the world might be if everyone acted the way they were expected to, said the right things, and never expressed their true feelings. (Lord knows if I couldn't roll my eyes, my head might explode.) Eleanor lives by her routines. She eats the same meals, wears the same clothes, has her weekly chat with Mummy, and has her weekend rituals, which include frozen pizza and enough vodka to keep her pleasantly drunk all weekend. For the most part, she eschews interactions with her coworkers, whom she mostly thinks are daft and lazy. They make fun of her both behind her back and in front of her, and she doesn't really care. ""I do not light up a room when I walk into it. No one longs to see me or hear my voice. I do not feel sorry for myself, not in the least. These are simply statements of fact."" Two things happen which throw her routines off-kilter. First, while attending a concert with a coworker, she spots a handsome musician and is quickly smitten. She has decided that he is the one for her, and starts to ready herself for their first encounter, during which she knows he'll sweep her off her feet and they'll live happily ever after. She needs a makeover and new clothes, and she starts doing research on her soon-to-be-beloved. Meanwhile, one afternoon she and Raymond, the IT guy from her office, whom she considers poorly groomed and a bit bumbling, save the life of an elderly man who falls in front of them. Saving Sammy's life suddenly gives Eleanor two unexpected relationships, friendships, that she has never had before. She still acts the way she believes to be appropriate, and says things that most wouldn't, but she begins liking the feeling of belonging, of companionship, which she never realized she wanted. ""Some people, weak people, fear solitude. What they fail to understand is that there's something very liberating about it, once you realize that you don't need anyone, you can take care of yourself. That's the thing: it's best just to take care of yourself. You can't protect other people, however hard you try. You try, and you fail, and your world collapses around you, burns down to ashes."" Eleanor's social awkwardness, her lack of a filter, her inability to grasp exactly how people expect her to behave, actually hides a great deal of secret pain, pain and memories even she has hidden. And when she is forced to start recognizing just what a burden she has carried for so much of her life, and who was responsible, it threatens to break her. Suddenly she realizes she may need to do something she never has—depend on others, and reveal things about herself she's always kept hidden, in order to move forward. If she wants to. Eleanor Oliphant is Completely Fine is really a special book. Even if some of Eleanor's behaviors are similar to other quirky characters you might have seen, she is totally unique, and while off-putting, just absolutely wonderful. You both marvel and are saddened by the burdens she has carried, and how she copes with them. I found myself becoming protective of her, worrying there would come an instant where someone made a total fool out of her (with her own help, of course). Honeyman really did a terrific job with Eleanor. Even as she began letting down her guard, Honeyman kept her character consistent, but never let her become unsympathetic. While this is certainly Eleanor's story, I liked the other characters as well, although they certainly didn't get as much attention. I thought the ending was a little too pat for my taste, but I really enjoyed this overall, and don't think I'll be forgetting Eleanor or her story anytime soon. God bless the people who challenge our notions of ""appropriate"" and ""normal,"" because they are what keeps our world interesting!",4.0,positive,Eleanor Oliphant Is Completely Fine,35127681
"Eleanor Oliphant lives a fairly secluded life due to her lack of social graces and crippling self esteem and anxiety issues. She works at a graphic design firm in the finance department and spends the rest of her time at home, usually drinking. Her social life consists of a phone call with her mummy every week. Then one day she goes to a concert, for which she won tickets in a raffle, and falls in love at first sight with a musician. Eleanor decides to make some changes to herself as part of a plan to get her dream man. Meanwhile a new hire in the IT department of her company, Raymond, strikes up a friendship with Eleanor. As things change for Eleanor she is forced to confront the past and confront the real reason for her recent desire for more. I really enjoyed this, oh man Eleanor is so quirky and endearing. Her inner monologue was excellent and I could really relate to her. I had an especially visceral reaction when she is at the concert and suddenly feels disgusted with herself when she realizes she's been projecting this whole time and created a fantasy in her head and just feels foolish because come on who hasn't had a moment like that. I've had my fair share of moments when I try really hard and then just feel embarrassed and stupid about everything I've done. Eleanor just felt so real and human. The only thing that annoyed me was the ending when we find out her mother isn't alive she was imagining it because it felt unnecessary and I didn't think we needed a plot twist like it kind of ruined all her conversations with her mom for me a little bit. Everything else was really great though, definitely 4.5 stars.",4.0,positive,Eleanor Oliphant Is Completely Fine,35127681
"I had no idea what I was in for before I read this book. I loved every minute of it and the characters of Eleanor and Raymond. There were so many kind minor characters, even if they didn't understand Eleanor, they cared about her. Getting to see the world through her eyes was so very funny and also sad. She made me laugh so many times and it was a good laugh. Then there were the deepest of heartaches for the way a parent can treat their children. Just so much emotion from this book and it felt so real to me. I actually did understand a lot about Eleanor and why she did things the way she did them. Published May 9th 2017",5.0,positive,Eleanor Oliphant Is Completely Fine,35127681
"eleanor oliphant may be completely fine but i, on the other hand, am not. sigh. ugh. i feel so bad for not really enjoying this. this was the debut heard around the world, the debut that won numerous awards. and i saw so many people rave about this nonstop. but i think that was where i went wrong to begin with. the book blurb did not sound interesting to me in the least, so i probably shouldnt have picked it up to read just because everyone else was. next, eleanor drove me up the wall. im talking about driving me absolutely bananas. and i am definitely one of those people who if they dont like the character, then the book will be a massive struggle. which was the case here. especially because this story is almost completely character driven. theres not a whole lot going on the with the plot, so what drives most people to finish the book is desperately wanting to know ‘what happened to eleanor?’ and i did too, but not because i cared about eleanor as a character. only because i have an incessant need to know everything. lol. overall, i understood the message of the story, and whilst i agree that it was a good one in theory, it didnt personally impact me as much as i would have liked. just too many things got in the way, i suppose. but yay for everyone else who loved this - you all are much more patient and understanding than i am! ↠ 2.5 stars",3.0,neutral,Eleanor Oliphant Is Completely Fine,35127681
"What an absolutely fantastic character Eleanor is, a character that grew on me the more I read. She has had a scarred childhood, though we don't learn exactly what happened until later in the story, she wears the evidence on her face. She remembers little from that time only knows she was burned in a fire. Raised in a series of group homes, given an apartment by social services who still check on her though she is now thirty. She has few social skills, is very matter of fact, has no friends, few filters and has a schedule that she keeps to, a job she likes and insists she is fine. Until a crush with a musician and an IT guy named Raymond derails her schedule and her life. Why did I give this five stars? It is a first book, with nary a misstep, an assured book with amazing writing and character development. Plus it is difficult to take a book with so few characters, and not only make it interesting enough to keep the reader immersed, but to let us see the way Eleanor changes and grows throughout the story. There is much humor, there is also sadness and I came to embrace this character in all her strangeness, loved when she figured things out and came to terms with her past. There are a few places where the author could have gone overboard on sweetness but she kept true to the character of Eleanor and just managed to stay on the border, without crossing over. This is a book I will remember, it was that good and meaningful, in my opinion. Looking forward to great things from this new author, she is a true talent. Thanks to my friend Esil who told me to grab this one. ARC from publisher.",5.0,positive,Eleanor Oliphant Is Completely Fine,35127681
"Eleanor Oliphant is NOT completely fine! Well, at least not at first! This book is a fantastic character study. The journey with quirky Eleanor through the past and present is bizarre at times, thought-provoking at others. But, I found it to be engaging no matter what. And, while it is mainly about Eleanor, there are a few other interesting characters met along the way as well. Such a fun ride! Also, I thought from the start of the book it was just going to be a general humor-fiction sort of book. But, there are some very dark and twisted elements that are encountered along the way that put this book in a class/genre all by itself. I truly don't think I have ever seen a book that combines dark mystery and humor quite the same way that this book does. You know, when I sat down to write this, I thought I was going to go 4 stars. But, in writing the paragraphs above and thinking about the uniqueness of the story and how engaged I was with Eleanor's journey, I am going to have to up it to 5 stars. Give this one a try! While you may recognize some of the elements, I think in the end, as a whole, it is a totally new experience.",5.0,positive,Eleanor Oliphant Is Completely Fine,35127681
"At first it’s easy to think that Eleanor is just a quirky social misfit with no friends and no social life and she is, but I soon found out that there is so much more to Eleanor and so much more to learn about her. It’s a lonely life she leads and she says everything is fine but we learn eventually that it isn’t, and that life hasn’t ever been fine. While hints of what happened to her are slowly divulged, we never really find out everything until the end . It’s heartbreaking to learn why she drowns herself in alcohol and fantasizes about a guy in a band, wanting a guy to love her, scars and all, the ones on the outside and those in her heart. Although, there is some humor to be found here, this really is such a profoundly sad story. I found it very difficult to read at times, especially hearing the disturbing things that she tells us her mother says to her in their weekly conversations. She’s ridiculed and laughed at by her coworkers except for the seemingly odd Raymond, the IT guy with whom she becomes friends. Suddenly Eleanor Is living parts of the life that her past had taken away from her. She slowly gets to know a little of the world that she had hidden herself from for so many years behind the walls of her apartment and large quantities of vodka. I’m almost at a loss for anything further to say, except that I’m sorry I waited so long to read this book. I didn’t get to it right away because I really thought it was just another quirky book and I couldn’t have been more wrong. It’s about how people can impact each other’s lives in unbearably awful ways and how others rise to save them. A fantastic debut that is not to be missed.",5.0,positive,Eleanor Oliphant Is Completely Fine,35127681
"What an emotional roller coaster, this book! I laughed. I thought about crying. I was angry. I was delighted. I was empathetic. I was completely fine, sometimes. What started out as a book that could have easily been called A Woman Called Eleanor ended up being far superior to that Ove stuff. There were legit moments that made me laugh, and the book turned in directions that were hard to get through, assuming you have a heart inside your chest that beats about 65bpm as mine does. A heart that feels emotion and pumps blood at the same time. Have you one of those? Are you human? This could have easily been just a three-star, that was nice, thanks, see ya later kind of book. It wasn’t. It was a cut above that because it had memorable characters and situations and relationships and conditions and events and circumstances that made it a more powerful book than I anticipated. The last third of the book was heavy. This thing took me all over the place emotionally... and physically. I mean I guess I physically took this book all over the place since I read it on my phone and also listened to the audiobook. Whatever. I didn’t read the synopsis. I just liked the cover and people I like liked the book so I just went for it. I’m glad I did. I should go for more things in life. Take more risks. That’s what life is all about. Taking risks and reading books without knowing too much about them. Life is also about other things, too. Some of those other life things can be found in the pages of this book. Others can’t be found in any book because they just have to be experienced in, you know, real life. Experiences are good. So here’s another book for me to recommend. If I recommend anything, it’s worth your time. I don’t recommend anything unless I’m 100% sure everyone in the entire world will agree with me. So here I am, confidently recommending this book to you all because I know you will thoroughly enjoy it much the same way I did, and perhaps even more, but definitely not less. If that’s the case, don’t blame me. It’s not my fault.",4.0,positive,Eleanor Oliphant Is Completely Fine,35127681
