review,rating,sentiment,book_title,book_id
"Hallucinogenic Drugs, Virtual Sex, Alienated People. Brave New World is a futuristic novel by Aldous Huxley, considered one of the greatest prophetic writers of the 20th century. Aldous, who wrote about the effects of LSD and acids, brought from his experimental sessions ideas that were, at the very least, intriguing, so much so that some renowned scientists then chose him for research into the effects of hallucinogens on humans. In Brave New World, Aldous describes a perfect society, possibly located in Europe, dominated by a single ruler, where the state distributed a drug called SOMA to the citizens. All had a very calm life, without stress, which helped discipline all inhabitants. In addition to this collective doping strategy, the state provided cinemas where the audience connected to the sensory terminals. It accompanied the films, directly knowing sensations, taste, and smell from the screen. The sex is divided into two parts, one for pleasure and another for prosecution. The latter depended on state authorization. The first was free since there was no sensual coition, i.e., no direct contact between people, which eliminated the carnal intercourse of relationships, connecting to individual terminals, conveying the sensations of sex through the mind and not of the sensual body. Several children were born in a test tube, adapting them to future situations and raising them in the basement from a fetus in a dark room. Others who would be soldiers were taught by electroshocks not to appreciate nature, flowers, and wild animals. Beyond context, the fascination of this literature is that Aldous described all this writing around 1913, when the world was still preparing for the First World War, trench warfare, without any technology. No one dared to think, much less talk about test-tube children, and sensory terminals were unimaginable; humanity had barely gotten used to the telephone. There was no television; cinema was recently released by the genius Chaplin, still in black and white and mute. In the book, Aldous mentions a region that would protect from the state's power, where wholly savage people lived, preserving customs of food, sex, and freedom unrelated to the present stage. This charming place, described by Huxley in that fiction written in the moments of his hallucination, was Brazil, with its forests and people.",5.0,positive,Brave New World,31124837
"”I feel I could do something much more important. Yes, and more intense, more violent. But what? What is there more important to say? And how can one be violent about the sort of things one’s expected to write about? Words can be like X-rays, if you use them properly--they’ll go through anything. You read and you’re pierced.” Aldous Huxley was prompted to write this book in the early 1930s because he feared the direction society was heading. The worship of material goods, the embracement of capitalism, the promiscuity, the growing ambivalence towards books, the self-medication to escape reality, and the overall vacuousness of people, in general. The book begins rather awkwardly in the lab where people are being created. A massive, industrial, test tube baby factory with very little variety, after all, they have determined the very best specimens so why create anything else? Note to self: rewatch the movie Gattaca . We do meet Lenina in the lab, an uncommonly pretty woman, who feels a pat on a fanny by her supervisor is a reassurance that all is well. Note to self: #metoo movement needs a time machine. Huxley read a book on Henry Ford, who was certainly the poster child for industry and capitalism. In this book, he has become a deity of sorts. ”Oh for Ford’s Sake!” a character thunders. Note to self: Start using Ford for Fuck and see if anyone has a clue where such a use of the word came from. ”We don’t want people attracted by old things. We want them to like the new ones.” Rampant consumerism is the only way to keep the merry-go-round turning. Fortunately, by using brainwashing techniques while everyone sleeps, they can implant the proper desires and prejudices that will make for a united and happy society. Lenina has become hung up on a guy by the name of Henry Foster. She hasn’t been with another man for four months. She is dangerously close to being accused of monogamy. Her friend is appalled and reminds her that ”everyone belongs to everyone else.” A woman being “allowed” and even encouraged to be promiscuous would seem like evolution, but when it becomes an obligation to be promiscuous, it feels like just another form of oppression. Sex has become a plaything to keep the masses happy. They also have soma, which is the ultimate happy pill. Anytime things become too real, they pop a tab of soma or three. ”Christianity without tears--that’s what soma is.” It bleeds all meaning out of life, leaving the user complacent and happy and completely oblivious to whatever had been bothering them in the first place. It feels more than a bit like the opioid epidemic that we are struggling with currently; only soma is made readily available to all who need it and seems to have been carefully manufactured to avoid overdoses. Overdoses would definitely be a downer that would create some of that much feared unhappiness. #opiodcrisis What kind of life would it be to feel nothing? Bernard Marx has been trying to get Lenina to do something with him for some time. He is a bit of an odd duck among these carefully designed people. A Danny Devito among a herd of Arnold Schwarzeneggers. Note to self: Rewatch Twins , just because it is such a hoot. There is much speculation that something went wrong in the lab, a bit too much of this or too little of that leaked into his test tube. Needless to say, he is testy about it. After all, why does he look like this while his siblings look like that? He finally convinces Lenina to go with him to an Indian reservation in America, where they meet the natives who have been untouched by technology. They get old. They get sick. They die young. They give birth. This is a #povertyporn trip similar to white westerns driving through African villages so they can point and say things like...can you believe people live like this? Bernard is there really to feel something. Lenina is there to become overcome by all the squalor and unfamiliar feelings of discomfort, but she is glad she came because she is going to rock her #Facebook page when she gets back. Bernard decides to bring a white Savage back with him. He is the product of a lustful coupling by Bernard’s boss, and believe me Bernard needs all the leverage he can get with his boss. The Savage is reading, not only reading, but reading Shakespeare. Can you imagine a person learning to read from Shakesepeare being integrated into an uneducated society such as this? Note to self: Read Othello. The Savage is primitive and a thinker, and this will prove to be a dangerous combination. He will see the absurdity in everything. He will protest violently...how dare he? ”O Brave New World!” Can one man bring truth to the masses? It will be a nearly impossible task, given that the masses don’t even know they need saving. I had forgotten about all the humor in the book. Huxley is poking fun at nearly everything we hold sacred. Satire is the perfect vehicle for modern comedians like John Oliver, Jon Stewart, Stephen Colbert, Samantha Bee, and Bill Maher to make their political points and make their audience laugh as well. We seem to need our truths given to us with a dose of sugar. Even in this futuristic utopia, Huxley called it a negative utopia, the population still needs healthy doses of soma to keep up the pretense that everything is fine. The people who rebel are those who find integration to be a problem or, like Bernard, feel disadvantages from the very beginning of their life. One size does not fit all, even when everyone is manufactured to be the same. A society will always be judged by the tolerance it shows for those different than the majority. If you wish to see more of my most recent book and movie reviews, visit I also have a Facebook blogger page at: and an Instagram account",4.0,positive,Brave New World,31124837
"For fans of 1984….. Brave New World is a dystopian novel published in 1932. Reproduction occurs in a lab. The government conditions children to hate books and flowers while the government promotes certain products (like sports that require a lot of equipment). Everyone looks the same and has similar names. The government conditions people through a program of predestiny, and instead of saying “Our Lord,” the people say, “Our Ford.” The book itself is a bit rough at times, particularly in the beginning which is too focused on statistics and numbers. However, there is a lot to think about in this book. Although I don’t know the exact social mores of the 1930’s, many of the ideas expressed in Brave New World are accurate today. Consumerism is still a founding principle in the United States where consumer debt is at an all-time high between mortgages, credit cards, student loans, and auto loans. The idea is that one always needs more, more, more. Now, let’s talk about predestiny. If you just work hard, you can be anything, right? You could be the next Bill Gates, right? Let’s look at the education of some of the wealthiest people in the world. Bill Gates: He went to a private school, Lakeside prep. According to the Lakeside School website, the tuition for the 2023-2024 school year is $42,000. That isn’t for college. This is for high school. Mark Zuckerberg: He attended a private school as well, Phillips Exeter Academy. According to its website, tuition for the 2023-2024 school year is $50,604. Jeff Bezos: He attended Miami Palmetto High School and even worked at McDonald’s. However, he also participated in the Student Science Training Program at the University of Florida. According to the website, this is a “rigorous and fast paced program for academically talented and motivated students.” The program costs $5,200 plus a $50 application fee. We talk about predestiny. It seems like we, as a society, need to invest more in education. 2025 Reading Schedule Jan	A Town Like Alice Feb	Birdsong Mar	Captain Corelli's Mandolin - Louis De Berniere Apr	War and Peace May	The Woman in White Jun	Atonement Jul	The Shadow of the Wind Aug	Jude the Obscure Sep	Ulysses Oct	Vanity Fair Nov	A Fine Balance Dec	Germinal Connect With Me!",5.0,positive,Brave New World,31124837
"Back in high school, one of the teachers brought a little sample from this book, and I found it totally captivating. Terrifying but at the same captivating. So, I went back to it. “One believes things because one has been conditioned to believe them.” The beginning is totally the strongest part of this book, as it progresses, it goes a bit down. But at the same time, I think that the beginning is the hardest to get over. The world is being introduced to us in a rather raw way which definitely has the potential to make people uneasy. And while it was hard to read but it was also fascinating in a way. You do not like what you see, but you cannot look away. However, the book gave me chills; it's definitely not a ""summer-read"", it's quite a bit to unpack and get over what's happening. Side note, I just hope that no one ever looks at this book and thinks that it's a great idea. THAT would be terrifying.",4.0,positive,Brave New World,31124837
"Given that dystopian books are generally not my first choice ‘run-to-books-to-read’.... and I’m sure I didn’t understand the full depths of this book - which was written 21 years before I was born....even I can see Aldous Huxley had a brilliant mind. I was trying to wrap my thinking around the conspiracies that it looked liked the author was trying to warn us were happening in the world —�trying to visualize the already futuristic setting —( was he thinking of 2017?)....and follow the story itself, trying to get inside the heads of the created characters. See... I’m not very good at this. This type of reading is challenging for me. It hurts my brain!!!! But.....here are a few things I think I got from this book: .....thousands of little babies got born from one cell.....but not from a mothers womb....and these were the SORRY SUCKERS...( too bad for you Johnny - you’re pretty much a worthless bean- and you get to have all the shitty underpaid jobs in the world). .....embryos were incubated in bottles in laboratories. .....there were no traditional ‘Leave It To Beaver’ families in this society - there were no families at all - no sexual reproduction at all! .....there is a REASON for all this. Embryos were divided by their social status. There were five castes: alpha, beta, (THE LUCKY SUCKERS).....and delta, gamma, and epsilon.....(the SORRY SUCKERS)...... Oh but wait the SORRY SUCKERS won’t feel sorry for themselves because this is utopia....where everybody is made to be happy - as all personal identity has vanished. DRUGS ARE COOL.... even encouraged! Everybody must get stoned. So? How am I doing? Am I understanding this book somewhat? ...that what Aldous Huxley was saying is that the FUTURE LOOKS SCARY?/!.... It looked scary in 1931.... and it still looks scary in 2017. One of Huxley’s predictions was spot on: Bombastic- pretentious -pompous RIDICULOUS senatorial entertainment! ( Huxley was more kind and didn’t use all those adjectives)....but he might have if he knew how right he’d really be! Lots more in this slim-jim novel - we get enlightened on history - religion - consumerism- emotions ( not to worry - you won’t need to worry - it’s a no worry society).... we’ve become deadbeats! PLEASE read other reviews- I have NO idea if I read this book right. However ...seems like I shouldn’t worry about it all according to the brilliant man himself...Aldous Huxley! VERY WORTH READING! ( even for a girl who understands nothin) Whew.... now I can start my day.... as all is well in the world. 🌏",4.0,positive,Brave New World,31124837
"Brave New World is a vision of the future where science will (at last) be put full time into the service of our needs. Some of the ideas might seem a little controversial (because of our preconceived ideas) but we must be open minded...! SEX. Biology teaches that sex is meant to be had. To put restrictions on sex is as silly as putting restrictions on which chair to sit. And like chairs, women are meant to be pneumatic. ""Oh, she’s a splendid girl. Wonderfully pneumatic. I’m surprised you haven’t had her."" BIRTH. Why should modern man have to put up with it? Any informed person will affirm it is gross: all meat and blood and pain. Science will solve this problem with advances in reproductive technology: thinking outside the box. ""Which brings us at last,"" continued Mr. Foster, ""out of the realm of mere slavish imitation of nature into the much more interesting world of human invention."" CHILDREN. If you've been to a supermarket you will have seen plenty of bad parenting. How often have you wanted to step in and rectify the situation? Let's take the important job of citizen building out of the hands of amateurs. There's a good reason some of the foulest language we use involve the word *Mother*. ""Psychically, [home] was a rabbit hole, a midden, hot with the frictions of tightly packed life, reeking with emotion. What suffocating intimacies, what dangerous, insane, obscene relationships between the members of the family group! Maniacally, the mother brooded over her children ( her children) … brooded over them like a cat over its kittens; but a cat that could talk, a cat that could say, ""My baby, my baby,"" over and over again."" PEACE OF MIND. This is something we all want. Yet we must contend with traffic jams, lost cellphones, and raised voices. The frustration you feel is the result of a chemical reaction in your brain. Thus it is only natural that Science should offer a chemical solution. ""A gramme in time saves nine"" DEATH. The problem here is not death per se. It is our poor attitude toward it. Rigorous psychology will help us achieve complete indifference and thus free up a lot of wasted time. ""...what fatal mischief he might do to these poor innocents? Undoing all their wholesome death-conditioning with this disgusting outcry—as though death were something terrible, as though any one mattered as much as all that!"" BOOKS. These are only needed for reference and factual information. Reading in itself is profoundly antisocial. And, although there is little danger of anyone actually reading Shakespeare, his works are especially egregious in provoking time wasting thoughts.""Do they read Shakespeare?"" asked the Savage as they walked, on their way to the Bio-chemical Laboratories, past the School Library. ""Certainly not,"" said the Head Mistress, blushing. ""Our library,"" said Dr. Gaffney, ""contains only books of reference. If our young people need distraction, they can get it at the feelies. We don’t encourage them to indulge in any solitary amusements."" RELIGION. The absurdity of religion is self-evident, as every nonconforming individual knows. If there must be faith, let it be bright. Let it be in science. ""As if one believed anything by instinct! One believes things because one has been conditioned to believe them. Finding bad reasons for what one believes for other bad reasons—that’s philosophy. People believe in God because they’ve been conditioned to believe in God."" LOVE. Love is the unifying idea in each of the above themes - certainly the most destructive concept ever to exist. Shakespeare of course has been largely responsible for its glorification. Brave New World is a world without pain, without hunger, with total comfort. It is a world without love. ""Community, Identity, Stability.""",4.0,positive,Brave New World,31124837
"Dystopian Happiness. In a distant utopian future, society reaches its maximum ideal. Advanced technology, limitless overabundance, poverty disappearance, end of violence. Well-being at the reach of a pill. Everyone is happy. Everyone gets what they want, when and how they want it. Everybody belongs to everyone. ""Community, Identity, Stability"", the society's motto. Genetically altered from birth, each person learns to live under certain conditionings. And they are perfectly happy, within those parameters and capacities. But when a variable goes wrong, stability becomes hard to achieve. In this perfect world, Bernard Max tries to find a place in a society he does not feel he belongs, Lenina Crowne tries to overcome feelings she should not have, and John Savage struggles with his desire... to understand. Interesting from time to time, but sometimes, not so much. Mixed feelings. Overall an enjoyable read. An all-time classic, and a pillar of dystopian fiction. Still remaining, two movies based on the book (1980 and 1998). ----------------------------------------------- PERSONAL NOTE : [1932] [268p] [Dystopia] [Conditional Recommendable] ----------------------------------------------- ★★★☆☆ ★★★☆☆ ----------------------------------------------- Felicidad Distópica. En un futuro utópico distante, la sociedad alcanza su máximo ideal. Tecnología avanzada, sobreabundancia ilimitada, desaparición de la pobreza, fin de la violencia. Bienestar al alcance de una píldora. Todos son felices. Todos tienen lo que quieren, cuando quieren, cuanto quieren. Todos pertenecen a todos. ""Comunidad, Identidad, Estabilidad"" es el lema de la sociedad. Alterados genéticamente desde nacimiento, cada persona aprende a vivir bajo ciertos condicionamientos. Y son perfectamente felices, dentro de esos parámetros y capacidades. Pero cuando una variable sale mal, la estabilidad se vuelve difícil de alcanzar. En este mundo perfecto, Bernard Marx trata de encontrar su lugar en un mundo al cual siente no pertenecer, Lenina Crowne por sobrellevar sentimientos que no debería tener, y John Savage lucha por su deseo de... entender. Interesante de a ratos, a veces no tanto. Sentimientos cruzados. Dentro de todo una lectura pasable. Clásico de clásicos y un pilar de la distopía. Quedan pendientes ver las dos películas basadas en el libro (1980 y 1998). ----------------------------------------------- NOTA PERSONAL : [1932] [268p] [Distopía] [Recomendable Condicional] -----------------------------------------------",3.0,neutral,Brave New World,31124837
