review,rating,sentiment,book_title,book_id
"Sparks fly in the second volume of Suzanne Collins’ blockbuster Hunger Games trilogy, Catching Fire . Victory in the 74th games has not been all that sweet for surprise double-victors Katniss Everdeen and Peeta Mellark. And it is extremely sour for the reigning government. Katniss had shown them up big time when she publicly defied the gamemasters to keep from having to kill Peeta, an act of sedition as much as it was an act of courage and honor. President Snow burns with rage at Katniss for showing up the games, the Capitol, and him personally. He recognizes that it is necessary to give the subjects of his government some hope, but Katniss and Peeta have provided a spark to the tinder of popular resentment, and Snow needs to forestall a conflagration. The author Katniss is not in a good place back in District 12 after the games. Yeah, she has a nifty new house in the victor village, and her family is well taken care of, but she is experiencing a fair bit of PTSD. Collins describes Kat the victor. She has nightmares. She has flashbacks. And in the beginning you can see she’s practicing avoidance. She’s completely pushed Peeta to arm’s length, you know? She’s trying to stay away from him. Why? Because everything associated with him except some very early childhood memories are associated with the Games. She’s conflicted to some degree about her relationship with Prim because she couldn’t save Rue. So she’s dealing with all that, and her method of dealing with it is to go to the woods and be alone and keep all of that as far away as possible, because there just are so many triggers in her everyday life. - from the Time interview Part of the requirement for games winners is to go on a Victory Tour across all the districts. One of the soft spots in the logic of the story is that President Snow would think for a second that parading across the defeated districts the youngsters who had killed their children was anything but a guaranteed recipe for disaster. It is believed that Katniss' popularity and selling the lie of her death-defying love for Peeta would gain some love for the Capitol, and would dampen public unrest. Sure, whatever. Of course, Katniss manages to fan the flames of the people’s unhappiness with things as they are by her acts of kindness and respect for some of her fallen competitors and their families. As her popularity grows, the pin she wore in the 74th games, the mockingjay, spreads as a symbol of resistance. I am sure would approve. Time for Plan B. With his hopes for a palliative Victory Tour in ashes, Snow come up with another plan. How better to douse the embers of hope than to destroy all those who would fan the flame. So, for the 75th games, instead of a new crop of potential contestants, children between 12 and 18, from whom game contestants might be selected, he decrees that this time the tributes (those selected) will be chosen from the pool of prior winners. Hell-uh-oh, Kat and Peet, this means you-oo. Hell hath no fury like a president scorned. There is no law, only power, and Snow aims to char those caught, or even suspected, of playing with matches. And if crushing the Hunger Games victors from all twelve districts crushes the rebellious spirit of the people, well, may the odds be ever in your favor. Of course, we all know there is a third volume in the series, so I am giving nothing up by reporting that the plan goes up in smoke. There are many notions in play in Catching Fire , among them visions from the classical world of Greece and Rome. The whole notion of the games was taken from the Greek myth of Theseus and the Minotaur. King Minos of Crete had issues with Athens. There are varying accounts of how this came to be, but the accounts agree on the arrangement that was made. Athens was forced to send seven boys and seven girls to Crete every nine years to make a nice snack for a Minotaur, who resided in a labyrinth constructed by Daedelus. The kids are sent, but Theseus, an Athenian prince, wanted to get rid of the Minotaur, and thus the need for kid-burger specials, and so inserts himself in place of one of the young’uns. He gets some help from Cretan princess Ariadne, who offers a way for the children to escape the Minotaur’s maze after Theseus, hopefully, dispatches the beast. Her solution is significant here, beyond the classic story, as the unraveling of string, of a sort, figures large in Catching Fire in helping out the tributes. Katniss Everdeen grew from a raw teen in Book I to become a warrior. She grows stronger still in Book II, overcoming her fears and miseries, growing in strength, even while accepting that her fate was likely sealed. She is a gladiator, thrown into an arena to do battle for the pleasure and control of the rulers. And another classical notion comes in here, the slave warrior leading a rebellion. Katniss, by defying the Capitol in Book I and by her actions this time, has become the face of popular resistance, whether potential or kinetic. There are contemporary issues that resonate as well. Collins said: The Hunger Games is a reality television program. An extreme one, but that's what it is. And while I think some of those shows can succeed on different levels, there's also the voyeuristic thrill, watching people being humiliated or brought to tears or suffering physically. And that's what I find very disturbing. There's this potential for desensitizing the audience so that when they see real tragedy playing out on the news, it doesn't have the impact it should. It all just blurs into one program. - from Scholastic article And it is not exactly news that we are increasingly living in a world in which the one-percenters get to live lives of obscene luxury while working people are denied basic rights. The ancient Roman practice of eating to excess, then using a vomitorium to make room for even more indulgence is brought up in Collins’ vision as a very telling link between decadence old and new. And then there is the romantic element. Peeta is a wonderful guy, pure soul, gifted communicator, smart, strong as an ox, loves her, but, while she may find him attractive as a friend, does she find him attractive enough to throw over her childhood sweetheart, Gale? The pressure is unspeakable as the President, in order to save his own face, is insisting that she and Peeta make good on their cover story from their first game together. At the end of the 74th, Katniss had threatened pairs-suicide if the rulers insisted on having a single winner, and she prevailed. But the Capitol sold it as a manifestation of her love for Peeta, while the reality had been that she had stood up against the Capitol rulers. She agreed to help sell the lie after the games in order to keep bad things from happening to her family. Peeta and Katniss have to cope with the public lie of their being a couple, but must also contend with the fact that they really are very fond of each other. Add in another hottie in the shape of the studly Finnick Odair (a tribute in the 75th) and the potential for emotional imbalance is considerable. Some of Collins’ secondary characters get to spread their wings a bit, most particularly the District 12 mentor, Haymitch Abernathy, who gets to do a lot but much of his activity is told after the fact rather than shown. The president, Coriolanus Snow, gets to strut and fret his hour upon the stage, issuing threats mostly. I expect it is no accident that the president’s given name is the same as that of a Roman consul notorious for his low opinion of the ruled. Ok, I really enjoyed this book. I do have one gripe, though. Really, you knew there would have to be one. The Hunger Games story is really one long tale, and in order to keep from having to sell the book with its own set of wheels so you can tote it around, the publisher has divided it, like all Gaul, into three parts. (Unlike the greedy film makers who took it a step further and made four films out of a trilogy) And while it may make sense for this volume to have ended where it did, it seemed to me that it went from full on action to see ya next time in an awful hurry. That’s it. That’s my gripe. I had originally intended to make this a four-star rating, but on further consideration, in light of what Collins has done in terms of looking at real issues in a serious way, while offering top-notch entertainment, bringing in cultural foundations, and for making me root for a teenager to do something other than get a bad case of zits or run afoul of a serial killer, I am upping it to five. Catching Fire sizzles. ============================= EXTRA STUFF An excellent to catch you up on what happened in the first book An interview on My review of Neat bit on Theseus and the Minotaur in an SC interview in the The five part Time interview SC’s",5.0,positive,"Catching Fire (The Hunger Games, #2)",6148028
"๋ · ˚ 🖇️ ⊹ ⌇ pre-read. ⋆ ⤿ started on october 16, 2025. i read The Hunger Games two years ago and since then i’ve been procrastinating on reading this one, but i guess it’s finally time to stop doing that. 🫡 i’m *suuuper* excited to start it and hope it can live up to my expectations! 🧡",,,"Catching Fire (The Hunger Games, #2)",6148028
4.5 stars MY HEART Peeta is the original book boyfriend and this series is aging like the finest of wines,4.0,positive,"Catching Fire (The Hunger Games, #2)",6148028
"Warning!! SPOILERS AHEAD ... Well, kind of . No plot spoilers, just image spoilers. Don't read on if you do not want to see images of the actors cast in the upcoming Hunger Games movies . I am officially designating this review as my update central for casting on the Hunger Games. As new characters are cast, I will post the actor's pictures here along with the images I find that imitate how they might look as the character they will be playing. LATEST UPDATES ON CASTING WOWZA! The best photoshopped pic I have seen of Jennifer Lawrence as Katniss: So we officially have our Peeta: Okay, I just want to say that, while Josh is not what I had pictured, I trust those in charge. And Suzanne Collins gave her approval, so that in itself speaks volumes. Bottom-line is: Josh is workable. As long as they work with him to LOOK the part, and give him the eyes and most importantly the hair, I think he could be good. And our Gale: A little too pretty for my image of Gale. I also didn't picture Gale so beefy but instead trim and slim. Although for me, I was never too concerned with this role anyway. Gale never stood out to me as much as Peeta did in these books, so I would have been fine with nearly any choice. Once again, as long as they work their studio magic on his looks, he should do just fine. Willow Shields as PRIMROSE EVERDEEN Paula Malcomson (of SyFy's Caprica) as Mrs. Everdeen! [image error] Elizabeth Banks will be playing Effie Trinket Woody Harrelson is officially our HAYMITCH!!! The guy is awesome. I think he will pull it off without effort. Wes Bentley is Seneca Crane. Ummmmmm, yeah. [image error] If you ask me - this guy is way hotter than I ever thought Crane would be. Gah. He's frikkin hotter than the guy playing Peeta! Ceasar Flickerman will be played by Stanley Tucci. Excellent choice! Meet Rue and Thresh!! Amandla Stenberg and Dayo Okeniyi. They are perfect, and I am already getting emotional thinking about that infamous scene with Rue... *sigh* We also have our District 1 tributes!! Leven Rambin as Glimmer and Jack Quaid as Marvel. The unnamed District 3 Tributes have been cast: Ian Nelson and Kalia Prescott. As far as the other characters, the news isn't out quite yet. It seems they will be looking for Prim and Haymitch soon. So I will post more info here once the news is out. Let me know what you think of the re-imaginings of these actors in their new character roles!",4.0,positive,"Catching Fire (The Hunger Games, #2)",6148028
"1.) ★★★★★ Are we ready for another review breakdown in The Hunger Games trilogy? If you haven’t read my review summary for , then I suggest you do so! Unless you just want a little fresher up in this second installment! I personally do not think that Catching Fire holds up as well as book one, but I still loved it a lot, and I’m very impressed with it, even in 2020. For some strange reason, I didn’t love the parts of the game in this book, but I loved the buildup, and the capitol, and the meeting of new characters (be still, my Finnick Odair heart). Ah, lets get into it before I start to gush! Also, again, this review will have spoilers , so use caution if you don’t want me to tell you what happens in each chapter of this book! ➽ Chapter One: I love it when a tale starts out with the sipping of tea. Katniss and Peeta are both home and they both are remembering everything that they were forced to endure during the games. It has been a year already, and they are getting ready for (gosh this feels like a bad word, but…) celebration. We also get to see Gale, who is incredibly stubborn and works in the mines most of the time now and refuses to take any of Katniss’s winning fortune. Yet, this is the real start of the Gale versus Peeta love triangle for me. And I’m not the only one who notices, because President Snow soon comes and lets Katniss know he is brewing is own pot of tea. ➽ Chapter Two: Snow proceeds to threaten Gale’s life and tells Katniss that she needs to make everyone (including himself) believe in the love between Peeta and her. And he also lets her know that they have a whole tour of all the districts, filled with opportunities to prove themselves and their love for one another. ➽ Chapter Three: This year will be the 75th games, and that is especially important because it means it is a Quarter Quell! Which essentially means they have an even more wild game every 25 years. And during the last one? Haymitch was the winner. Katniss is suffering from extreme PTSD from everything she was forced to endure, and she keeps seeing Rue and it’s haunting her. She is also quickly realizing that she is going to be forced to keep convincing the world of her love for Peeta forever, because they will always be in the spotlight for the rest of their lives. Oh, and Peeta has an artificial leg now, and it makes me wish so desperately that they included that representation into the movies! ➽ Chapter Four: Katniss feels like she is going to have to eventually marry Peeta, and again it is just giving her added pressure and stress on top of everything else that is to come. This is also the iconic favorite colors (green and orange) scene and I love it a lot, honestly. But Peeta and Katniss make their way to district 11 and they make their speeches to the people. And during Peeta’s speech he promises to give Rue’s family part of their earnings forever. After that grand gesture, an old man makes the whistle sound that Rue and Katniss made in the games, and he is promptly killed. ➽ Chapter Five: After the heartbreaking end of that visit, Katniss promises to always keep Peeta in the loop with everything, and she lets him know about what Snow has said to her. Katniss and Peeta cuddle each night and try to protect themselves from the nightmares, while they go on their full tour to all the districts while being engaged. ➽ Chapter Six: I’ll be honest, I had forgotten about the throw up drinks that the Capitol uses to take bites of all the food that they can’t possibly eat with their normal digesting stomach alone! I really liked this chapter, because it felt like Katniss and Peeta are able to slip into this world of winning for mere moments, when they are just abruptly forced to see these privileged people who don’t have a care in the world, while they remember how hungry and cold they had to grow up in district 12. Speaking of district 12, that is where they are going to end their tour, but Katniss finds her way into the mayor’s house where she secretly finds out that district 8 is uprising. ➽ Chapter Seven: Katniss was going to run away with Gale, and he was all like “I love you” and Katniss was just like *microwave noises* a bit and it sent me, truly. But after that, Gale gets whipped and I felt really bad. ➽ Chapter Eight: Katniss gets hit in the face while trying to get to Gale, but he gets medicine and stiches and is healing up as best as he can. Yet, they obviously are not going to run away any longer. ➽ Chapter Nine: Peeta and Katniss’s marriage is going to be soon. And Katniss starts to really believe that maybe an uprising can spark a revolution. ➽ Chapter Ten: In this chapter we get to learn about district 13, and how it was supposedly bombed and completely taken out. But we also learn about a conspiracy theory that they people are somewhere safe and waiting. ➽ Chapter Eleven: Katniss is trapped by an electric fence and hurts herself returning home. She also learns that they are hiding something in district 8 and showing the same television clip over and over. ➽ Chapter Twelve: Many districts start rebelling, and then the truly shocking twist of the special 75th games is announced: the victors of previous years will go back in to fight. Reminder that Katniss is the only girl who can go back, and Peeta and Haymitch are the only two boys. ➽ Chapter Thirteen: Katniss and Haymitch get very drunk together. And then Haymitch is picked, and Peeta volunteers to take his place like the good boy he always is. “The odds are never in our favour” ➽ Chapter Fourteen: Peeta and Katniss watch Haymitch’s competition and see how he outsmarted the game with the force field that held them inside. “He offered me sugar and wanted to know all my secrets” ➽ Chapter Fifteen: Finnick Odair!!! We get to really start to begin to see the sad truth of what it means to be a victor in the games. Finnick and Katniss meet for the first time, and its so heartbreaking and heartwarming in the same exact instant. ➽ Chapter Sixteen: We get to see a tiny bit more of Snow’s cruelty with the servant who is assigned to Katniss at a dinner. But Katniss and Peeta are meeting people and practicing their skills and abilities. Peeta, as always, is such a people person, who everyone loves, but Katniss just cannot bear getting close to anyone again. Even though her and Peeta put on very heartbreaking and memorable acts at the end of this chapter. “I have to kill them all to save Peeta” ➽ Chapter Seventeen: Peeta tells Katniss about his painting for Rue (I didn’t talk about this earlier, but I love how Peeta paints to heal some of his pain and trauma, while also remembering the story of what happened to them). Then Katniss and Peeta have a rooftop picnic where they just spend the whole entire day together. This is truly one of my favorite chapters, and just the calm before the storm. Or the calm before Katniss puts on the mockingjay outfit that Cinna has made for her. ➽ Chapter Eighteen: We get to see Caesar again, and Katniss and Peeta have an interview with him. Then… the most heartbreaking part of this entire book happens, and while Katniss is in the tube to go up to the game, she is forced to watch Cinna be beat and killed before her. I truly wonder if Cinna knew what would be his fate, when he made that dress and when he unapologetically believed in Katniss with a love so strong that it was his end. “Remember, girl on fire […] I'm still betting on you.” ➽ Chapter Nineteen: It is the start of the games and Katniss is supposed to be pretending like she is pregnant, but she can hardly even see what is going on after the events that she was just forced to witness. ➽ Chapter Twenty: Katniss, Finnick, Mags (who I said I would pay better attention too, because of the prequel, but honestly I didn’t and I feel a bit bad), and Peeta try to get away. Katniss believes Peeta to be dead. And then she believes Finnick to be kissing him, until she realizes he is saving him. Yet, that doesn’t stop the other tributes from dying all around them. ➽ Chapter Twenty-One: They are still running away, but they soon realize that this game is unlike any other. Katniss and Finnick are forced to carry the other two, until the weight is too much to bear, and the deadly fog is creeping closer and closer. Mags understands the severity of the situation and throws herself into it, in hopes that the others will get away, safely. ➽ Chapter Twenty-Two: Oh! And killer monkeys were in the last chapter too, because again, this year’s games is wild as all hell! But the three of them are still retreating when they stumble across another small group of Johanna, Beetee, and Wiress. You know, I haven’t talked about Johanna Mason in this review yet, but oh my word do I love her character and how she always keeps you guessing. But they are all somewhat injured (some worse than others), but Wiress keeps saying the famous like ""Tick, tock. Tick, tock"" which they have no idea what that means… yet. ➽ Chapter Twenty-Three: Okay, it is “yet” and Katniss figured out it’s a clock all on her own. Basically, the map is one big clock and each hour some deadly force happens. And Katniss now believes she is hearing Prim. ➽ Chapter Twenty-Four: She soon realizes it is a jabberjay, and she also learned seven of the hours so far! Also…. This is really sad foreshadowing of what is to come in Mockingjay and I gasped a little bit, truly. Oh, and Peeta is being really sweet and romantic to Katniss, because he refuses to let her sacrifice herself for him. “You're my whole life.” ➽ Chapter Twenty-Five: They are trying to survive the best that they can, and Peeta gives her a pearl for luck, and Katniss is just so sure that she is going to die. ➽ Chapter Twenty-Six: That is, until she makes the connection with this mysterious lightning tree, where she is able to also hit the game dome and break everything she knows and doesn’t know yet. And this time Katniss is positive that she is going to die. ➽ Chapter Twenty-Seven: Yet, she wakes up in a hospital, not understand anything. She heartbreakingly finds out that people knew and were part of a rebellion plan the whole game and used her without her consent or knowledge. And they chose to save Katniss, and not Peeta, because she is a symbol, even though she never asked to be one. Katniss feels so betrayed and helpless. And then the book ends with her finding out that district 12 has been firebombed and is gone. Trigger and Content Warnings for talk of loss of a parent, animal death(s), abandonment, depression, PTSD depiction, blood depiction, alcoholism, gore, violence, murder, talk of suicidal thoughts, talk of death in the past. | | | | | Buddy read with ! ❤",4.0,positive,"Catching Fire (The Hunger Games, #2)",6148028
"Catching Fire proves that sequels can be superior. This is but with extra trauma, more love angst & Finnick Odair. Haymitch was right about everything. Now I need a nap and a rebellion. ♦️♦️♦️ Re-read: I'm just here for Haymitch. (And Peeta.).",5.0,positive,"Catching Fire (The Hunger Games, #2)",6148028
"I can't review this without being spoilery, so... 1. AAAAAAAAAAAAAH 2. The one thing I didn't like about this book is the part where Katniss finds out she has to go back to the Hunger Games. I think there should have been more of a pause there--for disbelief, for Katniss maybe trying to think of ways out of it, ways to kill herself even. The book started moving at a really fast pace after that point, with Katniss and Peeta preparing for the next Games, and I was like ""wait, what? hang on a minute!"" It was hard for me to believe that Katniss would willingly go back to the arena, at least not without major depression. One night of drinking didn't seem to cover it. 3. Everything else = awesome. The imagery. The clock arena. The rebellion. President Snow being creepy as fuck. HIS BREATH SMELLS LIKE BLOOOOOOD! 4. As soon as Wiress and Beetee started talking about the chink in the force field's armor, I knew the answer to the Games was BRING DOWN THE FORCE FIELD. I was yelling and yelling at them to do it, and then finally they did, and I was like ""YES!"" 5. I find the love triangle a little annoying but mostly interesting. Katniss doesn't really know how she feels about either of them, because she doesn't have the freedom to feel on her own terms. I like that she has some makeout time on the beach with Peeta, though. 6. This series is reminding me more and more of 's series. The evil oppressive government, the secret rebellion, the possibly-mythical place for them to escape to (The Smoke/District 13), hovercrafts, face tattoos, genetically modified plants/animals. I was hoping it'd go that way when I first read . I was like, this government needs to be overthrown , Tally Youngblood-style. 7. ""This is why we don't let you make plans."" HA! 8. AAAAAAAAAAAAAAAH!!! WHEN IS BOOK THREE COMING OUT!!!!!!!",4.0,positive,"Catching Fire (The Hunger Games, #2)",6148028
