review,rating,sentiment,book_title,book_id
"Re-read #? : November 27-28, 2014 Re-read #?? : November 29-December 3, 2016 While this is probably one of my least favorites of the series, it's still a fantastic book. I can't say for sure why I don't love it as much as the others, but it's just never stood out to me. However, upon rereading it, I am reminded again how great Rowling is at developing a story arc! There are so many hints to later parts of the series in this book! Especially with Tom Riddle showing up, the diary, hints of Ron's affection for Hermione, and overall just building up the characters and storyline. It's also really fun to see things of importance show up early in the story come into significance later on. Here are some thoughts on things I noticed or didn't remember about this book while I was reading it: -Like in one of the Harry Potter video games, Ron and Harry de-gnome the Burrow's garden at the beginning of the book. -Hermione's parents actually go to Diagon Alley and exchange Muggle money at Gringott's! -Why wasn't Nearly Headless Nick's deathday party in the movie? Also he died in 1492 which is when Columbus 'discovered' America. Significant? -""And some old witch in Bath had a book that you could never stop reading! You just had to wander around with your nose in it, trying to do everything one-handed."" (p.231) Sounds familiar. -I really wish they had the Valentine's Day party in the movie, with all the dwarves walking around dressed as cupids and delivering love messages. -Aragog is literally my biggest fear. -Apparently Dumbledore, back in the day, was a Transfiguration professor at Hogwarts. -And finally, I knew Voldemort was an heir of Slytherin, duh, but I didn't realize he was the last heir of Slytherin. Dun dun duuuun. 5/5 stars because even when it's my least favorite of the seven, it's still perfect.",5.0,positive,"Harry Potter and the Chamber of Secrets (Harry Potter, #2)",15881
"Reading HP to ring in the new year may be a new tradition of mine, since I've done just that two years in a row. I haven't read this book since the first time I read it in 5th grade, but I loved it! I never would have thought before that CoS was one of my favorites from the series but I stand corrected.",5.0,positive,"Harry Potter and the Chamber of Secrets (Harry Potter, #2)",15881
"I don’t know who’s worse: Lockhart or Umbridge. 😑 Even though it’s a 5-star read, (because nostalgia trumps logic at times) this is my least favourite in the series. I prefer the movie adaptation. Yeah I said it.",5.0,positive,"Harry Potter and the Chamber of Secrets (Harry Potter, #2)",15881
"Second Read Review This book was so much fun! And I honestly enjoyed it more than the first time I read it. I didn't know how much I forgot about this book until I reread it, so I probably enjoyed it very much because I mostly forgot many things in this book. So there are also some things that I want to talk about, Gilderoy Lockhart He was so annoying and irked me so much. Especially in the scene where he set loose of pixies in Defence Against the Dark Arts class and he couldn't even fix this mess! And told Harry, Ron and Hermione to put them back in the cage and he left them, I was like "" what the hell? "" he's so unbelievable. But I must admit that he made me laugh like in the Duelling Club, he was disarmed by Snape and that scene was so funny until I laughed out loud. I disliked him very much for lying about those stories! He's such a liar. Ugh. Oh and he deserved what he got in the end that he lost his memory because Ron's wand backfired at him. Hermione Granger I was shocked when I realized that Hermione liked Lockhart. That guy was so annoying. Maybe he was charming BUT he didn't even know any useful spells, like when Harry broke his arm, he conjured a spell and that spell caused Harry to lose his bones in his arm! He just made it worse instead of helping him. And even though I was shocked, I also laughed when I knew that Hermione put a Get Well card from lockhart under her pillow when she was in the hospital wing hahahahaha. I guess she really liked him. that scene was just so funny. 😂😂 Well, overall I really enjoyed re-reading this book and I'm going to read the third book now! Bye! ❤️ •••••••••••••••••••••••••••••••••••••••••••• Edit : Rounded it up into 5 stars REVIEW TO COME ON SATURDAY! ^^ 4.8 Stars "" It is our choice, Harry, That show what we truly are, Far more than our abilities "" Okay guys, before I started reviewing this book, I wanted to tell you something. This saturday, I read this book until 04:30 am and I completely didn't realise that I was reading for 4 hours or so and on that same day I had an economy course with my teacher and I completely forgot about that too until my mom reminded me of it. the course started at 10:00 am o'clock and I woke up at 11:00 am and maybe I'll get into a little bit trouble when I'm coming to school on Monday because of this. But I really couldn't help it! THIS BOOK WAS SO GOOD AND I COULD NOT STOP READING IT!! okay now let's talking about this book! My Opinion omg! this book! I had a lot of feelings! Anger. Sadness. Happiness and many more and the chapter I most loved was The Duelling Club. it was so funny to see Professor Snape disarmed Lockhart until he was flying because of the impact of Professor Snape's spell hahaha. xD I don't like calling Lockhart a Professor because he clearly didn't know any spells that were usefull for his students or anyone... Maybe just a Memory Charm. but it was only usefull for him to do his nasty business. ugh and he was a liar too. all those books he wrote were all faked. If Hogwarts were real, I would be really happy to learn all about Defence Against The Dark Arts. this is the most interesting subject that have really caught my interest since I began reading the first book. what about you guys? tell me on the comment section below! ^^ and that Duelling Club was so amazing! learning how to fight with spells! and what schocked me was that Voldemort was used to be a human! and Voldemort was not his real name. His real name was Tom Marvolo Riddle but he changed it. I mean, not an ordinary human,of course. he was a half-blood. his father was a muggle and his mother was a witch. I knew he was a Slytherin and he studied at Hogwarts too but I never thought him as half-blood was or a child or a teenager. because he was so evil that I couldn't even imagine what he would look like in the past and he *coughs coughs * used to be handsome... oh! I love Quidditch too! I don't really like sports but it's different with Quidditch. Quidditch is wonderful and amazing! I even always scream like "" YOU CAN DO IT HARRY! YOU CAN CATCH IT!"" and when Gryffindor wins I always scream like "" YAY!! GRYFFINDOR! GRYFFINDOR! "" Am I weird? hahaaha. AHHH. I wish Hogwarts were real. I wish I were at least a muggle-born. I have only read two books in Harry Potter series but they already have changed my life. thank you guys for reading and liking this review! I hope you guys have a great day and Happy Reading!! ❤❤",5.0,positive,"Harry Potter and the Chamber of Secrets (Harry Potter, #2)",15881
"Before I say anything else, it's important you know that I LOVE HARRY POTTER. In my fingers and my toes. LOVE. That being said, this is my least favorite of the early books (I'll let you know whether it's my least favorite overall after I reread HARRY POTTER AND THE ORDER OF THE PHOENIX). The reasons are LEGION: 1. Gilderoy Lockhart is a prat and I hate him. 2. Deathday party. It's creepy and gross. 3. Poor Ginny. 4. The trouble Harry and Ron get Mr. Weasley into stresses me out. 5. I don't like snakes. 6. I HATE spiders. 7. Dobby needs to calm the eff down: BUT. This is Harry Potter we're talking about, so there's also plenty of awesomeness: 1. Dwarves dressed as cupids, delivering singing valentines. 2. MOLLY WEASLEY. 3. Ford Anglia in the wilds of the Forbidden Forest. 4. Polyjuice Potion 5. Gnomes shouting ""geroff."" 6. Lucius Malfoy getting taken down a peg. SO. Even if this is my least favorite, it's still Harry Potter, and Harry Potter = AWESOME. If you haven't already, READ IT. If you have read it, read it AGAIN. That is all. My other reviews for this series:",4.0,positive,"Harry Potter and the Chamber of Secrets (Harry Potter, #2)",15881
"*Life lessons: 1. Don't trust too easily. 2. Unexpected grumpy people could mean everything in the end 😭 3. Have a life-saving nerdy friend like Hermione at all costs. 👀 I cannot get over Ron's mom's letter ... literally made my ears bleed. And that diary.... My life won't be the same again 😩 The character which made me laughed out loud many a times without them meaning to was Hermione! Surprising! Not because she's that chatty but the way some lines were written about her that made me squeal because of how nerdy she could be. ""....read every book in the library before Christmas."" ""Hermione took nobody's advice but signed up for everything."" I mean...😂 *Harry: ""But why's she got to go to the library?"" Ron: ""Because that's what Hermione does. When in doubt, go to the library."" Another bookish quote relived! I cannot believe I had this much patience in me to give more than a year gap after reading the first book! Damn! 2021, you are making me shine all over again! Bless you, book 2! Fantasy, mystery, adventure done right. The way it has been written is so simple that it's just impossible not to enjoy. Everything is so damn vivid and entertaining! Things are well-balanced. There aren't anything underwhelming or overwhelming parts I have come across this series. I watched the entire movie series adaptation years ago and thankfully, none of it made sense that time and I am so GLAD I cannot remember anything happening there except for the actors' faces in my head while reading the books. I loved the first book. It was so much better than watching a good movie. I could feel the action, adventure and the dialogues more with the book. And this sequel is amazing as heck too! I feel the first half was a bit slow but it's the second half that got the legs of my imagination run it's winning race until the end! Malfoy is annoying (bless him!), the spells are happening real, more strict rules to break and, of course, Hermione and Ron are becoming more endearing with Harry not smiling at all because he's Harry Potter! Dumbledore, you never fail to impress me. I wish there were more parts of the characters. But it's fine. I wasn't bored even for a moment there. The entire read was a fun fest for me. I woke up knowing it's Sunday. The reading gods cast a spell on me at 6.30 am and I started reading the book. And now I feel magical! I am feeling so proud of the characters, including the jerks and the scoffing teachers at Hogwarts. I say nothing would have been this perfect without any of you. There are more dramatic characters in this one. The ghosts, the side characters...and I don't think I will ever get to see a detailed story description of anyone belonging to my house, Hufflepuff. I know we are all Slytherin here but I need to know a Hufflepuff soon. Are you there in 3, 4, 5, 6 or the dreaded 7th?",5.0,positive,"Harry Potter and the Chamber of Secrets (Harry Potter, #2)",15881
"It's actually quite fascinating how much happened in this book, to be honest.",5.0,positive,"Harry Potter and the Chamber of Secrets (Harry Potter, #2)",15881
"When everyone first read and loved Harry Potter I ignored it. Not for any particular reason but about 10 years ago I didn't think I would be into it. Fast forward a decade and I'm now working my way through what I can say already is a children's classic fantasy series that is up there with The Wizard of Oz and The Chronicles of Narnia. Harry's existence with his Muggle uncle and auntie is as horrible as ever and he can't wait to get back to Hogwarts after speaking to a mini-elf masochist who essentially predicts his doom and travelling in an awesome magic-infused flying car. Upon returning to Hogwarts it's similar to before, Quidditch lessons, Malfoy being a bit of a tosser, Hermainie loving studying, and the wizarding threesome getting into all sorts of nonsensical antics. A new tutor is introduced this time, Professor Lockhart and I thought he was brilliant mainly due to how awful he was with his tall-tales and celebrity status! This narrative is brimming with ghosts, boys and girls who adore Harry, spiders, and Professor Sprout. The characters are pretty brilliant and I can easily understand why this is adored globally. I didn't need the continuous info-dumps that reminded me what happened in book one but apart from that there isn't really anything negative to say. The ending was surprising with a cool twist, a magic hat, a phoenix, a sword, a diary, and a giant snake. I hope you don't tell me off for these spoilers as I'm sure I'm the only fantasy book reviewer who hasn't read these yet. I'm loving the adventure so far. These books are what I go to for now when I want no-nonsense, uncomplex awesomeness. Love it.",4.0,positive,"Harry Potter and the Chamber of Secrets (Harry Potter, #2)",15881
"""It is our choices, Harry, that show what we truly are, far more than our abilities."" - Albus Dumbledore Such a wise wizard. You know how sometimes when you read the first in a series and it turns out so much better than you originally anticipated, it makes you a little apprehensive when starting the sequel? Well, I felt that way before starting this, but I can definitely say that Harry Potter and the Chamber of Secrets is another fabulous installment in the rightfully beloved Harry Potter series! And while I will admit to not loving it quite as much as its predecessor, I still enjoyed it a great deal. I think the reason for my not liking it as much can be mostly credited to the introduction of a new character, Professor Lockhart. Lockhart is an annoyingly pretentious wizard who is completely full of himself, and the majority of his teachings were based on his own life and his supposed brushes with death that he escaped only because of his ""heroism"" and great knowledge of the magic arts. Riiiiiiiiight. In a summary, I didn't find the story involving Lockhart quite as interesting as Harry's realization of his true abilities and the escapades of his first year at Hogwarts. But HP II undoubtedly still has plenty of hilarious moments and magical wonders - not to mention the lovely cast of characters - to more than compensate for this particular installment's slightly lacking plot. Hence the five stars. :) Very clever Ms. Rowling, very clever indeed. FAVORITE QUOTE: ""I've heard you hate those Muggles you live with,"" said Ernie swiftly. ""It's not possible to live with the Dursleys and not hate them,"" said Harry. ""I'd like to see you try it."" Next up is , and I'm very much looking forward to it. ********************************************************** My reviews of other titles in this series:",4.0,positive,"Harry Potter and the Chamber of Secrets (Harry Potter, #2)",15881
